rank,title,author,price,format,rating,review_count,isbn10,isbn13,page_count,category,target_age_range,timestamp,asin,product_url,image_url,category_ranks
1,"Tales from Acorn Wood: Who's in Acorn Wood? World Book Day 2025: A rhyming search-and-find story (Tales From Acorn Wood, 12)",Julia Donaldson,1.0,Paperback,2.9,9.0,1035059223,9781035059225,16,"Science, Nature & How It Works",3-7,2025-02-16T12:46:22.388900,1035059223,https://www.amazon.co.uk/Tales-Acorn-Wood-search-find/dp/1035059223,https://images-eu.ssl-images-amazon.com/images/P/1035059223.01.L.jpg,1 in Hidden Picture Books for Children | 1 in Children's Fiction Books on Animals | 1 in Stories in Verse for Children (Books)
2,Bluey: Bluey's Little Book: A World Book Day 2025 MINI BOOK,Bluey,1.0,Paperback,3.8,7.0,0241734401,9780241734407,16,"Science, Nature & How It Works",3-6,2025-02-16T12:46:22.392098,0241734401,https://www.amazon.co.uk/Bluey-Blueys-Little-Book-World/dp/0241734401,https://images-eu.ssl-images-amazon.com/images/P/0241734401.01.L.jpg,"1 in Fiction About Friendship for Children | 1 in TV, Movie & Video Game Adaptations for Children | 1 in Children's Books on Nature"
3,The Adventures of Paddington: Farm Escape!: World Book Day 2025: The brilliantly funny new Paddington mini picture book for World Book Day 2025!,HarperCollins Children’s Books,1.0,Paperback,2.2,3.0,0008714576,9780008714574,16,"Science, Nature & How It Works",1-5,2025-02-16T12:46:22.400085,0008714576,https://www.amazon.co.uk/Adventures-Paddington-Escape-brilliantly-picture/dp/0008714576,https://images-eu.ssl-images-amazon.com/images/P/0008714576.01.L.jpg,1 in Children's Books on Country & Farm Life | 1 in Humour for Children | 1 in General Humour
4,LEGO Our Amazing Universe: World Book Day 2025: Fantastic Building Ideas and Facts About Our Universe,DK,1.0,Paperback,4.1,4.0,0241740851,9780241740859,80,"Science, Nature & How It Works",6-11,2025-02-16T12:46:22.403004,0241740851,https://www.amazon.co.uk/LEGO-Our-Amazing-Universe-Fantastic/dp/0241740851,https://images-eu.ssl-images-amazon.com/images/P/0241740851.01.L.jpg,1 in Nature Education | 1 in Astronomy & Cosmology References | 1 in Home Improvement Construction
5,Can You Get Jellyfish in Space? A World Book Day 2024 Mini Book,Dr Sheila Kanani,1.0,Paperback,4.6,143.0,0241669839,9780241669839,96,"Science, Nature & How It Works",7-9,2025-02-16T12:46:22.406463,0241669839,https://www.amazon.co.uk/Jellyfish-Space-World-Book-2024/dp/0241669839,https://images-eu.ssl-images-amazon.com/images/P/0241669839.01.L.jpg,1 in Animal Sciences | 1 in Children's Books on Mystery & Wonders | 2 in Children's Books on Aeronautics & Space
6,Superworm,Julia Donaldson,4.0,Paperback,4.8,8437.0,,9781407170725,32,"Science, Nature & How It Works",2-5,2025-02-16T12:46:22.409491,1407170724,https://www.amazon.co.uk/Superworm-Julia-Donaldson/dp/1407170724,https://images-eu.ssl-images-amazon.com/images/P/1407170724.01.L.jpg,1 in Fantasy Adventure for Children | 1 in Children's Books on Performing Arts | 3 in Children's Books on Nature
7,Jonty Gentoo: The Adventures of a Penguin The Number One Bestseller by the creators of Stick Man and Zog,Julia Donaldson,6.49,Hardcover,4.8,437.0,0702329436,9780702329432,40,"Science, Nature & How It Works",3-6,2025-02-16T12:46:22.414639,0702329436,https://www.amazon.co.uk/Jonty-Gentoo-Adventures-Julia-Donaldson/dp/0702329436,https://images-eu.ssl-images-amazon.com/images/P/0702329436.01.L.jpg,1 in Children's Books on Birds | 3 in Fiction About Health for Children | 4 in Children's Books on Nature
8,Zog,Julia Donaldson,4.0,Paperback,4.9,11128.0,,9781407170763,32,"Science, Nature & How It Works",2-5,2025-02-16T12:46:22.418433,1407170767,https://www.amazon.co.uk/Zog-Julia-Donaldson/dp/1407170767,https://images-eu.ssl-images-amazon.com/images/P/1407170767.01.L.jpg,"1 in Children's Books on Royalty | 1 in Dragons, Unicorns & Mythical Creatures Tales for Children | 2 in Children's Books on Mystery & Wonders"
9,"The Baddies: the wickedly funny picture book from the creators of Zog and Stick Man, now available in paperback!",Julia Donaldson,4.0,Paperback,4.7,2152.0,0702325066,9780702325069,32,"Science, Nature & How It Works",3-6,2025-02-16T12:46:22.421332,0702325066,https://www.amazon.co.uk/Baddies-wickedly-creators-available-paperback/dp/0702325066,https://images-eu.ssl-images-amazon.com/images/P/0702325066.01.L.jpg,"1 in Horror & Ghost Stories for Children | 2 in Fairy Tales, Folk Tales & Myths for Children (Books) | 3 in Children's Books on Mystery & Wonders"
10,"There’s a Bunny in Your Book (Who's in Your Book?, 11)",Tom Fletcher,4.0,Paperback,5.0,8.0,0241591244,9780241591246,32,"Science, Nature & How It Works",,2025-02-16T12:46:22.424873,0241591244,https://www.amazon.co.uk/Theres-Bunny-Your-Book-Whos/dp/0241591244,https://images-eu.ssl-images-amazon.com/images/P/0241591244.01.L.jpg,1 in Children's Books on Rabbits | 4 in General Humour | 5 in Children's Books on Nature
11,Zog and the Flying Doctors,Julia Donaldson,4.0,Paperback,4.9,9387.0,1407173502,9781407173504,32,"Science, Nature & How It Works",2-4,2025-02-16T12:46:22.431669,1407173502,https://www.amazon.co.uk/Zog-Flying-Doctors-Julia-Donaldson/dp/1407173502,https://images-eu.ssl-images-amazon.com/images/P/1407173502.01.L.jpg,"2 in Dragons, Unicorns & Mythical Creatures Tales for Children | 2 in Children's Books on Jobs & Careers | 2 in Children's Early Learning Books on Sense & Sensation"
12,Sticker Dolly Dressing Pets,Fiona Watt,4.0,Paperback,4.7,76.0,1805316907,9781805316909,44,"Science, Nature & How It Works",5-8,2025-02-16T12:46:22.437986,1805316907,https://www.amazon.co.uk/Sticker-Dolly-Dressing-Pets-Fiona/dp/1805316907,https://images-eu.ssl-images-amazon.com/images/P/1805316907.01.L.jpg,2 in Children's Books on Pets | 5 in Primary School Textbooks | 6 in Children's Books on Nature
13,You and Your Body: A First Look Inside the Human Body,Punam Krishan,11.95,Board book,5.0,27.0,0241675502,9780241675502,18,"Science, Nature & How It Works",4-6,2025-02-16T12:46:22.442694,0241675502,https://www.amazon.co.uk/You-Your-Body-First-Inside/dp/0241675502,https://images-eu.ssl-images-amazon.com/images/P/0241675502.01.L.jpg,1 in Children's Books on Biology | 1 in Biological Sciences Teaching Aids | 2 in Nature Education
14,"The Gruffalo (The Gruffalo, 1)",Julia Donaldson,6.39,Board book,4.9,17010.0,,9781509830398,24,"Science, Nature & How It Works",2-4,2025-02-16T12:46:22.450128,1509830391,https://www.amazon.co.uk/Gruffalo-Julia-Donaldson/dp/1509830391,https://images-eu.ssl-images-amazon.com/images/P/1509830391.01.L.jpg,"2 in Horror & Ghost Stories for Children | 3 in Dragons, Unicorns & Mythical Creatures Tales for Children | 5 in Children's Books on Mystery & Wonders"
15,The Last Bear: Winner of the Blue Peter Award – ‘A dazzling debut’ THE TIMES,Hannah Gold,4.5,Paperback,4.7,2663.0,000841131X,9780008411312,320,"Science, Nature & How It Works",8+,2025-02-16T12:46:22.453386,000841131X,https://www.amazon.co.uk/Last-Bear-stunning-childrens-battle/dp/000841131X,https://images-eu.ssl-images-amazon.com/images/P/000841131X.01.L.jpg,1 in Children's Books on Bears | 1 in Exploring Polar Regions for Children | 1 in Children's Books on Recycling & Green Living
16,From the Wizarding Archive: Curated Writing from the World of Harry Potter,J.K. Rowling,17.99,Audible Audiobook,4.4,241.0,,,,"Science, Nature & How It Works",,2025-02-16T12:46:22.458299,B0D8WJ56XZ,https://www.amazon.co.uk/Wizarding-Archive-Curated-Writing-Potter/dp/B0D8WJ56XZ,https://images-eu.ssl-images-amazon.com/images/P/B0D8WJ56XZ.01.L.jpg,
17,Paddington’s Suitcase: Eight funny Paddington Bear picture books for children in a gift-set carry case!,Michael Bond,10.0,Paperback,4.8,3275.0,0007251947,9780007251940,192,"Science, Nature & How It Works",2-5,2025-02-16T12:46:22.462083,0007251947,https://www.amazon.co.uk/Paddington-Suitcase-Eight-book-Bear/dp/0007251947,https://images-eu.ssl-images-amazon.com/images/P/0007251947.01.L.jpg,1 in Children's Books on Emigrants & Immigrants | 1 in Short Story Collections for Children | 2 in Children's Books on Bears
18,Charlie Cook's Favourite Book,Julia Donaldson,4.0,Paperback,4.7,4517.0,,9781509812486,32,"Science, Nature & How It Works",2-5,2025-02-16T12:46:22.468984,1509812482,https://www.amazon.co.uk/Charlie-Cooks-Favourite-Julia-Donaldson/dp/1509812482,https://images-eu.ssl-images-amazon.com/images/P/1509812482.01.L.jpg,1 in Mystical Poetry | 1 in Adventure Fiction About Pirates for Children | 1 in Children's Books on Pirates
19,"Bunny vs Monkey: Bunny Bonanza (a Phoenix Comic Book, from the million-selling Jamie Smart, Illustrator of the Year): A Rollicking Rabbit Rumble",Jamie Smart,5.0,Paperback,4.8,475.0,1788453077,9781788453073,240,"Science, Nature & How It Works",7-10,2025-02-16T12:46:22.472163,1788453077,https://www.amazon.co.uk/Bunny-Monkey-million-selling-Illustrator-Rollicking/dp/1788453077,https://images-eu.ssl-images-amazon.com/images/P/1788453077.01.L.jpg,"10 in Children's Animal Comics & Graphic Novels | 14 in Children's Humorous Comics & Graphic Novels | 19 in Children's Books on Science, Nature & How It Works"
20,"The Oak Tree: a dazzling, poetic picture book, by Julia Donaldson, author of The Gruffalo and Stick Man",Julia Donaldson,4.0,Paperback,4.7,449.0,0702324353,9780702324352,32,"Science, Nature & How It Works",3-6,2025-02-16T12:46:22.475852,0702324353,https://www.amazon.co.uk/Oak-Tree-dazzling-Donaldson-Gruffalo/dp/0702324353,https://images-eu.ssl-images-amazon.com/images/P/0702324353.01.L.jpg,1 in Birdwatching (Books) | 1 in Children's Books on Forests & Trees | 1 in Biodiversity
21,"In the Jungle: A Push, Pull, Slide Book (Campbell Axel Scheffler, 6)",Campbell Books,5.34,Board book,4.7,2170.0,1509866957,9781509866953,10,"Science, Nature & How It Works",1-2,2025-02-16T12:46:22.483953,1509866957,https://www.amazon.co.uk/Axel-Scheffler-Jungle/dp/1509866957,https://images-eu.ssl-images-amazon.com/images/P/1509866957.01.L.jpg,2 in Children's Books on Forests & Trees | 3 in Children's Early Learning Books on Numbers & Counting | 19 in Children's Books on Mammals
22,We're Looking for the Perfect Hug: A Lift-the-Flap Adventure and perfect Valentines gift (The Bunny Adventures),Martha Mumford,4.5,Paperback,5.0,2.0,1526671379,9781526671370,24,"Science, Nature & How It Works",,2025-02-16T12:46:22.487965,1526671379,https://www.amazon.co.uk/Were-Looking-Perfect-Lift-Flap/dp/1526671379,https://images-eu.ssl-images-amazon.com/images/P/1526671379.01.L.jpg,3 in Children's Books on Valentine's Day | 3 in Children's Books on Rabbits | 5 in Hidden Picture Books for Children
23,"Bunny vs Monkey (a Phoenix Comic Book, from the million-selling Jamie Smart, Illustrator of the Year)",Jamie Smart,6.0,Paperback,4.8,1139.0,1788451775,9781788451772,256,"Science, Nature & How It Works",8-9,2025-02-16T12:46:22.491204,1788451775,https://www.amazon.co.uk/Bunny-vs-Monkey-Jamie-Smart/dp/1788451775,https://images-eu.ssl-images-amazon.com/images/P/1788451775.01.L.jpg,"23 in Comics & Graphic Novels for Children | 23 in Children's Books on Science, Nature & How It Works | 33 in General Humour"
24,LEGO Race Cars: 5 (Klutz),Editors of Klutz,14.99,Toy,4.4,1342.0,1338802062,9781338802061,64,"Science, Nature & How It Works",5-7,2025-02-16T12:46:22.495765,1338802062,https://www.amazon.co.uk/LEGO-Race-Cars-Klutz-Editors/dp/1338802062,https://images-eu.ssl-images-amazon.com/images/P/1338802062.01.L.jpg,"1 in Children's Books on Cars, Trains & Things That Go | 1 in Children's Books on Architecture | 1 in Children's Books on How Things Work"
25,"Weird but true! 2025: Discover weird, unbelievable facts and world records in this popular annual for the whole family (National Geographic Kids)",National Geographic Kids,10.53,Hardcover,4.7,248.0,0008694125,9780008694128,256,"Science, Nature & How It Works",7-10,2025-02-16T12:46:22.500313,0008694125,https://www.amazon.co.uk/Weird-but-true-2025-Geographic/dp/0008694125,https://images-eu.ssl-images-amazon.com/images/P/0008694125.01.L.jpg,1 in Humour Collections & Anthologies | 2 in Almanacs for Children | 2 in Geography References
26,"There's a Dinosaur in Your Book: An interactive board book for toddlers: 9 (Who's in Your Book?, 9)",Tom Fletcher,4.0,Paperback,4.8,609.0,0241591317,9780241591314,32,"Science, Nature & How It Works",2-4,2025-02-16T12:46:22.503177,0241591317,https://www.amazon.co.uk/Theres-Dinosaur-Your-Book-Whos/dp/0241591317,https://images-eu.ssl-images-amazon.com/images/P/0241591317.01.L.jpg,1 in Children's Books on Dinosaurs | 2 in Children's Books on Social Skills | 2 in Children's Books on Manners
27,Addition and Subtraction Ages 5-7: Prepare for school with easy home learning (Collins Easy Learning KS1),Collins Easy Learning,3.99,Paperback,4.7,5640.0,1398213616,9781398213616,32,"Science, Nature & How It Works",5-6,2025-02-16T12:46:22.506617,0008134286,https://www.amazon.co.uk/Addition-Subtraction-Ages-5-7-Learning/dp/0008134286,https://images-eu.ssl-images-amazon.com/images/P/0008134286.01.L.jpg,3 in Children's Books on Arithmetic | 5 in Children's Early Learning Books on Numbers & Counting | 5 in Home Schooling
28,Room on the Broom,Julia Donaldson,6.39,Paperback,4.9,35243.0,1509804773,9781509804771,32,"Science, Nature & How It Works",2-4,2025-02-16T12:46:22.510694,1509804773,https://www.amazon.co.uk/Room-Broom-Julia-Donaldson/dp/1509804773,https://images-eu.ssl-images-amazon.com/images/P/1509804773.01.L.jpg,1 in Paranormal Fantasy for Children | 1 in Children's Books on Halloween | 2 in Mystical Poetry
29,The World’s Worst Pets,David Walliams,6.99,Audible Audiobook,4.7,3390.0,,,,"Science, Nature & How It Works",,2025-02-16T12:46:22.516881,B09X87FTMH,https://www.amazon.co.uk/Audible-The-Worlds-Worst-Pets/dp/B09X87FTMH,https://images-eu.ssl-images-amazon.com/images/P/B09X87FTMH.01.L.jpg,
30,Julia Donaldson,Julia Donaldson,6.49,Board book,,,103504496X,9781035044962,12,"Science, Nature & How It Works",2-5,2025-02-16T12:46:22.520303,103504496X,https://www.amazon.co.uk/Hares-New-Dress-Julia-Donaldson/dp/103504496X,https://images-eu.ssl-images-amazon.com/images/P/103504496X.01.L.jpg,2 in Children's Books on Fashion Crafts | 4 in Children's Books on Home | 5 in Children's Books on Rabbits
1,Bluey: Bluey's Little Book: A World Book Day 2025 MINI BOOK,Bluey,1.0,Paperback,3.8,7.0,0241734401,9780241734407,16,"TV, Movie & Video Game Adaptations",3-6,2025-02-16T12:46:24.038592,0241734401,https://www.amazon.co.uk/Bluey-Blueys-Little-Book-World/dp/0241734401,https://images-eu.ssl-images-amazon.com/images/P/0241734401.01.L.jpg,"1 in Fiction About Friendship for Children | 1 in TV, Movie & Video Game Adaptations for Children | 1 in Children's Books on Nature"
2,Disney Princess: The Ultimate Colouring Book,Walt Disney,2.0,Paperback,4.7,2942.0,1801081530,9781801081535,72,"TV, Movie & Video Game Adaptations",3-7,2025-02-16T12:46:24.040224,1801081530,https://www.amazon.co.uk/Disney-Princess-Ultimate-Colouring-Book/dp/1801081530,https://images-eu.ssl-images-amazon.com/images/P/1801081530.01.L.jpg,"1 in Children's Interactive Adventures | 2 in TV, Movie & Video Game Adaptations for Children | 3 in Children's Books on Royalty"
3,Marvel Avengers: The Ultimate Colouring Book,Marvel Entertainment International Ltd,2.0,Paperback,4.6,625.0,1801081549,9781801081542,72,"TV, Movie & Video Game Adaptations",4-8,2025-02-16T12:46:24.043060,1801081549,https://www.amazon.co.uk/Marvel-Avengers-Ultimate-Colouring-Book/dp/1801081549,https://images-eu.ssl-images-amazon.com/images/P/1801081549.01.L.jpg,"1 in Superhero Fiction for Children | 2 in Children's Interactive Adventures | 3 in TV, Movie & Video Game Adaptations for Children"
4,Bluey: Where's Bluey?: A Search-and-Find Book,Bluey,6.99,Paperback,4.8,3295.0,0241558573,9780241558577,32,"TV, Movie & Video Game Adaptations",2-5,2025-02-16T12:46:24.047764,0241558573,https://www.amazon.co.uk/Bluey-Wheres-Search-Find-Book/dp/0241558573,https://images-eu.ssl-images-amazon.com/images/P/0241558573.01.L.jpg,"4 in Puzzle Books for Children | 4 in TV, Movie & Video Game Adaptations for Children | 4 in Hidden Picture Books for Children"
5,Nickelodeon Publishing,Nickelodeon Publishing,,Kindle Edition,4.7,967.0,,,14,"TV, Movie & Video Game Adaptations",,2025-02-16T12:46:24.050011,B073R342DW,https://www.amazon.co.uk/Save-School-Bus-PAW-Patrol-ebook/dp/B073R342DW,https://images-eu.ssl-images-amazon.com/images/P/B073R342DW.01.L.jpg,"1 in Children's Dog eBooks | 1 in Children's Popular Culture Literature | 5 in TV, Movie & Video Game Adaptations for Children"
6,Disney: Disneyland Paris Colouring Book (Young Adult Colouring),Walt Disney,4.5,Paperback,4.8,75.0,1837714401,9781837714407,96,"TV, Movie & Video Game Adaptations",9-13,2025-02-16T12:46:24.052580,1837714401,https://www.amazon.co.uk/Disney-Disneyland-Paris-Colouring-Book/dp/1837714401,https://images-eu.ssl-images-amazon.com/images/P/1837714401.01.L.jpg,1 in Vocational | 1 in Children's Books on Travel | 4 in Children's Books on Jobs & Careers
7,Disneyland Parks Colouring Book,Igloo Books,4.0,Paperback,4.7,4084.0,1838523650,9781838523657,96,"TV, Movie & Video Game Adaptations",5+,2025-02-16T12:46:24.054533,1838523650,https://www.amazon.co.uk/Disneyland-Parks-Colouring-Igloo-Books/dp/1838523650,https://images-eu.ssl-images-amazon.com/images/P/1838523650.01.L.jpg,"7 in TV, Movie & Video Game Adaptations for Children | 13 in Colouring Books for Children"
8,Bluey: Bluey and Friends: A Sticker Activity Book,Bluey,3.99,Paperback,4.6,1183.0,0241550513,9780241550519,16,"TV, Movie & Video Game Adaptations",2-5,2025-02-16T12:46:24.057117,0241550513,https://www.amazon.co.uk/Bluey-Friends-Sticker-Activity/dp/0241550513,https://images-eu.ssl-images-amazon.com/images/P/0241550513.01.L.jpg,"8 in TV, Movie & Video Game Adaptations for Children | 14 in Children's Books on Dogs | 31 in Children's Books on Mammals"
9,Ms Rachel: Ms Rachel and the Special Surprise: Encouraging Speech and Learning Through Play and Music,Ms Rachel,4.5,Paperback,4.8,49.0,0241760607,9780241760604,40,"TV, Movie & Video Game Adaptations",,2025-02-16T12:46:24.059074,0241760607,https://www.amazon.co.uk/Ms-Rachel-Surprise-Encouraging-Learning/dp/0241760607,https://images-eu.ssl-images-amazon.com/images/P/0241760607.01.L.jpg,2 in Nursery Rhymes for Children (Books) | 3 in Beginner Readers for Children | 5 in Children's Early Learning Books on the Alphabet
10,Minecraft Catch the Creeper and Other Mobs: Search for your favourite mobs in this official Minecraft Search and Find book! Perfect for kids into video games.,Mojang AB,7.35,Paperback,4.7,2689.0,0755503570,9780755503575,40,"TV, Movie & Video Game Adaptations",5-9,2025-02-16T12:46:24.062003,0755503570,https://www.amazon.co.uk/Minecraft-Catch-Creeper-Other-Mobs/dp/0755503570,https://images-eu.ssl-images-amazon.com/images/P/0755503570.01.L.jpg,2 in Children's Books on the History of Exploration & Discovery | 3 in Children's Books on Video & Electronic Games | 3 in Children's Books on Computer Entertainment & Games
11,Peppa Pig: Peppa's Party Bus!: Noisy Sound Book,Peppa Pig,7.0,Board book,4.3,14.0,0241666007,9780241666005,10,"TV, Movie & Video Game Adaptations",,2025-02-16T12:46:24.065515,0241666007,https://www.amazon.co.uk/Peppa-Pig-Peppas-Party-Noisy/dp/0241666007,https://images-eu.ssl-images-amazon.com/images/P/0241666007.01.L.jpg,"1 in Children's Fiction Books on Cars, Trains & Things That Go | 3 in Children's Books on Pigs | 5 in Children's Early Learning Books on Sounds"
12,Marvel Spider-Man: Sticker Scenes (With over 50 stickers!),Marvel Entertainment International Ltd,3.49,Paperback,4.1,52.0,1837950148,9781837950140,12,"TV, Movie & Video Game Adaptations",4-6,2025-02-16T12:46:24.068777,1837950148,https://www.amazon.co.uk/Marvel-Spider-Man-Sticker-Scenes-stickers/dp/1837950148,https://images-eu.ssl-images-amazon.com/images/P/1837950148.01.L.jpg,3 in Superhero Fiction for Children | 5 in Children's Interactive Adventures | 9 in Puzzle Books for Children
13,Bluey: Bluey and Friends Little Library,Bluey,5.51,Board book,4.6,597.0,0241605040,9780241605042,48,"TV, Movie & Video Game Adaptations",1-3,2025-02-16T12:46:24.070560,0241605040,https://www.amazon.co.uk/Bluey-Friends-Little-Library/dp/0241605040,https://images-eu.ssl-images-amazon.com/images/P/0241605040.01.L.jpg,"13 in TV, Movie & Video Game Adaptations for Children | 15 in Children's Books on Dogs | 25 in Children's Books on Nature"
14,Pokémon Where’s Pikachu? A search & find book: New for 2023: Search and find the perfect gift for fans of Pokémon in this official Pikachu adventure!,Pokemon,6.99,Paperback,4.7,466.0,0008547599,9780008547592,40,"TV, Movie & Video Game Adaptations",4-8,2025-02-16T12:46:24.072327,0008547599,https://www.amazon.co.uk/Pok%C3%A9mon-Wheres-Pikachu-search-find/dp/0008547599,https://images-eu.ssl-images-amazon.com/images/P/0008547599.01.L.jpg,1 in Comics with Media Tie-Ins for Children | 3 in Children's Books on the History of Exploration & Discovery | 4 in Children's Books on Video & Electronic Games
15,Disney Stitch: The Ultimate Colouring Book,Walt Disney,4.99,Paperback,4.5,379.0,1837950326,9781837950324,72,"TV, Movie & Video Game Adaptations",6-9,2025-02-16T12:46:24.074130,1837950326,https://www.amazon.co.uk/Disney-Stitch-Ultimate-Colouring-Book/dp/1837950326,https://images-eu.ssl-images-amazon.com/images/P/1837950326.01.L.jpg,"8 in Science Fiction for Children | 15 in TV, Movie & Video Game Adaptations for Children | 16 in Colouring Books for Children"
16,Disney: Bedtime Stories (Treasury of Classic Tales),Walt Disney,10.0,Hardcover,4.7,32.0,1837959080,9781837959082,384,"TV, Movie & Video Game Adaptations",6-10,2025-02-16T12:46:24.076677,1837959080,https://www.amazon.co.uk/Disney-Bedtime-Stories-Treasury-Classic/dp/1837959080,https://images-eu.ssl-images-amazon.com/images/P/1837959080.01.L.jpg,"1 in Anthologies & Collections of Fairy Tales, Folk Tales & Myths for Children | 6 in Children's Bedtime & Dream Books | 9 in Short Story Collections for Children"
17,Disney Princess: Simply Colouring (Over 30 pages to colour in),Igloo Books,3.99,Paperback,4.5,379.0,1800220294,9781800220294,32,"TV, Movie & Video Game Adaptations",4-6,2025-02-16T12:46:24.080877,1800220294,https://www.amazon.co.uk/Disney-Princess-Colouring-Igloo-Books/dp/1800220294,https://images-eu.ssl-images-amazon.com/images/P/1800220294.01.L.jpg,"17 in TV, Movie & Video Game Adaptations for Children | 21 in Colouring Books for Children"
18,"Disney The Lion King: 5 in 1 Colouring (With dot-to-dot, colour-by-numbers, copy colouring, and more!)",Walt Disney,1.99,Paperback,4.7,47.0,1837950083,9781837950089,48,"TV, Movie & Video Game Adaptations",4-6,2025-02-16T12:46:24.082800,1837950083,https://www.amazon.co.uk/Disney-Lion-King-colour-numbers/dp/1837950083,https://images-eu.ssl-images-amazon.com/images/P/1837950083.01.L.jpg,"2 in Children's Books on Cats | 8 in Children's Interactive Adventures | 18 in TV, Movie & Video Game Adaptations for Children"
19,Bluey: Let's Stick!: Sticker Scenes Book,Bluey,6.43,Paperback,4.7,653.0,0241551951,9780241551950,24,"TV, Movie & Video Game Adaptations",3-4,2025-02-16T12:46:24.090124,0241551951,https://www.amazon.co.uk/Bluey-Lets-Stick-Sticker-Scenes/dp/0241551951,https://images-eu.ssl-images-amazon.com/images/P/0241551951.01.L.jpg,"19 in TV, Movie & Video Game Adaptations for Children | 63 in Children's Books on Family Life | 64 in Fiction About Family for Children"
20,Shrek 2: The Movie Storybook,zuuka,2.55,Kindle Edition,3.9,66.0,,,56,"TV, Movie & Video Game Adaptations",,2025-02-16T12:46:24.093992,B009093GXU,https://www.amazon.co.uk/Shrek-2-Movie-Storybook-zuuka-ebook/dp/B009093GXU,https://images-eu.ssl-images-amazon.com/images/P/B009093GXU.01.L.jpg,2 in Children's Popular Culture Literature | 3 in Children's Humorous Literature | 12 in Children's Fantasy eBooks
21,Peppa Pig: Little Library,Peppa Pig,4.0,Board book,4.7,25454.0,,9781409303183,60,"TV, Movie & Video Game Adaptations",1-3,2025-02-16T12:46:24.100403,1409303187,https://www.amazon.co.uk/Peppa-Pig-Little-Library-Ladybird/dp/1409303187,https://images-eu.ssl-images-amazon.com/images/P/1409303187.01.L.jpg,"6 in Children's Books on Pigs | 21 in TV, Movie & Video Game Adaptations for Children | 93 in Early Learning for Children"
22,Marvel Spider-Man: Giant Colour-Me Pad,Marvel Entertainment International Ltd,5.0,Paperback,4.8,229.0,1801082448,9781801082440,64,"TV, Movie & Video Game Adaptations",4-6,2025-02-16T12:46:24.102371,1801082448,https://www.amazon.co.uk/Marvel-Spider-Man-Giant-Colour-Pad/dp/1801082448,https://images-eu.ssl-images-amazon.com/images/P/1801082448.01.L.jpg,"5 in Superhero Fiction for Children | 22 in TV, Movie & Video Game Adaptations for Children | 30 in Colouring Books for Children"
23,The Ultimate Sonic Prime Coloring Book (Sonic the Hedgehog),Patrick Spaziante,5.49,Paperback,4.6,356.0,0593750489,9780593750483,64,"TV, Movie & Video Game Adaptations",4-6,2025-02-16T12:46:24.104147,0593750489,https://www.amazon.co.uk/Ultimate-Sonic-Prime-Coloring-Hedgehog/dp/0593750489,https://images-eu.ssl-images-amazon.com/images/P/0593750489.01.L.jpg,"6 in Superhero Fiction for Children | 23 in TV, Movie & Video Game Adaptations for Children | 116 in Action & Adventure for Children (Books)"
24,Numberblocks: Countdown to Bed (A Numberblocks Storybook Perfect for Bedtimes Ages 3-6),Numberblocks,6.99,Paperback,4.8,95.0,1802632522,9781802632521,32,"TV, Movie & Video Game Adaptations",3-6,2025-02-16T12:46:24.106113,1802632522,https://www.amazon.co.uk/Numberblocks-Countdown-Bed/dp/1802632522,https://images-eu.ssl-images-amazon.com/images/P/1802632522.01.L.jpg,"7 in Children's Bedtime & Dream Books | 15 in Children's Early Learning Books on Numbers & Counting | 24 in TV, Movie & Video Game Adaptations for Children"
