rank,title,author,price,format,rating,review_count,isbn10,isbn13,page_count,category,target_age_range,timestamp,asin,product_url,image_url,category_ranks
1,"Tales from Acorn Wood: Who's in Acorn Wood? World Book Day 2025: A rhyming search-and-find story (Tales From Acorn Wood, 12)",Julia Donaldson,1.0,Paperback,3.2,12.0,1035059223,9781035059225,16,"Science, Nature & How It Works",3-7,2025-02-17T09:38:43.038744,1035059223,https://www.amazon.co.uk/Tales-Acorn-Wood-search-find/dp/1035059223,https://images-eu.ssl-images-amazon.com/images/P/1035059223.01.L.jpg,1 in Hidden Picture Books for Children | 1 in Children's Fiction Books on Animals | 1 in Stories in Verse for Children (Books)
2,Bluey: Bluey's Little Book: A World Book Day 2025 MINI BOOK,Bluey,1.0,Paperback,3.7,11.0,0241734401,9780241734407,16,"Science, Nature & How It Works",3-6,2025-02-17T09:38:43.040355,0241734401,https://www.amazon.co.uk/Bluey-Blueys-Little-Book-World/dp/0241734401,https://images-eu.ssl-images-amazon.com/images/P/0241734401.01.L.jpg,"1 in TV, Movie & Video Game Adaptations for Children | 1 in Fiction About Family for Children | 1 in Children's Books on Family Life"
3,The Adventures of Paddington: Farm Escape!: World Book Day 2025: The brilliantly funny new Paddington mini picture book for World Book Day 2025!,HarperCollins Children’s Books,1.0,Paperback,3.5,6.0,0008714576,9780008714574,16,"Science, Nature & How It Works",1-5,2025-02-17T09:38:43.041946,0008714576,https://www.amazon.co.uk/Adventures-Paddington-Escape-brilliantly-picture/dp/0008714576,https://images-eu.ssl-images-amazon.com/images/P/0008714576.01.L.jpg,1 in Children's Books on Country & Farm Life | 1 in Humour for Children | 1 in General Humour
4,LEGO Our Amazing Universe: World Book Day 2025: Fantastic Building Ideas and Facts About Our Universe,DK,1.0,Paperback,4.1,4.0,0241740851,9780241740859,80,"Science, Nature & How It Works",6-11,2025-02-17T09:38:43.043832,0241740851,https://www.amazon.co.uk/LEGO-Our-Amazing-Universe-Fantastic/dp/0241740851,https://images-eu.ssl-images-amazon.com/images/P/0241740851.01.L.jpg,1 in Astronomy (Books) | 1 in Nature References | 1 in Nature Education
5,Can You Get Jellyfish in Space? A World Book Day 2024 Mini Book,Dr Sheila Kanani,1.0,Paperback,4.6,143.0,0241669839,9780241669839,96,"Science, Nature & How It Works",7-9,2025-02-17T09:38:43.045948,0241669839,https://www.amazon.co.uk/Jellyfish-Space-World-Book-2024/dp/0241669839,https://images-eu.ssl-images-amazon.com/images/P/0241669839.01.L.jpg,1 in Animal Sciences | 1 in Children's Books on Mystery & Wonders | 2 in Children's Books on Astronomy
6,Zog,Julia Donaldson,4.0,Paperback,4.9,11128.0,,9781407170763,32,"Science, Nature & How It Works",2-5,2025-02-17T09:38:43.047593,1407170767,https://www.amazon.co.uk/Zog-Julia-Donaldson/dp/1407170767,https://images-eu.ssl-images-amazon.com/images/P/1407170767.01.L.jpg,"1 in Children's Books on Royalty | 1 in Dragons, Unicorns & Mythical Creatures Tales for Children | 2 in Travel Fiction for Children"
7,"The Baddies: the wickedly funny picture book from the creators of Zog and Stick Man, now available in paperback!",Julia Donaldson,4.0,Paperback,4.7,2153.0,0702325066,9780702325069,32,"Science, Nature & How It Works",3-6,2025-02-17T09:38:43.049399,0702325066,https://www.amazon.co.uk/Baddies-wickedly-creators-available-paperback/dp/0702325066,https://images-eu.ssl-images-amazon.com/images/P/0702325066.01.L.jpg,"1 in Horror & Ghost Stories for Children | 2 in Fairy Tales, Folk Tales & Myths for Children (Books) | 3 in Children's Books on Mystery & Wonders"
8,Jonty Gentoo: The Adventures of a Penguin The Number One Bestseller by the creators of Stick Man and Zog,Julia Donaldson,6.49,Hardcover,4.8,439.0,0702329436,9780702329432,40,"Science, Nature & How It Works",3-6,2025-02-17T09:38:43.051314,0702329436,https://www.amazon.co.uk/Jonty-Gentoo-Adventures-Julia-Donaldson/dp/0702329436,https://images-eu.ssl-images-amazon.com/images/P/0702329436.01.L.jpg,1 in Children's Books on Birds | 3 in Fiction About Health for Children | 3 in Children's Books on Nature
9,Superworm,Julia Donaldson,4.0,Paperback,4.8,8438.0,,9781407170725,32,"Science, Nature & How It Works",2-5,2025-02-17T09:38:43.053033,1407170724,https://www.amazon.co.uk/Superworm-Julia-Donaldson/dp/1407170724,https://images-eu.ssl-images-amazon.com/images/P/1407170724.01.L.jpg,1 in Fantasy Adventure for Children | 1 in Children's Books on Performing Arts | 4 in Children's Books on Nature
10,"There’s a Bunny in Your Book (Who's in Your Book?, 11)",Tom Fletcher,4.0,Paperback,5.0,9.0,0241591244,9780241591246,32,"Science, Nature & How It Works",,2025-02-17T09:38:43.054971,0241591244,https://www.amazon.co.uk/Theres-Bunny-Your-Book-Whos/dp/0241591244,https://images-eu.ssl-images-amazon.com/images/P/0241591244.01.L.jpg,1 in Children's Books on Rabbits | 5 in Children's Books on Nature | 7 in General Humour
11,Zog and the Flying Doctors,Julia Donaldson,4.0,Paperback,4.9,9387.0,1407173502,9781407173504,32,"Science, Nature & How It Works",2-4,2025-02-17T09:38:43.056585,1407173502,https://www.amazon.co.uk/Zog-Flying-Doctors-Julia-Donaldson/dp/1407173502,https://images-eu.ssl-images-amazon.com/images/P/1407173502.01.L.jpg,"2 in Dragons, Unicorns & Mythical Creatures Tales for Children | 2 in Children's Books on Jobs & Careers | 2 in Children's Early Learning Books on Sense & Sensation"
12,Sticker Dolly Dressing Pets,Fiona Watt,4.0,Paperback,4.7,76.0,1805316907,9781805316909,44,"Science, Nature & How It Works",5-8,2025-02-17T09:38:43.058864,1805316907,https://www.amazon.co.uk/Sticker-Dolly-Dressing-Pets-Fiona/dp/1805316907,https://images-eu.ssl-images-amazon.com/images/P/1805316907.01.L.jpg,2 in Children's Books on Pets | 4 in Primary School Textbooks | 6 in Children's Books on Nature
13,"The Gruffalo (The Gruffalo, 1)",Julia Donaldson,6.39,Board book,4.9,17010.0,,9781509830398,24,"Science, Nature & How It Works",2-4,2025-02-17T09:38:43.060605,1509830391,https://www.amazon.co.uk/Gruffalo-Julia-Donaldson/dp/1509830391,https://images-eu.ssl-images-amazon.com/images/P/1509830391.01.L.jpg,"2 in Horror & Ghost Stories for Children | 3 in Dragons, Unicorns & Mythical Creatures Tales for Children | 4 in Poetry, Drama & Criticism"
14,Charlie Cook's Favourite Book,Julia Donaldson,4.0,Paperback,4.7,4517.0,,9781509812486,32,"Science, Nature & How It Works",2-5,2025-02-17T09:38:43.062211,1509812482,https://www.amazon.co.uk/Charlie-Cooks-Favourite-Julia-Donaldson/dp/1509812482,https://images-eu.ssl-images-amazon.com/images/P/1509812482.01.L.jpg,1 in Mystical Poetry | 1 in Adventure Fiction About Pirates for Children | 1 in Literary Criticism & Collections for Children
15,"In the Jungle: A Push, Pull, Slide Book (Campbell Axel Scheffler, 6)",Campbell Books,5.34,Board book,4.7,2173.0,1509866957,9781509866953,10,"Science, Nature & How It Works",1-2,2025-02-17T09:38:43.065033,1509866957,https://www.amazon.co.uk/Axel-Scheffler-Jungle/dp/1509866957,https://images-eu.ssl-images-amazon.com/images/P/1509866957.01.L.jpg,1 in Children's Books on Forests & Trees | 2 in Children's Early Learning Books on Numbers & Counting | 15 in Children's Books on Mammals
16,From the Wizarding Archive: Curated Writing from the World of Harry Potter,,17.99,Audible Audiobook,4.4,241.0,,,,"Science, Nature & How It Works",,2025-02-17T09:38:43.067349,B0D8WJ56XZ,https://www.amazon.co.uk/Wizarding-Archive-Curated-Writing-Potter/dp/B0D8WJ56XZ,https://images-eu.ssl-images-amazon.com/images/P/B0D8WJ56XZ.01.L.jpg,
17,The Last Bear: Winner of the Blue Peter Award – ‘A dazzling debut’ THE TIMES,Hannah Gold,4.5,Paperback,4.7,2663.0,000841131X,9780008411312,320,"Science, Nature & How It Works",8+,2025-02-17T09:38:43.069161,000841131X,https://www.amazon.co.uk/Last-Bear-stunning-childrens-battle/dp/000841131X,https://images-eu.ssl-images-amazon.com/images/P/000841131X.01.L.jpg,1 in Exploring Polar Regions for Children | 1 in Children's Books on Recycling & Green Living | 2 in Children's Books on Bears
18,Paddington’s Suitcase: Eight funny Paddington Bear picture books for children in a gift-set carry case!,Michael Bond,10.0,Paperback,4.8,3275.0,0007251947,9780007251940,192,"Science, Nature & How It Works",2-5,2025-02-17T09:38:43.070773,0007251947,https://www.amazon.co.uk/Paddington-Suitcase-Eight-book-Bear/dp/0007251947,https://images-eu.ssl-images-amazon.com/images/P/0007251947.01.L.jpg,
19,"The Oak Tree: a dazzling, poetic picture book, by Julia Donaldson, author of The Gruffalo and Stick Man",Julia Donaldson,4.0,Paperback,4.7,449.0,0702324353,9780702324352,32,"Science, Nature & How It Works",3-6,2025-02-17T09:38:43.072524,0702324353,https://www.amazon.co.uk/Oak-Tree-dazzling-Donaldson-Gruffalo/dp/0702324353,https://images-eu.ssl-images-amazon.com/images/P/0702324353.01.L.jpg,
20,"Weird but true! 2025: Discover weird, unbelievable facts and world records in this popular annual for the whole family (National Geographic Kids)",National Geographic Kids,10.53,Hardcover,4.7,248.0,0008694125,9780008694128,256,"Science, Nature & How It Works",7-10,2025-02-17T09:38:43.074149,0008694125,https://www.amazon.co.uk/Weird-but-true-2025-Geographic/dp/0008694125,https://images-eu.ssl-images-amazon.com/images/P/0008694125.01.L.jpg,
21,That's not my dog...,Fiona Watt,4.0,Board book,4.8,222.0,1805312235,9781805312239,10,"Science, Nature & How It Works",,2025-02-17T09:38:43.075751,1805312235,https://www.amazon.co.uk/Thats-not-dog-Fiona-Watt/dp/1805312235,https://images-eu.ssl-images-amazon.com/images/P/1805312235.01.L.jpg,3 in Children's Books on Pets | 6 in Animal Sciences | 10 in Children's Books on Dogs
22,"Bunny vs Monkey: Bunny Bonanza (a Phoenix Comic Book, from the million-selling Jamie Smart, Illustrator of the Year): A Rollicking Rabbit Rumble",Jamie Smart,5.0,Paperback,4.8,475.0,1788453077,9781788453073,240,"Science, Nature & How It Works",7-10,2025-02-17T09:38:43.077349,1788453077,https://www.amazon.co.uk/Bunny-Monkey-million-selling-Illustrator-Rollicking/dp/1788453077,https://images-eu.ssl-images-amazon.com/images/P/1788453077.01.L.jpg,
23,You and Your Body: A First Look Inside the Human Body,Punam Krishan,11.95,Board book,5.0,28.0,0241675502,9780241675502,18,"Science, Nature & How It Works",4-6,2025-02-17T09:38:43.084911,0241675502,https://www.amazon.co.uk/You-Your-Body-First-Inside/dp/0241675502,https://images-eu.ssl-images-amazon.com/images/P/0241675502.01.L.jpg,
24,"There's a Dinosaur in Your Book: An interactive board book for toddlers: 9 (Who's in Your Book?, 9)",Tom Fletcher,4.0,Paperback,4.8,610.0,0241591317,9780241591314,32,"Science, Nature & How It Works",2-4,2025-02-17T09:38:43.087168,0241591317,https://www.amazon.co.uk/Theres-Dinosaur-Your-Book-Whos/dp/0241591317,https://images-eu.ssl-images-amazon.com/images/P/0241591317.01.L.jpg,
25,LEGO Race Cars: 5 (Klutz),,14.99,Toy,4.4,1343.0,1338802062,9781338802061,64,"Science, Nature & How It Works",5-7,2025-02-17T09:38:43.092043,1338802062,https://www.amazon.co.uk/LEGO-Race-Cars-Klutz-Editors/dp/1338802062,https://images-eu.ssl-images-amazon.com/images/P/1338802062.01.L.jpg,
26,"Bunny vs Monkey (a Phoenix Comic Book, from the million-selling Jamie Smart, Illustrator of the Year)",Jamie Smart,6.0,Paperback,4.8,1139.0,1788451775,9781788451772,256,"Science, Nature & How It Works",8-9,2025-02-17T09:38:43.093661,1788451775,https://www.amazon.co.uk/Bunny-vs-Monkey-Jamie-Smart/dp/1788451775,https://images-eu.ssl-images-amazon.com/images/P/1788451775.01.L.jpg,
27,We're Looking for the Perfect Hug: A Lift-the-Flap Adventure and perfect Valentines gift (The Bunny Adventures),Martha Mumford,4.5,Paperback,5.0,2.0,1526671379,9781526671370,24,"Science, Nature & How It Works",,2025-02-17T09:38:43.095489,1526671379,https://www.amazon.co.uk/Were-Looking-Perfect-Lift-Flap/dp/1526671379,https://images-eu.ssl-images-amazon.com/images/P/1526671379.01.L.jpg,
28,The World’s Worst Pets,,6.99,Audible Audiobook,4.7,3391.0,,,,"Science, Nature & How It Works",,2025-02-17T09:38:43.098255,B09X87FTMH,https://www.amazon.co.uk/Audible-The-Worlds-Worst-Pets/dp/B09X87FTMH,https://images-eu.ssl-images-amazon.com/images/P/B09X87FTMH.01.L.jpg,
29,The Dinosaur that Pooped Easter!: An egg-cellent lift-the-flap adventure,Dougie Poynter,5.0,Paperback,4.9,770.0,0241488818,9780241488812,26,"Science, Nature & How It Works",3-6,2025-02-17T09:38:43.099883,0241488818,https://www.amazon.co.uk/Dinosaur-that-Pooped-Easter/dp/0241488818,https://images-eu.ssl-images-amazon.com/images/P/0241488818.01.L.jpg,
30,The Mysteries of the Universe: Discover the best-kept secrets of space (DK Children's Anthologies),Will Gater,11.99,Hardcover,4.8,6002.0,0241412471,9780241412473,224,"Science, Nature & How It Works",6-9,2025-02-17T09:38:43.101480,0241412471,https://www.amazon.co.uk/Mysteries-Universe-Discover-best-kept-secrets/dp/0241412471,https://images-eu.ssl-images-amazon.com/images/P/0241412471.01.L.jpg,
1,Bluey: Bluey's Little Book: A World Book Day 2025 MINI BOOK,Bluey,1.0,Paperback,3.7,11.0,0241734401,9780241734407,16,"TV, Movie & Video Game Adaptations",3-6,2025-02-17T09:38:44.232153,0241734401,https://www.amazon.co.uk/Bluey-Blueys-Little-Book-World/dp/0241734401,https://images-eu.ssl-images-amazon.com/images/P/0241734401.01.L.jpg,
2,Marvel Avengers: The Ultimate Colouring Book,,2.0,Paperback,4.6,625.0,1801081549,9781801081542,72,"TV, Movie & Video Game Adaptations",4-8,2025-02-17T09:38:44.234447,1801081549,https://www.amazon.co.uk/Marvel-Avengers-Ultimate-Colouring-Book/dp/1801081549,https://images-eu.ssl-images-amazon.com/images/P/1801081549.01.L.jpg,
3,Bluey: Where's Bluey?: A Search-and-Find Book,Bluey,6.99,Paperback,4.8,3295.0,0241558573,9780241558577,32,"TV, Movie & Video Game Adaptations",2-5,2025-02-17T09:38:44.236053,0241558573,https://www.amazon.co.uk/Bluey-Wheres-Search-Find-Book/dp/0241558573,https://images-eu.ssl-images-amazon.com/images/P/0241558573.01.L.jpg,
4,Disney Princess: The Ultimate Colouring Book,Walt Disney,2.0,Paperback,4.7,2942.0,1801081530,9781801081535,72,"TV, Movie & Video Game Adaptations",3-7,2025-02-17T09:38:44.237958,1801081530,https://www.amazon.co.uk/Disney-Princess-Ultimate-Colouring-Book/dp/1801081530,https://images-eu.ssl-images-amazon.com/images/P/1801081530.01.L.jpg,
5,Nickelodeon Publishing,,,Kindle Edition,4.7,967.0,,,14,"TV, Movie & Video Game Adaptations",,2025-02-17T09:38:44.239974,B073R342DW,https://www.amazon.co.uk/Save-School-Bus-PAW-Patrol-ebook/dp/B073R342DW,https://images-eu.ssl-images-amazon.com/images/P/B073R342DW.01.L.jpg,
6,Minecraft Catch the Creeper and Other Mobs: Search for your favourite mobs in this official Minecraft Search and Find book! Perfect for kids into video games.,Mojang AB,7.35,Paperback,4.7,2690.0,0755503570,9780755503575,40,"TV, Movie & Video Game Adaptations",5-9,2025-02-17T09:38:44.241591,0755503570,https://www.amazon.co.uk/Minecraft-Catch-Creeper-Other-Mobs/dp/0755503570,https://images-eu.ssl-images-amazon.com/images/P/0755503570.01.L.jpg,
7,Bluey: Bluey and Friends Little Library,Bluey,5.51,Board book,4.6,598.0,0241605040,9780241605042,48,"TV, Movie & Video Game Adaptations",1-3,2025-02-17T09:38:44.243270,0241605040,https://www.amazon.co.uk/Bluey-Friends-Little-Library/dp/0241605040,https://images-eu.ssl-images-amazon.com/images/P/0241605040.01.L.jpg,
8,Disney Stitch: The Ultimate Colouring Book,Walt Disney,4.99,Paperback,4.5,379.0,1837950326,9781837950324,72,"TV, Movie & Video Game Adaptations",6-9,2025-02-17T09:38:44.245131,1837950326,https://www.amazon.co.uk/Disney-Stitch-Ultimate-Colouring-Book/dp/1837950326,https://images-eu.ssl-images-amazon.com/images/P/1837950326.01.L.jpg,
9,Peppa Pig: Peppa's Party Bus!: Noisy Sound Book,Peppa Pig,7.0,Board book,4.3,14.0,0241666007,9780241666005,10,"TV, Movie & Video Game Adaptations",,2025-02-17T09:38:44.247035,0241666007,https://www.amazon.co.uk/Peppa-Pig-Peppas-Party-Noisy/dp/0241666007,https://images-eu.ssl-images-amazon.com/images/P/0241666007.01.L.jpg,
10,Disney Princess: Simply Colouring (Over 30 pages to colour in),Igloo Books,3.99,Paperback,4.5,379.0,1800220294,9781800220294,32,"TV, Movie & Video Game Adaptations",4-6,2025-02-17T09:38:44.248639,1800220294,https://www.amazon.co.uk/Disney-Princess-Colouring-Igloo-Books/dp/1800220294,https://images-eu.ssl-images-amazon.com/images/P/1800220294.01.L.jpg,
11,Bluey: Bluey and Friends: A Sticker Activity Book,,3.99,Paperback,4.6,1184.0,0241550513,9780241550519,16,"TV, Movie & Video Game Adaptations",2-5,2025-02-17T09:38:44.251081,0241550513,https://www.amazon.co.uk/Bluey-Friends-Sticker-Activity/dp/0241550513,https://images-eu.ssl-images-amazon.com/images/P/0241550513.01.L.jpg,
12,Ms Rachel: Ms Rachel and the Special Surprise: Encouraging Speech and Learning Through Play and Music,Ms Rachel,4.5,Paperback,4.8,51.0,0241760607,9780241760604,40,"TV, Movie & Video Game Adaptations",,2025-02-17T09:38:44.252793,0241760607,https://www.amazon.co.uk/Ms-Rachel-Surprise-Encouraging-Learning/dp/0241760607,https://images-eu.ssl-images-amazon.com/images/P/0241760607.01.L.jpg,
13,Disney: Bedtime Stories (Treasury of Classic Tales),Walt Disney,10.0,Hardcover,4.7,32.0,1837959080,9781837959082,384,"TV, Movie & Video Game Adaptations",6-10,2025-02-17T09:38:44.254549,1837959080,https://www.amazon.co.uk/Disney-Bedtime-Stories-Treasury-Classic/dp/1837959080,https://images-eu.ssl-images-amazon.com/images/P/1837959080.01.L.jpg,
14,"Disney The Lion King: 5 in 1 Colouring (With dot-to-dot, colour-by-numbers, copy colouring, and more!)",Walt Disney,1.99,Paperback,4.7,47.0,1837950083,9781837950089,48,"TV, Movie & Video Game Adaptations",4-6,2025-02-17T09:38:44.256246,1837950083,https://www.amazon.co.uk/Disney-Lion-King-colour-numbers/dp/1837950083,https://images-eu.ssl-images-amazon.com/images/P/1837950083.01.L.jpg,
15,Disney: Disneyland Paris Colouring Book (Young Adult Colouring),Walt Disney,4.5,Paperback,4.8,75.0,1837714401,9781837714407,96,"TV, Movie & Video Game Adaptations",9-13,2025-02-17T09:38:44.257956,1837714401,https://www.amazon.co.uk/Disney-Disneyland-Paris-Colouring-Book/dp/1837714401,https://images-eu.ssl-images-amazon.com/images/P/1837714401.01.L.jpg,
16,Bluey: Let's Stick!: Sticker Scenes Book,,6.43,Paperback,4.7,653.0,0241551951,9780241551950,24,"TV, Movie & Video Game Adaptations",3-4,2025-02-17T09:38:44.260251,0241551951,https://www.amazon.co.uk/Bluey-Lets-Stick-Sticker-Scenes/dp/0241551951,https://images-eu.ssl-images-amazon.com/images/P/0241551951.01.L.jpg,
17,Peppa Pig: Little Library,,4.0,Board book,4.7,25454.0,,9781409303183,60,"TV, Movie & Video Game Adaptations",1-3,2025-02-17T09:38:44.262992,1409303187,https://www.amazon.co.uk/Peppa-Pig-Little-Library-Ladybird/dp/1409303187,https://images-eu.ssl-images-amazon.com/images/P/1409303187.01.L.jpg,
18,Pokémon Where’s Pikachu? A search & find book: New for 2023: Search and find the perfect gift for fans of Pokémon in this official Pikachu adventure!,Pokemon,6.99,Paperback,4.7,467.0,0008547599,9780008547592,40,"TV, Movie & Video Game Adaptations",4-8,2025-02-17T09:38:44.265111,0008547599,https://www.amazon.co.uk/Pok%C3%A9mon-Wheres-Pikachu-search-find/dp/0008547599,https://images-eu.ssl-images-amazon.com/images/P/0008547599.01.L.jpg,
19,Disneyland Parks Colouring Book,Igloo Books,4.0,Paperback,4.7,4084.0,1838523650,9781838523657,96,"TV, Movie & Video Game Adaptations",5+,2025-02-17T09:38:44.266739,1838523650,https://www.amazon.co.uk/Disneyland-Parks-Colouring-Igloo-Books/dp/1838523650,https://images-eu.ssl-images-amazon.com/images/P/1838523650.01.L.jpg,
20,Shrek 2: The Movie Storybook,,2.55,Kindle Edition,3.9,66.0,,,56,"TV, Movie & Video Game Adaptations",,2025-02-17T09:38:44.269151,B009093GXU,https://www.amazon.co.uk/Shrek-2-Movie-Storybook-zuuka-ebook/dp/B009093GXU,https://images-eu.ssl-images-amazon.com/images/P/B009093GXU.01.L.jpg,
21,Numberblocks: Countdown to Bed (A Numberblocks Storybook Perfect for Bedtimes Ages 3-6),Numberblocks,6.99,Paperback,4.8,95.0,1802632522,9781802632521,32,"TV, Movie & Video Game Adaptations",3-6,2025-02-17T09:38:44.270783,1802632522,https://www.amazon.co.uk/Numberblocks-Countdown-Bed/dp/1802632522,https://images-eu.ssl-images-amazon.com/images/P/1802632522.01.L.jpg,
22,Marvel Spider-Man: Sticker Scenes (With over 50 stickers!),,3.49,Paperback,4.1,52.0,1837950148,9781837950140,12,"TV, Movie & Video Game Adaptations",4-6,2025-02-17T09:38:44.273051,1837950148,https://www.amazon.co.uk/Marvel-Spider-Man-Sticker-Scenes-stickers/dp/1837950148,https://images-eu.ssl-images-amazon.com/images/P/1837950148.01.L.jpg,
23,The Ultimate Sonic Prime Coloring Book (Sonic the Hedgehog),Patrick Spaziante,5.49,Paperback,4.6,358.0,0593750489,9780593750483,64,"TV, Movie & Video Game Adaptations",4-6,2025-02-17T09:38:44.279279,0593750489,https://www.amazon.co.uk/Ultimate-Sonic-Prime-Coloring-Hedgehog/dp/0593750489,https://images-eu.ssl-images-amazon.com/images/P/0593750489.01.L.jpg,
24,"Paw Patrol: Meet the Pups Sticker Activity: With over 50 BIG stickers! A fun illustrated sticker book for children aged 3, 4, 5 based on the Nickelodeon TV Series",,5.51,Paperback,4.7,539.0,075550268X,9780755502684,32,"TV, Movie & Video Game Adaptations",3-4,2025-02-17T09:38:44.281916,075550268X,https://www.amazon.co.uk/Paw-Patrol-Sticker-Activity-stickers/dp/075550268X,https://images-eu.ssl-images-amazon.com/images/P/075550268X.01.L.jpg,
25,Peppa Pig: George's Potty: A potty training sound book,Peppa Pig,8.27,Board book,4.4,330.0,0241476488,9780241476482,10,"TV, Movie & Video Game Adaptations",2-3,2025-02-17T09:38:44.283528,0241476488,https://www.amazon.co.uk/Peppa-Pig-Georges-Potty/dp/0241476488,https://images-eu.ssl-images-amazon.com/images/P/0241476488.01.L.jpg,
26,The Adventures of Paddington – The Wrong List,,2.99,Kindle Edition,4.9,231.0,,,32,"TV, Movie & Video Game Adaptations",,2025-02-17T09:38:44.285984,B082DRYBGN,https://www.amazon.co.uk/Adventures-Paddington-Wrong-List-TV-ebook/dp/B082DRYBGN,https://images-eu.ssl-images-amazon.com/images/P/B082DRYBGN.01.L.jpg,
27,Peppa Pig: Peppa and the New Baby,Peppa Pig,5.51,Board book,4.8,77.0,0241575710,9780241575710,16,"TV, Movie & Video Game Adaptations",2-6,2025-02-17T09:38:44.289245,0241575710,https://www.amazon.co.uk/Peppa-Pig-New-Baby/dp/0241575710,https://images-eu.ssl-images-amazon.com/images/P/0241575710.01.L.jpg,
28,Peppa Pig: At the Zoo: A Lift-the-Flap Book,Peppa Pig,4.0,Board book,4.8,2868.0,0241335914,9780241335918,10,"TV, Movie & Video Game Adaptations",1-3,2025-02-17T09:38:44.290916,0241335914,https://www.amazon.co.uk/Peppa-Pig-Lift-Flap-Book/dp/0241335914,https://images-eu.ssl-images-amazon.com/images/P/0241335914.01.L.jpg,
29,Pokémon Where’s Eevee? An Evolutions Search and Find Book: An action-packed search and find for fans aged 6 and up in this official Pokémon adventure!,Pokémon,4.5,Paperback,4.6,110.0,0008616744,9780008616748,40,"TV, Movie & Video Game Adaptations",5+,2025-02-17T09:38:44.292520,0008616744,https://www.amazon.co.uk/Pok%C3%A9mon-Wheres-Eevee-Evolutions-Search/dp/0008616744,https://images-eu.ssl-images-amazon.com/images/P/0008616744.01.L.jpg,
30,Hey Duggee: Duggee’s Noisy Farm Sound Book,Hey Duggee,7.0,Board book,5.0,1.0,1405959894,9781405959896,10,"TV, Movie & Video Game Adaptations",2-6,2025-02-17T09:38:44.294480,1405959894,https://www.amazon.co.uk/Hey-Duggee-Duggees-Noisy-Sound/dp/1405959894,https://images-eu.ssl-images-amazon.com/images/P/1405959894.01.L.jpg,
1,Bluey: Bluey's Little Book: A World Book Day 2025 MINI BOOK,Bluey,1.0,Paperback,3.7,11.0,0241734401,9780241734407,16,Educational Books,3-6,2025-02-17T09:38:45.287623,0241734401,https://www.amazon.co.uk/Bluey-Blueys-Little-Book-World/dp/0241734401,https://images-eu.ssl-images-amazon.com/images/P/0241734401.01.L.jpg,
2,The Adventures of Paddington: Farm Escape!: World Book Day 2025: The brilliantly funny new Paddington mini picture book for World Book Day 2025!,HarperCollins Children’s Books,1.0,Paperback,3.5,6.0,0008714576,9780008714574,16,Educational Books,1-5,2025-02-17T09:38:45.289220,0008714576,https://www.amazon.co.uk/Adventures-Paddington-Escape-brilliantly-picture/dp/0008714576,https://images-eu.ssl-images-amazon.com/images/P/0008714576.01.L.jpg,
3,LEGO Our Amazing Universe: World Book Day 2025: Fantastic Building Ideas and Facts About Our Universe,DK,1.0,Paperback,4.1,4.0,0241740851,9780241740859,80,Educational Books,6-11,2025-02-17T09:38:45.290813,0241740851,https://www.amazon.co.uk/LEGO-Our-Amazing-Universe-Fantastic/dp/0241740851,https://images-eu.ssl-images-amazon.com/images/P/0241740851.01.L.jpg,
4,The Very Hungry Caterpillar [Board Book]: Eric Carle,Eric Carle,4.0,Board book,4.8,92830.0,0241003008,9780241003008,24,Educational Books,1-3,2025-02-17T09:38:45.298697,0241003008,https://www.amazon.co.uk/Very-Hungry-Caterpillar-Board-Book/dp/0241003008,https://images-eu.ssl-images-amazon.com/images/P/0241003008.01.L.jpg,
5,Pokémon: The Epic Pocket Guide. World Book Day 2025: Become an expert Pokémon Trainer with this new handy pocket-sized guidebook for World Book Day 2025,Pokémon,1.0,Paperback,4.6,3.0,0008719810,9780008719814,64,Educational Books,5-8,2025-02-17T09:38:45.300360,0008719810,https://www.amazon.co.uk/Pok%C3%A9mon-Pocket-Trainer-pocket-sized-guidebook/dp/0008719810,https://images-eu.ssl-images-amazon.com/images/P/0008719810.01.L.jpg,
6,Can You Get Jellyfish in Space? A World Book Day 2024 Mini Book,Dr Sheila Kanani,1.0,Paperback,4.6,143.0,0241669839,9780241669839,96,Educational Books,7-9,2025-02-17T09:38:45.301973,0241669839,https://www.amazon.co.uk/Jellyfish-Space-World-Book-2024/dp/0241669839,https://images-eu.ssl-images-amazon.com/images/P/0241669839.01.L.jpg,
