rank,title,author,price,format,rating,review_count,isbn10,isbn13,page_count,category,target_age_range,timestamp,asin,product_url,image_url,category_ranks
27,Messi (Ultimate Football Heroes - the No. 1 football series): Collect them all!,Matt & Tom Oldfield,5.22,Paperback,4.7,1537.0,1786064030,9781786064035,192,Sport and Outdoors,7-10,2025-01-22T20:12:59.385823,1786064030,https://www.amazon.co.uk/Messi-Ultimate-Football-Heroes-Collect/dp/1786064030,https://images-eu.ssl-images-amazon.com/images/P/1786064030.01.L.jpg,6 in Sports & Recreation Biographies for Children | 9 in Football Biographies (Books) | 20 in Children's Books on Football
28,"The Breakfast Club Adventures: The Headless Ghost (The Breakfast Club Adventures, 5)",Marcus Rashford,4.0,Paperback,4.7,26.0,1035053942,9781035053940,256,Sport and Outdoors,9-11,2025-01-22T20:12:59.389177,1035053942,https://www.amazon.co.uk/Breakfast-Club-Adventures-Headless-Ghost/dp/1035053942,https://images-eu.ssl-images-amazon.com/images/P/1035053942.01.L.jpg,1 in Children's Fiction on Sexuality | 9 in Children's Nonfiction on Sexuality & Pregnancy | 21 in Children's Books on Football
29,Football's Greatest Moments (Ultimate Football Heroes - The No.1 football series): Collect Them All!: Volume 79,Tom Palmer,6.04,Paperback,4.5,167.0,1789467152,9781789467154,176,Sport and Outdoors,7-11,2025-01-22T20:12:59.404361,1789467152,https://www.amazon.co.uk/Footballs-Greatest-Moments-Ultimate-Football/dp/1789467152,https://images-eu.ssl-images-amazon.com/images/P/1789467152.01.L.jpg,3 in Football Fans | 20 in Children's Books on Football | 47 in Children's Books on History
30,"Gymnastics Activity Book For Girls: Fun Gymnast Workbook, Includes Mazes, Word Searches, Coloring And MORE | Ideal For Ages 4, 5, 6, 7, 8",Activity Bandits,4.99,Paperback,4.3,33.0,,9798324693534,71,Sport and Outdoors,4-10,2025-01-22T20:12:59.416251,B0D39FN337,https://www.amazon.co.uk/Gymnastics-Activity-Book-Girls-Workbook/dp/B0D39FN337,https://images-eu.ssl-images-amazon.com/images/P/B0D39FN337.01.L.jpg,1 in Gymnastics (Books) | 2 in Children's Books on Gymnastics | 10 in Books of Mazes for Children
1,The Let Them Theory: A Life-Changing Tool That Millions of People Can’t Stop Talking About,Mel Robbins,22.74,Audible Audiobook,4.6,1987.0,,,,Teen and Young Adult,,2025-01-22T20:13:00.727984,B0DFMXWWX1,https://www.amazon.co.uk/Let-Them-Theory-Life-Changing-Millions/dp/B0DFMXWWX1,https://images-eu.ssl-images-amazon.com/images/P/B0DFMXWWX1.01.L.jpg,
2,What's Your Dream?: Find Your Passion. Love Your Work. Build a Richer Life.,Simon Squibb,11.37,Audible Audiobook,4.8,56.0,,,,Teen and Young Adult,,2025-01-22T20:13:00.732971,B0CZ9T1XCC,https://www.amazon.co.uk/Whats-Your-Dream-Passion-Richer/dp/B0CZ9T1XCC,https://images-eu.ssl-images-amazon.com/images/P/B0CZ9T1XCC.01.L.jpg,
3,Atomic Habits: The life-changing million-copy #1 bestseller,James Clear,6.99,Paperback,4.6,170615.0,1847941834,9781847941831,320,Teen and Young Adult,,2025-01-22T20:13:00.736285,1847941834,https://www.amazon.co.uk/Atomic-Habits-Proven-Build-Break/dp/1847941834,https://images-eu.ssl-images-amazon.com/images/P/1847941834.01.L.jpg,3 in Teen & Young Adult (Books) | 3 in Practical & Motivational Self Help
4,Girl Moments: Coloring Book for Adults and Teens Featuring Cute Cozy Daily Activities for Relaxation,Coco Wyo,7.68,Paperback,4.6,1197.0,,9798344507460,88,Teen and Young Adult,,2025-01-22T20:13:00.739469,B0DL5SF36B,https://www.amazon.co.uk/Girl-Moments-Featuring-Activities-Relaxation/dp/B0DL5SF36B,https://images-eu.ssl-images-amazon.com/images/P/B0DL5SF36B.01.L.jpg,1 in Cartooning Books for Young Adults | 1 in Fashion Books for Young Adults | 1 in Colouring Books for Grown-Ups
5,The Hotel Avocado,Bob Mortimer,11.37,Audible Audiobook,4.5,2001.0,,,,Teen and Young Adult,,2025-01-22T20:13:00.743743,B0CZ4GWCSC,https://www.amazon.co.uk/Audible-The-Hotel-Avocado/dp/B0CZ4GWCSC,https://images-eu.ssl-images-amazon.com/images/P/B0CZ4GWCSC.01.L.jpg,
6,"Harry Potter and the Chamber of Secrets, Book 2",J.K. Rowling,17.99,Audible Audiobook,4.8,99022.0,,,,Teen and Young Adult,,2025-01-22T20:13:00.748817,B017V690CO,https://www.amazon.co.uk/Harry-Potter-Chamber-Secrets-Book/dp/B017V690CO,https://images-eu.ssl-images-amazon.com/images/P/B017V690CO.01.L.jpg,
7,The Anxious Generation: How the Great Rewiring of Childhood Is Causing an Epidemic of Mental Illness,Jonathan Haidt,5.49,Paperback,4.6,5246.0,1802063277,9781802063271,400,Teen and Young Adult,,2025-01-22T20:13:00.752570,1802063277,https://www.amazon.co.uk/Anxious-Generation-Rewiring-Childhood-Epidemic/dp/1802063277,https://images-eu.ssl-images-amazon.com/images/P/1802063277.01.L.jpg,1 in Child & Developmental Psychology in Education | 1 in Child Development | 1 in Adolescent Counselling
8,Unruly: A History of England's Kings and Queens,David Mitchell,11.37,Audible Audiobook,4.3,4615.0,,,,Teen and Young Adult,,2025-01-22T20:13:00.757187,B0C4PNCT3J,https://www.amazon.co.uk/Unruly-History-Englands-Kings-Queens/dp/B0C4PNCT3J,https://images-eu.ssl-images-amazon.com/images/P/B0C4PNCT3J.01.L.jpg,
9,"Harry Potter and the Prisoner of Azkaban, Book 3",J.K. Rowling,17.99,Audible Audiobook,4.8,95983.0,,,,Teen and Young Adult,,2025-01-22T20:13:00.762455,B017WGP97I,https://www.amazon.co.uk/Harry-Potter-Prisoner-Azkaban-Book/dp/B017WGP97I,https://images-eu.ssl-images-amazon.com/images/P/B017WGP97I.01.L.jpg,
10,"Harry Potter and the Goblet of Fire, Book 4",J.K. Rowling,32.99,Audible Audiobook,4.8,86723.0,,,,Teen and Young Adult,,2025-01-22T20:13:00.768417,B017WJM1E4,https://www.amazon.co.uk/Harry-Potter-Goblet-Fire-Book/dp/B017WJM1E4,https://images-eu.ssl-images-amazon.com/images/P/B017WJM1E4.01.L.jpg,
11,The Mother,T.M. Logan,27.99,Audible Audiobook,4.3,6967.0,,,,Teen and Young Adult,,2025-01-22T20:13:00.774403,B0BG8YN5NV,https://www.amazon.co.uk/Audible-The-Mother/dp/B0BG8YN5NV,https://images-eu.ssl-images-amazon.com/images/P/B0BG8YN5NV.01.L.jpg,
12,"Red Rising: Celebrating its 10th anniversary, an explosive dystopian sci-fi novel (#1 New York Times bestselling Red Rising series book 1)",Pierce Brown,0.99,Kindle Edition,4.5,65855.0,,,401,Teen and Young Adult,,2025-01-22T20:13:00.780842,B00GIUG3ES,https://www.amazon.co.uk/Red-Rising-1-ebook/dp/B00GIUG3ES,https://images-eu.ssl-images-amazon.com/images/P/B00GIUG3ES.01.L.jpg,1 in Science Fiction Romance (Books) | 1 in Mysteries & Thrillers for Young Adults | 1 in Fantasy Adventure Fiction
13,In the Blink of an Eye,Jo Callaghan,11.37,Audible Audiobook,4.4,4359.0,,,,Teen and Young Adult,,2025-01-22T20:13:00.786720,B0BGJGP9MZ,https://www.amazon.co.uk/Audible-Blink-Eye/dp/B0BGJGP9MZ,https://images-eu.ssl-images-amazon.com/images/P/B0BGJGP9MZ.01.L.jpg,
14,The Housemaid,Freida McFadden,13.12,Audible Audiobook,4.5,435030.0,,,,Teen and Young Adult,,2025-01-22T20:13:00.791541,B09XRFTRFB,https://www.amazon.co.uk/Audible-The-Housemaid/dp/B09XRFTRFB,https://images-eu.ssl-images-amazon.com/images/P/B09XRFTRFB.01.L.jpg,
15,"Empire of the Vampire: Empire of the Vampire, Book 1",Jay Kristoff,17.49,Audible Audiobook,4.7,9039.0,,,,Teen and Young Adult,,2025-01-22T20:13:00.797324,B098KP7LLM,https://www.amazon.co.uk/Empire-Vampire-Book/dp/B098KP7LLM,https://images-eu.ssl-images-amazon.com/images/P/B098KP7LLM.01.L.jpg,
16,"Harry Potter and the Order of the Phoenix, Book 5",J.K. Rowling,32.99,Audible Audiobook,4.8,85704.0,,,,Teen and Young Adult,,2025-01-22T20:13:00.802334,B017WO25UO,https://www.amazon.co.uk/Harry-Potter-Order-Phoenix-Book/dp/B017WO25UO,https://images-eu.ssl-images-amazon.com/images/P/B017WO25UO.01.L.jpg,
17,The Curfew,T.M. Logan,27.99,Audible Audiobook,4.3,8801.0,,,,Teen and Young Adult,,2025-01-22T20:13:00.807484,B09GBPWH3R,https://www.amazon.co.uk/Audible-The-Curfew/dp/B09GBPWH3R,https://images-eu.ssl-images-amazon.com/images/P/B09GBPWH3R.01.L.jpg,
18,Butter,Asako Yuzuki,14.87,Audible Audiobook,3.9,4312.0,,,,Teen and Young Adult,,2025-01-22T20:13:00.812227,B0CHYSDCK5,https://www.amazon.co.uk/Audible-Butter/dp/B0CHYSDCK5,https://images-eu.ssl-images-amazon.com/images/P/B0CHYSDCK5.01.L.jpg,
19,"Harry Potter and the Half-Blood Prince, Book 6",J.K. Rowling,32.99,Audible Audiobook,4.8,81027.0,,,,Teen and Young Adult,,2025-01-22T20:13:00.817643,B017WOPU9W,https://www.amazon.co.uk/Harry-Potter-Half-Blood-Prince-Book/dp/B017WOPU9W,https://images-eu.ssl-images-amazon.com/images/P/B017WOPU9W.01.L.jpg,
20,1989,Val McDermid,12.24,Audible Audiobook,4.2,5008.0,,,,Teen and Young Adult,,2025-01-22T20:13:00.823718,B09SVMTCNF,https://www.amazon.co.uk/Audible-1989/dp/B09SVMTCNF,https://images-eu.ssl-images-amazon.com/images/P/B09SVMTCNF.01.L.jpg,
21,Comfy Days: Coloring Book for Adults and Teens Featuring Super Cute Animal Characters in Cozy Hygge Moments for Relaxation,Coco Wyo,7.42,Paperback,4.7,1027.0,,9798332619991,90,Teen and Young Adult,,2025-01-22T20:13:00.830320,B0D94546DX,https://www.amazon.co.uk/Comfy-Days-Featuring-Characters-Relaxation/dp/B0D94546DX,https://images-eu.ssl-images-amazon.com/images/P/B0D94546DX.01.L.jpg,1 in Drawing Books for Young Adults | 2 in Cartooning Books for Young Adults
22,A History of the World in 100 Objects: The Landmark BBC Radio 4 Series,Neil MacGregor,14.87,Audible Audiobook,4.6,1850.0,,,,Teen and Young Adult,,2025-01-22T20:13:00.837955,B08NFF2KPJ,https://www.amazon.co.uk/History-World-100-Objects-Landmark/dp/B08NFF2KPJ,https://images-eu.ssl-images-amazon.com/images/P/B08NFF2KPJ.01.L.jpg,
23,He is Watching You,Charlie Gallagher,12.24,Audible Audiobook,4.4,7962.0,,,,Teen and Young Adult,,2025-01-22T20:13:00.844334,B07NRXZDRY,https://www.amazon.co.uk/He-Watching-You-Detective-Maddie/dp/B07NRXZDRY,https://images-eu.ssl-images-amazon.com/images/P/B07NRXZDRY.01.L.jpg,
24,Now It All Makes Sense: How An ADHD Diagnosis Brought Clarity to My Life,Alex Partridge,11.37,Audible Audiobook,4.7,38.0,,,,Teen and Young Adult,,2025-01-22T20:13:00.848482,B0DDYZ8JQ8,https://www.amazon.co.uk/Now-All-Makes-Sense-Diagnosis/dp/B0DDYZ8JQ8,https://images-eu.ssl-images-amazon.com/images/P/B0DDYZ8JQ8.01.L.jpg,
25,"Wind and Truth: Stormlight Archive, Book 5",Brandon Sanderson,14.87,Audible Audiobook,4.8,11999.0,,,,Teen and Young Adult,,2025-01-22T20:13:00.853583,B0CQDF5PP6,https://www.amazon.co.uk/Wind-Truth-Stormlight-Archive-Book/dp/B0CQDF5PP6,https://images-eu.ssl-images-amazon.com/images/P/B0CQDF5PP6.01.L.jpg,
26,"The Courage to Be Disliked : How to Free Yourself, Change Your Life and Achieve Real Happiness",Fumitake Koga,20.12,Audible Audiobook,4.4,18650.0,,,,Teen and Young Adult,,2025-01-22T20:13:00.858725,B0785W1QC9,https://www.amazon.co.uk/Courage-Be-Disliked-Yourself-Happiness/dp/B0785W1QC9,https://images-eu.ssl-images-amazon.com/images/P/B0785W1QC9.01.L.jpg,
27,The Subtle Art of Not Giving a F*ck: A Counterintuitive Approach to Living a Good Life,Mark Manson,11.37,Audible Audiobook,4.5,148846.0,,,,Teen and Young Adult,,2025-01-22T20:13:00.863615,B01M9JOAFI,https://www.amazon.co.uk/Subtle-Art-Not-Giving-Counterintuitive/dp/B01M9JOAFI,https://images-eu.ssl-images-amazon.com/images/P/B01M9JOAFI.01.L.jpg,
28,Stone: The Complete Series 5-7: BBC Radio 4 Full-Cast Crime Dramas,Danny Brocklehurst,11.37,Audible Audiobook,4.4,3.0,,,,Teen and Young Adult,,2025-01-22T20:13:00.868915,B07L6D8T5B,https://www.amazon.co.uk/Stone-Complete-Radio-Full-Cast-Dramas/dp/B07L6D8T5B,https://images-eu.ssl-images-amazon.com/images/P/B07L6D8T5B.01.L.jpg,
29,Nexus: A Brief History of Information Networks from the Stone Age to AI,Yuval Noah Harari,14.87,Audible Audiobook,4.5,3475.0,,,,Teen and Young Adult,,2025-01-22T20:13:00.873484,B0CSYYMZKP,https://www.amazon.co.uk/Nexus-Brief-History-Information-Networks/dp/B0CSYYMZKP,https://images-eu.ssl-images-amazon.com/images/P/B0CSYYMZKP.01.L.jpg,
30,The Perfect Girlfriend,Hayley Smith,31.49,Audible Audiobook,4.3,1665.0,,,,Teen and Young Adult,,2025-01-22T20:13:00.877812,B0C94XLCKL,https://www.amazon.co.uk/Audible-The-Perfect-Girlfriend/dp/B0C94XLCKL,https://images-eu.ssl-images-amazon.com/images/P/B0C94XLCKL.01.L.jpg,
1,The Very Hungry Caterpillar [Board Book]: Eric Carle,Eric Carle,4.0,Board book,4.8,92709.0,0241003008,9780241003008,24,Comics and Graphic Novels,1-3,2025-01-22T20:13:02.059026,0241003008,https://www.amazon.co.uk/Very-Hungry-Caterpillar-Board-Book/dp/0241003008,https://images-eu.ssl-images-amazon.com/images/P/0241003008.01.L.jpg,1 in Children's Science & Nature Comics & Graphic Novels | 1 in Children's Books on Maths | 9 in Literature & Fiction for Children (Books)
2,"Dog Man 13: Big Jim Begins (the latest laugh-out-loud, full-colour book in the Number One, millions-of-copies-selling series!)",Dav Pilkey,6.49,Hardcover,4.7,2274.0,1338896458,9781338896459,224,Comics and Graphic Novels,7-10,2025-01-22T20:13:02.062490,1338896458,https://www.amazon.co.uk/Dog-Man-laugh-out-loud-millions-copies-selling/dp/1338896458,https://images-eu.ssl-images-amazon.com/images/P/1338896458.01.L.jpg,1 in Children's Mystery & Detective Comics & Graphic Novels | 1 in Children's Humorous Comics & Graphic Novels | 1 in Children's Animal Comics & Graphic Novels
3,"Diary of a Wimpy Kid: Hot Mess (Book 19): THE BRAND-NEW NUMBER ONE BESTSELLER (Diary of a Wimpy Kid, 19)",Jeff Kinney,7.49,Hardcover,4.7,1171.0,0241583160,9780241583166,224,Comics and Graphic Novels,9-12,2025-01-22T20:13:02.065566,0241583160,https://www.amazon.co.uk/Diary-Wimpy-Kid-Mess-Book/dp/0241583160,https://images-eu.ssl-images-amazon.com/images/P/0241583160.01.L.jpg,1 in Children's School Life Comics & Graphic Novels | 2 in General Humour | 2 in Children's Humorous Comics & Graphic Novels
4,Dog Man: From the Creator of Captain Underpants (Dog Man #1),Dav Pilkey,8.3,Paperback,4.8,25713.0,1407140396,9781407140391,240,Comics and Graphic Novels,7-9,2025-01-22T20:13:02.069040,1407140396,https://www.amazon.co.uk/Dog-Man-Dav-Pilkey/dp/1407140396,https://images-eu.ssl-images-amazon.com/images/P/1407140396.01.L.jpg,2 in Children's Books on Dogs | 2 in Children's Action & Adventure Comics & Graphic Novels | 2 in Children's Comics & Graphic Novels on Social & Philosophical Topics
5,Where's Stitch?: A Disney search-and-find activity book,Walt Disney,4.0,Paperback,4.7,251.0,1835870260,9781835870266,40,Comics and Graphic Novels,6-9,2025-01-22T20:13:02.072028,1835870260,https://www.amazon.co.uk/Wheres-Stitch-search-find-activity/dp/1835870260,https://images-eu.ssl-images-amazon.com/images/P/1835870260.01.L.jpg,2 in Puzzle Books for Children | 2 in Hidden Picture Books for Children | 4 in Children's Humorous Comics & Graphic Novels
6,"Dog Man 12: The Scarlet Shedder (the latest laugh-out-loud, full-colour book in the million-copy selling series!)",Dav Pilkey,7.0,Hardcover,4.7,6825.0,1338896431,9781338896435,224,Comics and Graphic Novels,7-10,2025-01-22T20:13:02.075422,1338896431,https://www.amazon.co.uk/Dog-Man-laugh-out-loud-full-colour-million-copy/dp/1338896431,https://images-eu.ssl-images-amazon.com/images/P/1338896431.01.L.jpg,3 in Children's Mystery & Detective Comics & Graphic Novels | 3 in Superhero Comics for Children | 3 in Children's Animal Comics & Graphic Novels
7,Dog Man 10: Mothering Heights (the latest book in the million-copy selling Dog Man series!),Dav Pilkey,4.0,Paperback,4.8,26013.0,0702313491,9780702313493,240,Comics and Graphic Novels,7-9,2025-01-22T20:13:02.078387,0702313491,https://www.amazon.co.uk/Dog-Man-10-Mothering-million-copy/dp/0702313491,https://images-eu.ssl-images-amazon.com/images/P/0702313491.01.L.jpg,4 in Children's Action & Adventure Comics & Graphic Novels | 4 in Super-Hero Graphic Novels | 4 in Superhero Comics for Children
8,"Bunny vs Monkey: Bunny Bonanza (a Phoenix Comic Book, from the million-selling Jamie Smart, Illustrator of the Year): A Rollicking Rabbit Rumble",Jamie Smart,4.99,Paperback,4.8,454.0,1788453077,9781788453073,240,Comics and Graphic Novels,7-10,2025-01-22T20:13:02.081741,1788453077,https://www.amazon.co.uk/Bunny-Monkey-million-selling-Illustrator-Rollicking/dp/1788453077,https://images-eu.ssl-images-amazon.com/images/P/1788453077.01.L.jpg,"5 in Children's Animal Comics & Graphic Novels | 7 in Children's Humorous Comics & Graphic Novels | 8 in Children's Books on Science, Nature & How It Works"
9,Dog Man Unleashed: From the Creator of Captain Underpants (Dog Man #2),Dav Pilkey,8.26,Paperback,4.8,24775.0,1407186604,9781407186603,224,Comics and Graphic Novels,7-9,2025-01-22T20:13:02.085378,1407186604,https://www.amazon.co.uk/Adventures-Dog-Man-Unleashed/dp/1407186604,https://images-eu.ssl-images-amazon.com/images/P/1407186604.01.L.jpg,1 in Children's Books on Pets | 5 in Children's Mystery & Detective Comics & Graphic Novels | 5 in Superhero Comics for Children
10,"Bunny vs Monkey: The Impossible Pig (a Phoenix Comic Book, from the million-selling Jamie Smart, Illustrator of the Year)",Jamie Smart,5.0,Paperback,4.8,579.0,1788453123,9781788453127,240,Comics and Graphic Novels,7-10,2025-01-22T20:13:02.088431,1788453123,https://www.amazon.co.uk/Bunny-vs-Monkey-Impossible-Pig/dp/1788453123,https://images-eu.ssl-images-amazon.com/images/P/1788453123.01.L.jpg,6 in Children's Action & Adventure Comics & Graphic Novels | 7 in Children's Animal Comics & Graphic Novels | 61 in Literature & Fiction for Children (Books)
11,"Diary of a Wimpy Kid: No Brainer (Book 18) (Diary of a Wimpy Kid, 18)",Jeff Kinney,5.0,Paperback,4.7,6432.0,0241583152,9780241583159,240,Comics and Graphic Novels,8-12,2025-01-22T20:13:02.091328,0241583152,https://www.amazon.co.uk/Diary-Wimpy-Kid-Brainer-Book/dp/0241583152,https://images-eu.ssl-images-amazon.com/images/P/0241583152.01.L.jpg,5 in Children's Books on School | 9 in Children's Humorous Comics & Graphic Novels | 15 in General Humour
12,"Bunny vs Monkey 7 Books Collection Set By Jamie Smart (Bunny vs Monkey, Supersonic Aye-aye, The Human Invasion, Rise of the Maniacal Badger, the League of Doom!, Multiverse Mix-up & Machine Mayhem)",Jamie Smart,34.0,Paperback,4.9,116.0,9124331236,9789124331238,1760,Comics and Graphic Novels,7-10,2025-01-22T20:13:02.094371,9124331236,https://www.amazon.co.uk/Collection-Supersonic-Invasion-Maniacal-Multiverse/dp/9124331236,https://images-eu.ssl-images-amazon.com/images/P/9124331236.01.L.jpg,1 in Children's Fantasy Comics & Graphic Novels
13,"Diary of a Wimpy Kid: Wrecking Ball (Book 14) (Diary of a Wimpy Kid, 14)",Jeff Kinney,4.0,Paperback,4.8,23945.0,0241396921,9780241396926,240,Comics and Graphic Novels,8-10,2025-01-22T20:13:02.097359,0241396921,https://www.amazon.co.uk/Diary-Wimpy-Kid-Wrecking-Ball/dp/0241396921,https://images-eu.ssl-images-amazon.com/images/P/0241396921.01.L.jpg,9 in Children's Books on School | 10 in Children's Humorous Comics & Graphic Novels | 21 in General Humour
14,"Diary of a Wimpy Kid: Big Shot (Book 16) (Diary of a Wimpy Kid, 16)",Jeff Kinney,4.0,Paperback,4.7,11449.0,0241396980,9780241396988,240,Comics and Graphic Novels,8-11,2025-01-22T20:13:02.102488,0241396980,https://www.amazon.co.uk/Diary-Wimpy-Kid-Shot-Book/dp/0241396980,https://images-eu.ssl-images-amazon.com/images/P/0241396980.01.L.jpg,2 in Children's School Life Comics & Graphic Novels | 10 in Children's Books on School | 11 in Children's Humorous Comics & Graphic Novels
15,"Diary of a Wimpy Kid: The Deep End (Book 15) (Diary of a Wimpy Kid, 15)",Jeff Kinney,4.0,Paperback,4.8,49855.0,0241396956,9780241396957,240,Comics and Graphic Novels,9-11,2025-01-22T20:13:02.105984,0241396956,https://www.amazon.co.uk/Diary-Wimpy-Kid-Deep-Book/dp/0241396956,https://images-eu.ssl-images-amazon.com/images/P/0241396956.01.L.jpg,12 in Children's Humorous Comics & Graphic Novels | 23 in General Humour | 27 in Children's Books on Family Life
16,Marvel Spidey and His Amazing Friends Glow in the Dark Sticker Book: With More Than 100 Stickers,DK,4.99,Paperback,4.4,54.0,0241659299,9780241659298,16,Comics and Graphic Novels,5-7,2025-01-22T20:13:02.109016,0241659299,https://www.amazon.co.uk/Marvel-Spidey-Amazing-Friends-Sticker/dp/0241659299,https://images-eu.ssl-images-amazon.com/images/P/0241659299.01.L.jpg,1 in Nonfiction Comic Books for Children | 1 in Children's Books on Television & Radio | 1 in Children's Books on Film
17,"Bunny vs Monkey (a Phoenix Comic Book, from the million-selling Jamie Smart, Illustrator of the Year)",Jamie Smart,6.0,Paperback,4.8,1099.0,1788451775,9781788451772,256,Comics and Graphic Novels,8-9,2025-01-22T20:13:02.114019,1788451775,https://www.amazon.co.uk/Bunny-vs-Monkey-Jamie-Smart/dp/1788451775,https://images-eu.ssl-images-amazon.com/images/P/1788451775.01.L.jpg,"17 in Comics & Graphic Novels for Children | 24 in General Humour | 25 in Children's Books on Science, Nature & How It Works"
18,"Diary of a Wimpy Kid: The Meltdown (Book 13) (Diary of a Wimpy Kid, 13)",Jeff Kinney,4.0,Paperback,4.7,28772.0,0241389313,9780241389317,240,Comics and Graphic Novels,8-11,2025-01-22T20:13:02.117094,0241389313,https://www.amazon.co.uk/Diary-Wimpy-Kid-Meltdown-Book/dp/0241389313,https://images-eu.ssl-images-amazon.com/images/P/0241389313.01.L.jpg,11 in Children's Books on School | 13 in Children's Humorous Comics & Graphic Novels | 24 in Fiction About Friendship for Children
19,"Diary of a Wimpy Kid: Diper Överlöde (Book 17) (Diary of a Wimpy Kid, 17)",Jeff Kinney,4.5,Paperback,4.7,7720.0,0241583101,9780241583104,240,Comics and Graphic Novels,9-12,2025-01-22T20:13:02.121206,0241583101,https://www.amazon.co.uk/Diary-Wimpy-Kid-Diper-%C3%96verl%C3%B6de/dp/0241583101,https://images-eu.ssl-images-amazon.com/images/P/0241583101.01.L.jpg,12 in Children's Books on School | 14 in Children's Humorous Comics & Graphic Novels | 28 in Children's Books on Family Life
20,"Diary of a Wimpy Kid: The Getaway (Book 12) (Diary of a Wimpy Kid, 12)",Jeff Kinney,3.99,Paperback,4.7,27152.0,0141385251,9780141385259,240,Comics and Graphic Novels,8-11,2025-01-22T20:13:02.124328,0141385251,https://www.amazon.co.uk/Diary-Wimpy-Kid-Getaway-book/dp/0141385251,https://images-eu.ssl-images-amazon.com/images/P/0141385251.01.L.jpg,15 in Children's Humorous Comics & Graphic Novels | 29 in Children's Books on Family Life | 30 in Fiction About Family for Children
21,My First Padded Board Books of Nursery Rhymes: Illustrated Classic Nursery Rhymes (My First Book),Wonder House Books Editorial,5.99,Board book,4.6,5614.0,9388144201,9789388144209,24,Comics and Graphic Novels,,2025-01-22T20:13:02.127403,9388144201,https://www.amazon.co.uk/First-Padded-Board-Nursery-Rhymes/dp/9388144201,https://images-eu.ssl-images-amazon.com/images/P/9388144201.01.L.jpg,"1 in Children's Fairy Tales, Folklore, Legends & Mythology Comics & Graphic Novels | 2 in Nursery Rhymes for Children (Books) | 18 in Early Reader's Rhymes, Verse & Wordplay for Children"
22,Jokes for 7 Year Olds: Awesome Jokes for 7 Year Olds : Birthday - Christmas Gifts for 7 Year Olds (Funny Jokes for Kids Age 5-12),Linda Summers,2.99,Paperback,4.4,714.0,1913485048,9781913485047,51,Comics and Graphic Novels,7+,2025-01-22T20:13:02.131850,1913485048,https://www.amazon.co.uk/Jokes-Year-Olds-Birthday-Christmas/dp/1913485048,https://images-eu.ssl-images-amazon.com/images/P/1913485048.01.L.jpg,3 in Jokes & Riddles Humour | 3 in Short Story Collections for Children | 14 in Children's Books on Games
23,Dog Man 11: Twenty Thousand Fleas Under the Sea (the latest book in the million-copy selling Dog Man series!),Dav Pilkey,7.97,Paperback,4.7,8971.0,0702330027,9780702330025,224,Comics and Graphic Novels,7-10,2025-01-22T20:13:02.134720,0702330027,https://www.amazon.co.uk/Dog-Man-11-Thousand-million-copy/dp/0702330027,https://images-eu.ssl-images-amazon.com/images/P/0702330027.01.L.jpg,5 in Children's Comics & Graphic Novels on Social & Philosophical Topics | 6 in Children's Mystery & Detective Comics & Graphic Novels | 6 in Superhero Comics for Children
24,The Adventures of Captain Underpants: 25th Anniversary Edition: 1,Dav Pilkey,4.0,Paperback,4.6,1375.0,0702325171,9780702325175,176,Comics and Graphic Novels,7-11,2025-01-22T20:13:02.138066,0702325171,https://www.amazon.co.uk/Adventures-Captain-Underpants-25th-Anniversary/dp/0702325171,https://images-eu.ssl-images-amazon.com/images/P/0702325171.01.L.jpg,6 in Children's Comics & Graphic Novels on Social & Philosophical Topics | 7 in Children's Mystery & Detective Comics & Graphic Novels | 7 in Superhero Comics for Children
25,Dog Man: For Whom the Ball Rolls: From the Creator of Captain Underpants (Dog Man #7),Dav Pilkey,8.99,Paperback,4.8,27656.0,0702303674,9780702303678,240,Comics and Graphic Novels,7-9,2025-01-22T20:13:02.141405,0702303674,https://www.amazon.co.uk/Dog-Man-Creator-Captain-Underpants/dp/0702303674,https://images-eu.ssl-images-amazon.com/images/P/0702303674.01.L.jpg,5 in Children's Books on Pets | 7 in Children's Comics & Graphic Novels on Social & Philosophical Topics | 8 in Children's Mystery & Detective Comics & Graphic Novels
26,Dog Man: Brawl of the Wild: From the Creator of Captain Underpants (Dog Man #6),Dav Pilkey,8.27,Paperback,4.8,23692.0,1407191942,9781407191942,224,Comics and Graphic Novels,7-10,2025-01-22T20:13:02.144671,1407191942,https://www.amazon.co.uk/Dog-Man-Creator-Captain-Underpants/dp/1407191942,https://images-eu.ssl-images-amazon.com/images/P/1407191942.01.L.jpg,8 in Children's Comics & Graphic Novels on Social & Philosophical Topics | 9 in Children's Mystery & Detective Comics & Graphic Novels | 9 in Superhero Comics for Children
27,Pokemon Encyclopedia: Updated and Expanded 2024: New updated final edition for 2024! The ultimate fact-packed book for Pokémon fans,Pokémon,8.0,Hardcover,4.8,887.0,0008659257,9780008659257,352,Comics and Graphic Novels,6-10,2025-01-22T20:13:02.147867,0008659257,https://www.amazon.co.uk/Pokemon-Encyclopedia-Expanded-ultimate-fact-packed/dp/0008659257,https://images-eu.ssl-images-amazon.com/images/P/0008659257.01.L.jpg,1 in Managers' Guides to Computing | 6 in Children's Books on Video & Electronic Games | 6 in Children's Books on Computer Entertainment & Games
