rank,title,author,price,format,rating,review_count,isbn10,isbn13,page_count,category,target_age_range,timestamp,asin,product_url,image_url,category_ranks
1,Guess How Much I Love You: The beloved classic and perfect Valentines gift,Sam McBratney,4.0,Board book,4.8,8841.0,,9781406358780,32,Classic Books,,2025-02-16T12:46:16.711895,1406358789,https://www.amazon.co.uk/Guess-How-Much-Love-You/dp/1406358789,https://images-eu.ssl-images-amazon.com/images/P/1406358789.01.L.jpg,1 in Classics for Children | 1 in Children's Books on Valentine's Day | 2 in Fiction About Family for Children
2,Dear Zoo: The Lift-the-flap Preschool Classic,Rod Campbell,4.0,Board book,4.8,30645.0,1529074932,9781529074932,18,Classic Books,1-3,2025-02-16T12:46:16.715359,1529074932,https://www.amazon.co.uk/Dear-Zoo-Anniversary-Rod-Campbell/dp/1529074932,https://images-eu.ssl-images-amazon.com/images/P/1529074932.01.L.jpg,1 in Children's Early Learning Books on Size & Shape | 2 in Classics for Children | 6 in Activity Books for Children
3,The Tiger Who Came to Tea,Judith Kerr,4.0,Paperback,4.8,15700.0,0007368380,9780007215997,32,Classic Books,2-4,2025-02-16T12:46:16.717202,0007215991,https://www.amazon.co.uk/Tiger-Who-Came-Tea/dp/0007215991,https://images-eu.ssl-images-amazon.com/images/P/0007215991.01.L.jpg,1 in Doctors & Medicine Humour | 2 in Children’s Daily Activity Fiction Books | 3 in Classics for Children
4,We're Going on a Bear Hunt: The bestselling classic family favourite,Michael Rosen,4.0,Paperback,4.8,4821.0,0744523230,9780744523232,40,Classic Books,2-4,2025-02-16T12:46:16.719045,0744523230,https://www.amazon.co.uk/Were-Going-Bear-Michael-Rosen/dp/0744523230,https://images-eu.ssl-images-amazon.com/images/P/0744523230.01.L.jpg,1 in Children's Early Learning Books on Words | 4 in Classics for Children | 8 in Activity Books for Children
5,Oh Dear!: A Lift-the-flap Farm Book from the Creator of Dear Zoo,Rod Campbell,4.0,Board book,4.8,2671.0,1529097886,9781529097887,18,Classic Books,,2025-02-16T12:46:16.720697,1529097886,https://www.amazon.co.uk/Oh-Dear-Rod-Campbell/dp/1529097886,https://images-eu.ssl-images-amazon.com/images/P/1529097886.01.L.jpg,1 in Children's Books on Easter | 3 in Children's Books on Country & Farm Life | 3 in Children's Books on Farm Animals
6,"The Gruffalo (The Gruffalo, 1)",Julia Donaldson,6.39,Board book,4.9,17010.0,,9781509830398,24,Classic Books,2-4,2025-02-16T12:46:16.722575,1509830391,https://www.amazon.co.uk/Gruffalo-Julia-Donaldson/dp/1509830391,https://images-eu.ssl-images-amazon.com/images/P/1509830391.01.L.jpg,"2 in Horror & Ghost Stories for Children | 3 in Dragons, Unicorns & Mythical Creatures Tales for Children | 5 in Children's Books on Mystery & Wonders"
7,"Fox's Socks: A Lift-the-flap Story (Tales From Acorn Wood, 1)",Julia Donaldson,4.0,Board book,4.8,6907.0,1529023475,9781529023473,12,Classic Books,1-3,2025-02-16T12:46:16.724371,1529023475,https://www.amazon.co.uk/Foxs-Socks-Anniversary-Tales-Acorn/dp/1529023475,https://images-eu.ssl-images-amazon.com/images/P/1529023475.01.L.jpg,1 in Children's Books on Home | 1 in Children's Books on Fashion Crafts | 3 in Children’s Daily Activity Fiction Books
8,Stephen King,Stephen King,20.0,Hardcover,,,1444919342,9781444919349,48,Classic Books,,2025-02-16T12:46:16.727970,1444919342,https://www.amazon.co.uk/Hansel-Gretel-Stephen-King/dp/1444919342,https://images-eu.ssl-images-amazon.com/images/P/1444919342.01.L.jpg,"6 in Fairy Tales, Folk Tales & Myths for Children (Books) | 7 in Primary School Textbooks | 8 in Classics for Children"
9,Where's Spot?: Eric Hill (Spot - Original Lift The Flap),Eric Hill,5.0,Hardcover,4.8,34230.0,0723263663,9780723263661,22,Classic Books,1-2,2025-02-16T12:46:16.730729,0723263663,https://www.amazon.co.uk/Wheres-Spot-Original-Lift-Flap/dp/0723263663,https://images-eu.ssl-images-amazon.com/images/P/0723263663.01.L.jpg,9 in Children's Books on Dogs | 9 in Classics for Children | 18 in Children's Books on Mammals
10,"Hide-and-Seek Pig: A Lift-the-flap Story (Tales From Acorn Wood, 2)",Julia Donaldson,4.0,Board book,4.8,3984.0,1529023548,9781529023541,12,Classic Books,1-3,2025-02-16T12:46:16.732397,1529023548,https://www.amazon.co.uk/Hide-Seek-Pig-Anniversary-Tales/dp/1529023548,https://images-eu.ssl-images-amazon.com/images/P/1529023548.01.L.jpg,1 in Children's Books on Pigs | 1 in Children's Books on Sports & the Outdoors | 4 in Children's Books on Farm Animals
11,"Rabbit's Nap: A Lift-the-flap Book (Tales From Acorn Wood, 4)",Julia Donaldson,4.0,Board book,4.8,6613.0,1529023521,9781529023527,12,Classic Books,1-2,2025-02-16T12:46:16.734172,1529023521,https://www.amazon.co.uk/Rabbits-Nap-Anniversary-Tales-Acorn/dp/1529023521,https://images-eu.ssl-images-amazon.com/images/P/1529023521.01.L.jpg,2 in Children's Books on Easter | 2 in Children's Books on Rabbits | 3 in Children's Bedtime & Dream Books
12,Matilda,Roald Dahl,4.0,Paperback,4.8,21243.0,024155831X,9780241558317,384,Classic Books,6-8,2025-02-16T12:46:16.735815,024155831X,https://www.amazon.co.uk/Matilda-Special-Roald-Dahl/dp/024155831X,https://images-eu.ssl-images-amazon.com/images/P/024155831X.01.L.jpg,1 in Children's Fiction on Bullying | 1 in Young Adult Nonfiction on Adoption | 1 in Young Adult Nonfiction on Social & Family Violence
13,"Postman Bear: A Lift-the-flap Story (Tales From Acorn Wood, 3)",Julia Donaldson,4.0,Board book,4.8,3072.0,152902353X,9781529023534,12,Classic Books,1-2,2025-02-16T12:46:16.737450,152902353X,https://www.amazon.co.uk/Postman-Bear-Anniversary-Tales-Acorn/dp/152902353X,https://images-eu.ssl-images-amazon.com/images/P/152902353X.01.L.jpg,4 in Children's Books on Bears | 4 in Children's Early Learning Books on Numbers & Counting | 8 in Children's Books on Holidays & Celebrations
14,"The Tiger Who Came to Tea: The nation’s favourite illustrated children’s book, from the author of Mog the Forgetful Cat",Judith Kerr,3.69,Kindle Edition,4.8,15700.0,,,32,Classic Books,,2025-02-16T12:46:16.739064,B007XJ70QI,https://www.amazon.co.uk/Tiger-Who-Came-Tea-ebook/dp/B007XJ70QI,https://images-eu.ssl-images-amazon.com/images/P/B007XJ70QI.01.L.jpg,"1 in Children's Imagination & Play Literature | 1 in Children's Classic Literature | 1 in Children's Lion, Tiger & Leopard eBooks"
15,Harry Potter Children's Collection: The Complete Collection (Children's Paperback),J.K. Rowling,40.0,Paperback,4.9,37074.0,,9781408856772,3872,Classic Books,8+,2025-02-16T12:46:16.740858,1408856778,https://www.amazon.co.uk/Harry-Potter-Box-Set-Collection/dp/1408856778,https://images-eu.ssl-images-amazon.com/images/P/1408856778.01.L.jpg,2 in Chapter Books for Children | 3 in Fiction Classics for Young Adults | 7 in Contemporary Fantasy for Young Adults
16,Disney: Disneyland Paris Colouring Book (Young Adult Colouring),Walt Disney,4.5,Paperback,4.8,75.0,1837714401,9781837714407,96,Classic Books,9-13,2025-02-16T12:46:16.743208,1837714401,https://www.amazon.co.uk/Disney-Disneyland-Paris-Colouring-Book/dp/1837714401,https://images-eu.ssl-images-amazon.com/images/P/1837714401.01.L.jpg,1 in Vocational | 1 in Children's Books on Travel | 4 in Children's Books on Jobs & Careers
17,The Gruffalo 25th Anniversary Edition: with a shiny gold foil cover and fun Gruffalo activities to make and do!,Julia Donaldson,4.0,Paperback,4.9,193.0,1035028395,9781035028399,32,Classic Books,2-5,2025-02-16T12:46:16.744991,1035028395,https://www.amazon.co.uk/Gruffalo-25th-Anniversary-shiny-material/dp/1035028395,https://images-eu.ssl-images-amazon.com/images/P/1035028395.01.L.jpg,"6 in Horror & Ghost Stories for Children | 10 in Dragons, Unicorns & Mythical Creatures Tales for Children | 12 in Children's Books on Mystery & Wonders"
18,Goodnight Moon,Margaret Wise Brown,7.35,Board book,4.7,48247.0,,9781509831975,32,Classic Books,1-3,2025-02-16T12:46:16.747677,1509831975,https://www.amazon.co.uk/Goodnight-Moon-Margaret-Wise-Brown/dp/1509831975,https://images-eu.ssl-images-amazon.com/images/P/1509831975.01.L.jpg,5 in Children's Bedtime & Dream Books | 5 in Children’s Daily Activity Fiction Books | 5 in Children's Books on Rabbits
19,The Boy Who Grew Dragons (The Boy Who Grew Dragons 1),Andy Shepherd,7.09,Paperback,4.7,5279.0,,9781848126497,224,Classic Books,5-8,2025-02-16T12:46:16.749509,1848126492,https://www.amazon.co.uk/Boy-Who-Grew-Dragons/dp/1848126492,https://images-eu.ssl-images-amazon.com/images/P/1848126492.01.L.jpg,1 in Intermediate & Advanced Readers for Children | 1 in Visionary & Metaphysical Fantasy Fiction for Children | 2 in Fiction About Values & Virtues for Children
20,The Cat in the Hat: The classic funny children's book from Dr Seuss perfect for early readers ages 3 – 7,Dr. Seuss,5.0,Paperback,4.8,21016.0,000734869X,9780007348695,64,Classic Books,2-6,2025-02-16T12:46:16.754977,000734869X,https://www.amazon.co.uk/Cat-Hat-Dr-Seuss/dp/000734869X,https://images-eu.ssl-images-amazon.com/images/P/000734869X.01.L.jpg,"2 in Magic & Fantasy Graphic Novels | 13 in Humorous Verse | 19 in Early Reader's Rhymes, Verse & Wordplay for Children"
21,"The Gruffalo's Child (The Gruffalo, 2)",Julia Donaldson,6.39,Board book,4.9,12001.0,1509830405,9781509830404,24,Classic Books,2-4,2025-02-16T12:46:16.756672,1509830405,https://www.amazon.co.uk/Gruffalos-Child-Julia-Donaldson/dp/1509830405,https://images-eu.ssl-images-amazon.com/images/P/1509830405.01.L.jpg,"3 in Children's Books on Christmas | 11 in Horror & Ghost Stories for Children | 20 in Dragons, Unicorns & Mythical Creatures Tales for Children"
22,"Brown Bear, Brown Bear, What Do You See?",Eric Carle,6.99,Board book,4.8,52248.0,0241137292,9780241137291,28,Classic Books,1-3,2025-02-16T12:46:16.758916,0241137292,https://www.amazon.co.uk/Brown-Bear-What-You-See/dp/0241137292,https://images-eu.ssl-images-amazon.com/images/P/0241137292.01.L.jpg,3 in Children's Early Learning Books on Colours | 4 in Children's Early Learning Books on Sounds | 6 in Children's Books on Bears
23,Harry Potter and the Goblet of Fire (Bloomsbury Publishing),J.K. Rowling,4.0,Paperback,4.8,87684.0,1408855682,9781408855683,640,Classic Books,9+,2025-02-16T12:46:16.761055,1408855682,https://www.amazon.co.uk/Harry-Potter-Goblet-Fire/dp/1408855682,https://images-eu.ssl-images-amazon.com/images/P/1408855682.01.L.jpg,5 in Chapter Books for Children | 5 in Fiction Classics for Young Adults | 11 in Contemporary Fantasy for Young Adults
24,We're Going on a Bear Hunt: The bestselling classic in a super-sturdy board book for babies and toddlers,Michael Rosen,7.32,Board book,4.8,4605.0,1406363073,9781406363074,36,Classic Books,1-3,2025-02-16T12:46:16.762760,1406363073,https://www.amazon.co.uk/Were-Going-Bear-Michael-Rosen/dp/1406363073,https://images-eu.ssl-images-amazon.com/images/P/1406363073.01.L.jpg,9 in Children's Early Learning Books on Words | 24 in Classics for Children | 73 in Action & Adventure for Children (Books)
25,"Harry Potter and the Order of the Phoenix (Harry Potter, 5)",J.K. Rowling,4.0,Paperback,4.8,86542.0,,9781408855690,816,Classic Books,9+,2025-02-16T12:46:16.767287,1408855690,https://www.amazon.co.uk/Harry-Potter-Order-Phoenix/dp/1408855690,https://images-eu.ssl-images-amazon.com/images/P/1408855690.01.L.jpg,5 in Fiction Classics for Young Adults | 5 in Chapter Books for Children | 12 in Contemporary Fantasy for Young Adults
26,Charlie and the Chocolate Factory,Roald Dahl,6.99,Audible Audiobook,4.7,857.0,,,,Classic Books,,2025-02-16T12:46:16.769628,B0CS4HJRRG,https://www.amazon.co.uk/Charlie-and-the-Chocolate-Factory/dp/B0CS4HJRRG,https://images-eu.ssl-images-amazon.com/images/P/B0CS4HJRRG.01.L.jpg,
27,A Bear Called Paddington,Michael Bond,6.99,Audible Audiobook,4.7,2659.0,,,,Classic Books,,2025-02-16T12:46:16.772261,B002SQAQEO,https://www.amazon.co.uk/A-Bear-Called-Paddington/dp/B002SQAQEO,https://images-eu.ssl-images-amazon.com/images/P/B002SQAQEO.01.L.jpg,
28,Harry Potter and the Prisoner of Azkaban (Bloomsbury Publishing),J.K. Rowling,4.0,Paperback,4.8,97102.0,1408855674,9781408855676,480,Classic Books,8+,2025-02-16T12:46:16.773897,1408855674,https://www.amazon.co.uk/Harry-Potter-Prisoner-Azkaban/dp/1408855674,https://images-eu.ssl-images-amazon.com/images/P/1408855674.01.L.jpg,7 in Chapter Books for Children | 7 in Fiction Classics for Young Adults | 14 in Contemporary Fantasy for Young Adults
29,"Skandar and the Unicorn Thief: The international, award-winning hit, and the biggest fantasy adventure series since Harry Potter (Volume 1)",A.F. Steadman,4.5,Paperback,4.7,1680.0,1398502731,9781398502734,400,Classic Books,9+,2025-02-16T12:46:16.775740,1398502731,https://www.amazon.co.uk/Skandar-Unicorn-Thief-major-fantasy/dp/1398502731,https://images-eu.ssl-images-amazon.com/images/P/1398502731.01.L.jpg,1 in Children's Books on Horses | 7 in Children's Books on Sports & the Outdoors | 10 in Science Fiction for Children
30,Ten Little Fingers and Ten Little Toes,Mem Fox,7.35,Board book,4.8,2892.0,1406331260,9781406331264,38,Classic Books,,2025-02-16T12:46:16.777878,1406331260,https://www.amazon.co.uk/Ten-Little-Fingers-Toes/dp/1406331260,https://images-eu.ssl-images-amazon.com/images/P/1406331260.01.L.jpg,2 in Multicultural Stories for Children (Books) | 2 in Children's Books on New Babies | 4 in Children's Early Learning Books on the Body
1,"Hide-and-Seek Pig: A Lift-the-flap Story (Tales From Acorn Wood, 2)",Julia Donaldson,4.0,Board book,4.8,3984.0,1529023548,9781529023541,12,Sport and Outdoors,1-3,2025-02-16T12:46:17.733210,1529023548,https://www.amazon.co.uk/Hide-Seek-Pig-Anniversary-Tales/dp/1529023548,https://images-eu.ssl-images-amazon.com/images/P/1529023548.01.L.jpg,1 in Children's Books on Pigs | 1 in Children's Books on Sports & the Outdoors | 4 in Children's Books on Farm Animals
2,"Football Kit Designer Colouring Book for Kids: Design Your Own Football Kit, Jersey, Boots and More | 50 Unique Football Colouring Pages and Football Facts",Kickstart Creatives,6.99,Paperback,4.6,171.0,,9798322166856,108,Sport and Outdoors,7-10,2025-02-16T12:46:17.734855,B0D12PYZYQ,https://www.amazon.co.uk/Football-Designer-Colouring-Book-Kids/dp/B0D12PYZYQ,https://images-eu.ssl-images-amazon.com/images/P/B0D12PYZYQ.01.L.jpg,1 in Celtic Glasgow | 1 in Children's Books on Football | 10 in Colouring Books for Children
3,Tom Palmer,Tom Palmer,1.0,Paperback,,,1837864144,9781837864140,80,Sport and Outdoors,,2025-02-16T12:46:17.736564,1837864144,https://www.amazon.co.uk/Soccer-Diaries-Rocky-Takes-World/dp/1837864144,https://images-eu.ssl-images-amazon.com/images/P/1837864144.01.L.jpg,3 in Children's Books on Sports & the Outdoors | 6 in Short Story Collections for Children | 31 in Fiction About Friendship for Children
4,Ultimate Football Heroes 2025: the perfect World Book Day gift for fans of the beautiful game,Matt & Tom Oldfield,7.85,Paperback,4.4,89.0,1789467527,9781789467529,336,Sport and Outdoors,,2025-02-16T12:46:17.740306,1789467527,https://www.amazon.co.uk/Ultimate-Football-Heroes-2025/dp/1789467527,https://images-eu.ssl-images-amazon.com/images/P/1789467527.01.L.jpg,1 in Football Fans | 1 in Children's Books on American Football | 2 in Children's Books on Football
5,Ultimate Football Heroes Colouring Book: the perfect World Book Day gift for fans of the beautiful game!,Ultimate Football Heroes,7.35,Paperback,4.6,314.0,1800784015,9781800784017,80,Sport and Outdoors,,2025-02-16T12:46:17.742284,1800784015,https://www.amazon.co.uk/Ultimate-Football-Heroes-Colouring-football/dp/1800784015,https://images-eu.ssl-images-amazon.com/images/P/1800784015.01.L.jpg,1 in FIFA | 2 in Football Fans | 3 in Children's Books on Football
6,"Simone Biles (103) (Little People, BIG DREAMS)",Maria Isabel Sanchez Vegara,7.26,Hardcover,4.6,107.0,0711285780,9780711285781,32,Sport and Outdoors,6-8,2025-02-16T12:46:17.744579,0711285780,https://www.amazon.co.uk/Simone-Biles-Little-People-DREAMS/dp/0711285780,https://images-eu.ssl-images-amazon.com/images/P/0711285780.01.L.jpg,1 in Children's Books on Gymnastics | 1 in Athletics Biographies | 1 in Children's Books on Marriage & Divorce
7,"Skandar and the Unicorn Thief: The international, award-winning hit, and the biggest fantasy adventure series since Harry Potter (Volume 1)",A.F. Steadman,4.5,Paperback,4.7,1680.0,1398502731,9781398502734,400,Sport and Outdoors,9+,2025-02-16T12:46:17.746235,1398502731,https://www.amazon.co.uk/Skandar-Unicorn-Thief-major-fantasy/dp/1398502731,https://images-eu.ssl-images-amazon.com/images/P/1398502731.01.L.jpg,1 in Children's Books on Horses | 7 in Children's Books on Sports & the Outdoors | 10 in Science Fiction for Children
8,"The Breakfast Club Adventures: The Beast Beyond the Fence: 1 (The Breakfast Club Adventures, 1)",Marcus Rashford,4.0,Paperback,4.7,1339.0,1529076625,9781529076622,272,Sport and Outdoors,7-10,2025-02-16T12:46:17.749084,1529076625,https://www.amazon.co.uk/Breakfast-Club-Adventures-Beast-Beyond/dp/1529076625,https://images-eu.ssl-images-amazon.com/images/P/1529076625.01.L.jpg,4 in Children's Books on Football | 5 in Sports Humour | 20 in Children's Books on School
9,Skandar and the Chaos Trials: The INSTANT NUMBER ONE BESTSELLER in the biggest fantasy adventure series since Harry Potter (Volume 3),A.F. Steadman,6.49,Paperback,4.8,982.0,1398502960,9781398502963,416,Sport and Outdoors,10-12,2025-02-16T12:46:17.750917,1398502960,https://www.amazon.co.uk/Skandar-Chaos-Trials-BESTSELLER-adventure/dp/1398502960,https://images-eu.ssl-images-amazon.com/images/P/1398502960.01.L.jpg,3 in Fiction About Siblings for Young Adults | 4 in Fiction About Parents for Young Adults | 6 in Fantasy & Supernatural Mysteries & Thrillers for Young Adults
10,Ultimate Football Heroes: Ronaldo (Wing Wizards 1): Collect them all!,Matt Oldfield Ltd,4.3,Paperback,4.7,1753.0,1786064057,9781786064059,192,Sport and Outdoors,8-12,2025-02-16T12:46:17.752561,1786064057,https://www.amazon.co.uk/Ronaldo-Ultimate-Football-Heroes-Collect/dp/1786064057,https://images-eu.ssl-images-amazon.com/images/P/1786064057.01.L.jpg,1 in South American Football | 1 in Football Biographies (Books) | 3 in Sports & Recreation Biographies for Children
11,Yamal: Ultimate Football Heroes,Matt Oldfield,16.62,Audible Audiobook,4.0,1.0,,,,Sport and Outdoors,,2025-02-16T12:46:17.755136,B0DQQG6WGF,https://www.amazon.co.uk/Audible-Yamal-Ultimate-Football-Heroes/dp/B0DQQG6WGF,https://images-eu.ssl-images-amazon.com/images/P/B0DQQG6WGF.01.L.jpg,
12,Football Colouring Book For Kids: Ages 4-8,The Future Teacher Foundation,3.99,Paperback,4.6,368.0,1090953607,9781090953605,64,Sport and Outdoors,5-7,2025-02-16T12:46:17.756773,1090953607,https://www.amazon.co.uk/Football-Colouring-Book-Kids-Ages/dp/1090953607,https://images-eu.ssl-images-amazon.com/images/P/1090953607.01.L.jpg,1 in Football Skills & Coaching | 2 in Premier League Football | 3 in Football Fans
13,"Boot It!: World Book Day 2023 - A Boy, Everywhere story",A. M. Dassu,1.0,Paperback,4.7,47.0,1910646830,9781910646830,128,Sport and Outdoors,10-14,2025-02-16T12:46:17.758940,1910646830,https://www.amazon.co.uk/Boot-World-Book-Day-2023/dp/1910646830,https://images-eu.ssl-images-amazon.com/images/P/1910646830.01.L.jpg,1 in Exploring Europe for Children | 2 in Children's Books on Prejudice & Racism | 3 in Children's Books on Multiculturalism
14,The Football GOAT: Messi v. Ronaldo: Who is the greatest of all time?,Matt Oldfield,4.5,Paperback,4.5,81.0,1529521025,9781529521023,160,Sport and Outdoors,9-12,2025-02-16T12:46:17.761075,1529521025,https://www.amazon.co.uk/Football-GOAT-Messi-Ronaldo-greatest/dp/1529521025,https://images-eu.ssl-images-amazon.com/images/P/1529521025.01.L.jpg,2 in South American Football | 2 in Children's Books on American Football | 2 in Football Biographies (Books)
15,Nick Eh 30,Nick Eh 30,8.15,Paperback,,,1524884588,9781524884581,304,Sport and Outdoors,8-12,2025-02-16T12:46:17.762885,1524884588,https://www.amazon.co.uk/Stream-Team-Battle-Squad/dp/1524884588,https://images-eu.ssl-images-amazon.com/images/P/1524884588.01.L.jpg,13 in Children's Autism Spectrum | 15 in Children's Books on Sports & the Outdoors | 19 in Children's Books on Computers & Technology
16,The Football School Encyclopedia: Everything you want to know about football,Alex Bellos,12.15,Hardcover,4.6,157.0,1529507588,9781529507584,144,Sport and Outdoors,7-11,2025-02-16T12:46:17.765648,1529507588,https://www.amazon.co.uk/Football-School-Encyclopedia-Everything-football/dp/1529507588,https://images-eu.ssl-images-amazon.com/images/P/1529507588.01.L.jpg,"1 in Sports, Hobby & Games Encyclopaedias | 1 in Humour Encyclopaedias | 3 in Children's Books on American Football"
17,The Most Incredible True Football Stories (You Never Knew): Winner of the Telegraph Children's Sports Book of the Year (Unbelievable Football),Matt Oldfield,6.36,Paperback,4.7,1892.0,1526362449,9781526362445,240,Sport and Outdoors,8-11,2025-02-16T12:46:17.767539,1526362449,https://www.amazon.co.uk/Unbelievable-Football-Incredible-Stories-Never/dp/1526362449,https://images-eu.ssl-images-amazon.com/images/P/1526362449.01.L.jpg,1 in Football References | 4 in Sports & Recreation Biographies for Children | 8 in Children's Books on Football
18,The Academy: 1 (The Academy Series),T.Z. Layton,9.19,Paperback,4.8,1358.0,1955804087,9781955804080,306,Sport and Outdoors,9-11,2025-02-16T12:46:17.769172,1955804087,https://www.amazon.co.uk/Academy-T-Z-Layton/dp/1955804087,https://images-eu.ssl-images-amazon.com/images/P/1955804087.01.L.jpg,5 in Intermediate & Advanced Readers for Children | 5 in Children's Fiction on Maturing | 11 in Children's Books on Football
19,"The Breakfast Club Adventures: The Phantom Thief (The Breakfast Club Adventures, 3)",Marcus Rashford,4.0,Paperback,4.8,292.0,1035022672,9781035022670,256,Sport and Outdoors,6-10,2025-02-16T12:46:17.770962,1035022672,https://www.amazon.co.uk/Breakfast-Club-Adventures-Phantom-Thief/dp/1035022672,https://images-eu.ssl-images-amazon.com/images/P/1035022672.01.L.jpg,3 in Children's Fiction on Sexuality | 7 in Children's Nonfiction on Sexuality & Pregnancy | 12 in Children's Books on Football
20,"Dork Diaries: Skating Sensation: Jokes, Drama and BFFs in the perfect stocking filler this Christmas (Volume 4)",Rachel Renee Russell,5.99,Paperback,4.8,1189.0,1398527580,9781398527584,368,Sport and Outdoors,,2025-02-16T12:46:17.772834,1398527580,https://www.amazon.co.uk/Dork-Diaries-Skating-Sensation-4/dp/1398527580,https://images-eu.ssl-images-amazon.com/images/P/1398527580.01.L.jpg,5 in Children's Books on Christmas | 13 in Jokes & Riddles Humour | 20 in Children's Books on Sports & the Outdoors
21,Football's Greatest Moments (Ultimate Football Heroes - The No.1 football series): Collect Them All!: Volume 79,Tom Palmer,4.82,Paperback,4.5,184.0,1789467152,9781789467154,176,Sport and Outdoors,7-11,2025-02-16T12:46:17.779149,1789467152,https://www.amazon.co.uk/Footballs-Greatest-Moments-Ultimate-Football/dp/1789467152,https://images-eu.ssl-images-amazon.com/images/P/1789467152.01.L.jpg,
22,"Leo Messi (Little People, BIG DREAMS)",Maria Isabel Sanchez Vegara,7.9,Hardcover,4.9,243.0,0711290571,9780711290570,32,Sport and Outdoors,6-8,2025-02-16T12:46:17.781953,0711290571,https://www.amazon.co.uk/Leo-Messi-Little-People-DREAMS/dp/0711290571,https://images-eu.ssl-images-amazon.com/images/P/0711290571.01.L.jpg,6 in Sports & Recreation Biographies for Children | 14 in Children's Books on Football | 17 in Children & Young Adult Biographies
23,Official Liverpool FC Annual 2025,Grange,6.99,Hardcover,4.6,112.0,1915879884,9781915879882,64,Sport and Outdoors,,2025-02-16T12:46:17.787632,1915879884,https://www.amazon.co.uk/Official-Liverpool-FC-Annual-2025/dp/1915879884,https://images-eu.ssl-images-amazon.com/images/P/1915879884.01.L.jpg,1 in FC Liverpool | 1 in Books on Football for Young Adults | 2 in Football References
24,Skandar and the Chaos Trials: The INSTANT NUMBER ONE BESTSELLER in the biggest fantasy adventure series since Harry Potter,A.F. Steadman,3.99,Kindle Edition,4.8,981.0,,,413,Sport and Outdoors,,2025-02-16T12:46:17.789321,B0C37W4NM5,https://www.amazon.co.uk/Skandar-3-F-Steadman-ebook/dp/B0C37W4NM5,https://images-eu.ssl-images-amazon.com/images/P/B0C37W4NM5.01.L.jpg,
25,Quidditch Through the Ages: A Harry Potter Hogwarts Library Book,J.K. Rowling,12.0,Audible Audiobook,4.6,6838.0,,,,Sport and Outdoors,,2025-02-16T12:46:17.792133,B07982F9PQ,https://www.amazon.co.uk/Quidditch-Through-the-Ages/dp/B07982F9PQ,https://images-eu.ssl-images-amazon.com/images/P/B07982F9PQ.01.L.jpg,
26,Messi (Ultimate Football Heroes - the No. 1 football series): Collect them all!,Matt & Tom Oldfield,5.22,Paperback,4.7,1549.0,1786064030,9781786064035,192,Sport and Outdoors,7-10,2025-02-16T12:46:17.794213,1786064030,https://www.amazon.co.uk/Messi-Ultimate-Football-Heroes-Collect/dp/1786064030,https://images-eu.ssl-images-amazon.com/images/P/1786064030.01.L.jpg,7 in Sports & Recreation Biographies for Children | 7 in Football Biographies (Books) | 16 in Children's Books on Football
27,Where's the Footballer?: A Search-and-Find Book (Fun With Ladybird),Gary Panton,7.35,Paperback,4.5,34.0,0241687683,9780241687680,32,Sport and Outdoors,,2025-02-16T12:46:17.796654,0241687683,https://www.amazon.co.uk/Wheres-Footballer-Search-Find-Ladybird/dp/0241687683,https://images-eu.ssl-images-amazon.com/images/P/0241687683.01.L.jpg,17 in Children's Books on Football | 24 in Hidden Picture Books for Children | 98 in Children's Books on Games
28,"The Breakfast Club Adventures: The Ghoul in the School: 2 (The Breakfast Club Adventures, 2)",Marcus Rashford,6.03,Paperback,4.7,455.0,1529076668,9781529076660,288,Sport and Outdoors,7-10,2025-02-16T12:46:17.799448,1529076668,https://www.amazon.co.uk/Breakfast-Club-Adventures-Ghoul-School/dp/1529076668,https://images-eu.ssl-images-amazon.com/images/P/1529076668.01.L.jpg,20 in Children's Books on Football | 31 in Sports Humour | 42 in Children's Books on School
