rank,title,author,price,format,rating,review_count,isbn10,isbn13,page_count,category,target_age_range,timestamp,asin,product_url,image_url,category_ranks
1,Guess How Much I Love You: The beloved classic and perfect Valentines gift,Sam McBratney,4.0,Board book,4.8,8782.0,,9781406358780,32,Classic Books,,2025-01-22T20:12:54.534361,1406358789,https://www.amazon.co.uk/Guess-How-Much-Love-You/dp/1406358789,https://images-eu.ssl-images-amazon.com/images/P/1406358789.01.L.jpg,1 in Fiction About Emotions & Feelings for Children | 1 in Classics for Children | 1 in Children's Books on Valentine's Day
2,Dear Zoo: The Lift-the-flap Preschool Classic,Rod Campbell,4.0,Board book,4.8,30605.0,1529074932,9781529074932,18,Classic Books,1-3,2025-01-22T20:12:54.537751,1529074932,https://www.amazon.co.uk/Dear-Zoo-Anniversary-Rod-Campbell/dp/1529074932,https://images-eu.ssl-images-amazon.com/images/P/1529074932.01.L.jpg,1 in Children's Early Learning Books on Size & Shape | 2 in Classics for Children | 2 in Children's Fiction Books on Animals
3,We're Going on a Bear Hunt: The bestselling classic family favourite,Michael Rosen,4.0,Paperback,4.8,4796.0,0744523230,9780744523232,40,Classic Books,2-4,2025-01-22T20:12:54.545280,0744523230,https://www.amazon.co.uk/Were-Going-Bear-Michael-Rosen/dp/0744523230,https://images-eu.ssl-images-amazon.com/images/P/0744523230.01.L.jpg,2 in Children's Early Learning Books on Words | 3 in Classics for Children | 6 in Activity Books for Children
4,The Tiger Who Came to Tea,Judith Kerr,4.0,Paperback,4.8,15663.0,0007368380,9780007215997,32,Classic Books,2-4,2025-01-22T20:12:54.552332,0007215991,https://www.amazon.co.uk/Tiger-Who-Came-Tea/dp/0007215991,https://images-eu.ssl-images-amazon.com/images/P/0007215991.01.L.jpg,2 in Children’s Daily Activity Fiction Books | 4 in Classics for Children | 11 in Children's Books on Family Life
5,Oh Dear!: A Lift-the-flap Farm Book from the Creator of Dear Zoo,Rod Campbell,4.0,Board book,4.8,2633.0,1529097886,9781529097887,18,Classic Books,,2025-01-22T20:12:54.555700,1529097886,https://www.amazon.co.uk/Oh-Dear-Rod-Campbell/dp/1529097886,https://images-eu.ssl-images-amazon.com/images/P/1529097886.01.L.jpg,1 in Children's Books on Country & Farm Life | 1 in Children's Books on Easter | 2 in Children's Books on Farm Animals
6,"The Gruffalo (The Gruffalo, 1)",Julia Donaldson,6.49,Board book,4.9,16958.0,,9781509830398,24,Classic Books,2-4,2025-01-22T20:12:54.559857,1509830391,https://www.amazon.co.uk/Gruffalo-Julia-Donaldson/dp/1509830391,https://images-eu.ssl-images-amazon.com/images/P/1509830391.01.L.jpg,"2 in Horror & Ghost Stories for Children | 4 in Dragons, Unicorns & Mythical Creatures Tales for Children | 5 in Children's Books on Mystery & Wonders"
7,Where's Spot?: Eric Hill (Spot - Original Lift The Flap),Eric Hill,5.0,Hardcover,4.8,34170.0,0723263663,9780723263661,22,Classic Books,1-2,2025-01-22T20:12:54.563520,0723263663,https://www.amazon.co.uk/Wheres-Spot-Original-Lift-Flap/dp/0723263663,https://images-eu.ssl-images-amazon.com/images/P/0723263663.01.L.jpg,7 in Children's Books on Dogs | 7 in Classics for Children | 11 in Children's Books on Mammals
8,"Fox's Socks: A Lift-the-flap Story (Tales From Acorn Wood, 1)",Julia Donaldson,4.0,Board book,4.8,6894.0,1529023475,9781529023473,12,Classic Books,1-3,2025-01-22T20:12:54.575646,1529023475,https://www.amazon.co.uk/Foxs-Socks-Anniversary-Tales-Acorn/dp/1529023475,https://images-eu.ssl-images-amazon.com/images/P/1529023475.01.L.jpg,1 in Children's Books on Fashion Crafts | 2 in Children's Books on Home | 3 in Children’s Daily Activity Fiction Books
9,Harry Potter Children's Collection: The Complete Collection (Children's Paperback),J.K. Rowling,40.0,Paperback,4.9,36965.0,,9781408856772,3872,Classic Books,8+,2025-01-22T20:12:54.579477,1408856778,https://www.amazon.co.uk/Harry-Potter-Box-Set-Collection/dp/1408856778,https://images-eu.ssl-images-amazon.com/images/P/1408856778.01.L.jpg,2 in Chapter Books for Children | 3 in Fiction Classics for Young Adults | 3 in Fantasy Fiction About Wizards & Witches for Young Adults
10,"The Tiger Who Came to Tea: The nation’s favourite illustrated children’s book, from the author of Mog the Forgetful Cat",Judith Kerr,3.69,Kindle Edition,4.8,15663.0,,,32,Classic Books,,2025-01-22T20:12:54.587446,B007XJ70QI,https://www.amazon.co.uk/Tiger-Who-Came-Tea-ebook/dp/B007XJ70QI,https://images-eu.ssl-images-amazon.com/images/P/B007XJ70QI.01.L.jpg,"1 in Children's Imagination & Play Literature | 1 in Children's Classic Literature | 1 in Children's Lion, Tiger & Leopard eBooks"
11,"Hide-and-Seek Pig: A Lift-the-flap Story (Tales From Acorn Wood, 2)",Julia Donaldson,4.0,Board book,4.8,3978.0,1529023548,9781529023541,12,Classic Books,1-3,2025-01-22T20:12:54.605099,1529023548,https://www.amazon.co.uk/Hide-Seek-Pig-Anniversary-Tales/dp/1529023548,https://images-eu.ssl-images-amazon.com/images/P/1529023548.01.L.jpg,3 in Children's Books on Farm Animals | 3 in Children's Books on Pigs | 3 in Children's Books on Sports & the Outdoors
12,"Postman Bear: A Lift-the-flap Story (Tales From Acorn Wood, 3)",Julia Donaldson,4.0,Board book,4.8,3070.0,152902353X,9781529023534,12,Classic Books,1-2,2025-01-22T20:12:54.618653,152902353X,https://www.amazon.co.uk/Postman-Bear-Anniversary-Tales-Acorn/dp/152902353X,https://images-eu.ssl-images-amazon.com/images/P/152902353X.01.L.jpg,4 in Children's Books on Bears | 5 in Children's Early Learning Books on Numbers & Counting | 12 in Children's Books on Holidays & Celebrations
13,We're Going on a Bear Hunt: The bestselling classic in a super-sturdy board book for babies and toddlers,Michael Rosen,7.35,Board book,4.8,4583.0,1406363073,9781406363074,36,Classic Books,1-3,2025-01-22T20:12:54.624440,1406363073,https://www.amazon.co.uk/Were-Going-Bear-Michael-Rosen/dp/1406363073,https://images-eu.ssl-images-amazon.com/images/P/1406363073.01.L.jpg,4 in Children's Early Learning Books on Words | 12 in Classics for Children | 39 in Action & Adventure for Children (Books)
14,Each Peach Pear Plum,Allan Ahlberg,6.29,Board book,4.7,4843.0,0141379529,9780141379524,34,Classic Books,1-3,2025-01-22T20:12:54.627597,0141379529,https://www.amazon.co.uk/Each-Peach-Pear-Allan-Ahlberg/dp/0141379529,https://images-eu.ssl-images-amazon.com/images/P/0141379529.01.L.jpg,"1 in Nursery Rhymes for Children (Books) | 14 in Classics for Children | 17 in Early Reader's Rhymes, Verse & Wordplay for Children"
15,"Rabbit's Nap: A Lift-the-flap Book (Tales From Acorn Wood, 4)",Julia Donaldson,4.0,Board book,4.8,6598.0,1529023521,9781529023527,12,Classic Books,1-2,2025-01-22T20:12:54.633089,1529023521,https://www.amazon.co.uk/Rabbits-Nap-Anniversary-Tales-Acorn/dp/1529023521,https://images-eu.ssl-images-amazon.com/images/P/1529023521.01.L.jpg,2 in Children's Books on Easter | 2 in Children's Books on Rabbits | 3 in Children's Early Learning Books on Sounds
16,Goodnight Moon,Margaret Wise Brown,7.35,Board book,4.7,48137.0,,9781509831975,32,Classic Books,1-3,2025-01-22T20:12:54.636213,1509831975,https://www.amazon.co.uk/Goodnight-Moon-Margaret-Wise-Brown/dp/1509831975,https://images-eu.ssl-images-amazon.com/images/P/1509831975.01.L.jpg,4 in Children's Books on Rabbits | 5 in Children’s Daily Activity Fiction Books | 5 in Children’s Daily Activity Books
17,"Brown Bear, Brown Bear, What Do You See?",Eric Carle,6.99,Board book,4.8,52134.0,0241137292,9780241137291,28,Classic Books,1-3,2025-01-22T20:12:54.642351,0241137292,https://www.amazon.co.uk/Brown-Bear-What-You-See/dp/0241137292,https://images-eu.ssl-images-amazon.com/images/P/0241137292.01.L.jpg,4 in Children's Early Learning Books on Colours | 4 in Children's Early Learning Books on Sounds | 6 in Children's Books on Bears
18,"Gruffalo, Where Are You?: A Felt Flaps Book (Gruffalo Baby, 3)",Julia Donaldson,7.99,Board book,4.8,2508.0,1529023602,9781529023602,10,Classic Books,,2025-01-22T20:12:54.646503,1529023602,https://www.amazon.co.uk/Gruffalo-Where-Are-You-Flaps/dp/1529023602,https://images-eu.ssl-images-amazon.com/images/P/1529023602.01.L.jpg,"6 in Children's Books on Rabbits | 15 in Dragons, Unicorns & Mythical Creatures Tales for Children | 18 in Children's Books on Mystery & Wonders"
19,Five-Minute Stories: 30 stories (Bumper Short Story Collections),Enid Blyton,5.99,Paperback,4.6,607.0,1444969218,9781444969214,336,Classic Books,4-6,2025-01-22T20:12:54.650437,1444969218,https://www.amazon.co.uk/Five-Minute-Tales-Bumper-Short-Collections/dp/1444969218,https://images-eu.ssl-images-amazon.com/images/P/1444969218.01.L.jpg,1 in Short Stories for Young Adults | 4 in Fiction Classics for Young Adults | 4 in Short Story Collections for Children
20,Owl Babies: A beloved classic from the recipient of An Post Irish Book Awards’ Bob Hughes Lifetime Achievement Award,Martin Waddell,4.99,Paperback,4.8,4932.0,0744531675,9780744531671,32,Classic Books,2-4,2025-01-22T20:12:54.653392,0744531675,https://www.amazon.co.uk/Owl-Babies-Martin-Waddell/dp/0744531675,https://images-eu.ssl-images-amazon.com/images/P/0744531675.01.L.jpg,16 in Children's Books on Emotions & Feelings | 24 in Classics for Children | 43 in Children's Books on Family Life
21,The Boy Who Grew Dragons (The Boy Who Grew Dragons 1),Andy Shepherd,7.09,Paperback,4.7,5273.0,,9781848126497,224,Classic Books,5-8,2025-01-22T20:12:54.659743,1848126492,https://www.amazon.co.uk/Boy-Who-Grew-Dragons/dp/1848126492,https://images-eu.ssl-images-amazon.com/images/P/1848126492.01.L.jpg,1 in Visionary & Metaphysical Fantasy Fiction for Children | 2 in Fiction About Values & Virtues for Children | 2 in Intermediate & Advanced Readers for Children
22,Harry Potter and the Prisoner of Azkaban (Bloomsbury Publishing),J.K. Rowling,4.0,Paperback,4.8,95983.0,1408855674,9781408855676,480,Classic Books,8+,2025-01-22T20:12:54.663011,1408855674,https://www.amazon.co.uk/Harry-Potter-Prisoner-Azkaban/dp/1408855674,https://images-eu.ssl-images-amazon.com/images/P/1408855674.01.L.jpg,4 in Chapter Books for Children | 6 in Fiction Classics for Young Adults | 10 in Contemporary Fantasy for Young Adults
23,A Christmas Carol (Scholastic Classics),Charles Dickens,5.5,Paperback,4.6,1186.0,1407143646,9781407143644,144,Classic Books,9-11,2025-01-22T20:12:54.668015,1407143646,https://www.amazon.co.uk/Christmas-Carol-Scholastic-Classics/dp/1407143646,https://images-eu.ssl-images-amazon.com/images/P/1407143646.01.L.jpg,3 in Children's Books on Christmas | 10 in Fiction About Emotions & Feelings for Children | 15 in Children's Books on Emotions & Feelings
24,The Explorer: WINNER OF THE COSTA CHILDREN'S BOOK AWARD,Katherine Rundell,5.99,Paperback,4.7,4100.0,1408882191,9781408882191,416,Classic Books,8-10,2025-01-22T20:12:54.699485,1408882191,https://www.amazon.co.uk/Explorer-Katherine-Rundell/dp/1408882191,https://images-eu.ssl-images-amazon.com/images/P/1408882191.01.L.jpg,2 in Children's Books on Travel | 3 in Children's Books on Forests & Trees | 5 in Travel Fiction for Children
25,Paddington: The original story of the bear from Darkest Peru,Michael Bond,4.0,Paperback,4.8,2042.0,,9780007236336,32,Classic Books,1-5,2025-01-22T20:12:54.707227,0007236336,https://www.amazon.co.uk/Paddington-original-story-bear-Darkest/dp/0007236336,https://images-eu.ssl-images-amazon.com/images/P/0007236336.01.L.jpg,"1 in Children's Books on Adoption | 1 in Children's Fiction Books on Cars, Trains & Things That Go | 25 in Classics for Children"
26,Harry Potter and the Goblet of Fire (Bloomsbury Publishing),J.K. Rowling,4.0,Paperback,4.8,86723.0,1408855682,9781408855683,640,Classic Books,9+,2025-01-22T20:12:54.714210,1408855682,https://www.amazon.co.uk/Harry-Potter-Goblet-Fire/dp/1408855682,https://images-eu.ssl-images-amazon.com/images/P/1408855682.01.L.jpg,5 in Chapter Books for Children | 7 in Fiction Classics for Young Adults | 11 in Contemporary Fantasy for Young Adults
27,The Gruffalo 25th Anniversary Edition: with a shiny gold foil cover and fun Gruffalo activities to make and do!,Julia Donaldson,4.0,Paperback,4.9,163.0,1035028395,9781035028399,32,Classic Books,2-6,2025-01-22T20:12:54.731069,1035028395,https://www.amazon.co.uk/Gruffalo-25th-Anniversary-shiny-material/dp/1035028395,https://images-eu.ssl-images-amazon.com/images/P/1035028395.01.L.jpg,"11 in Horror & Ghost Stories for Children | 21 in Dragons, Unicorns & Mythical Creatures Tales for Children | 25 in Children's Books on Mystery & Wonders"
28,Matilda,Roald Dahl,4.5,Paperback,4.8,21183.0,024155831X,9780241558317,384,Classic Books,6-8,2025-01-22T20:12:54.744341,024155831X,https://www.amazon.co.uk/Matilda-Special-Roald-Dahl/dp/024155831X,https://images-eu.ssl-images-amazon.com/images/P/024155831X.01.L.jpg,1 in Children's Fiction on Bullying | 1 in Children's Books on Violence | 1 in Young Adult Fiction on Bullying
29,"Harry Potter and the Order of the Phoenix (Harry Potter, 5)",J.K. Rowling,4.0,Paperback,4.8,85704.0,,9781408855690,816,Classic Books,9+,2025-01-22T20:12:54.747893,1408855690,https://www.amazon.co.uk/Harry-Potter-Order-Phoenix/dp/1408855690,https://images-eu.ssl-images-amazon.com/images/P/1408855690.01.L.jpg,6 in Chapter Books for Children | 11 in Fiction Classics for Young Adults | 13 in Contemporary Fantasy for Young Adults
30,The Story Orchestra: The Planets: Press the note to hear Holst's music (8),Jessica Courtney Tickle,13.29,Hardcover,4.6,236.0,0711289166,9780711289161,24,Classic Books,2-5,2025-01-22T20:12:54.752309,0711289166,https://www.amazon.co.uk/Story-Orchestra-Planets-Press-Holsts/dp/0711289166,https://images-eu.ssl-images-amazon.com/images/P/0711289166.01.L.jpg,3 in Children's Books on Musical Instruments | 31 in Classics for Children | 51 in Fantasy & Magic for Children
1,Ultimate Football Heroes 2025,Matt & Tom Oldfield,4.35,Paperback,4.3,70.0,1789467527,9781789467529,336,Sport and Outdoors,,2025-01-22T20:12:59.242878,1789467527,https://www.amazon.co.uk/Ultimate-Football-Heroes-2025/dp/1789467527,https://images-eu.ssl-images-amazon.com/images/P/1789467527.01.L.jpg,1 in Intermediate & Advanced Readers for Children | 1 in Children's Books on Football | 1 in Children's Books on American Football
2,"Football Kit Designer Colouring Book for Kids: Design Your Own Football Kit, Jersey, Boots and More | 50 Unique Football Colouring Pages and Football Facts",Kickstart Creatives,6.99,Paperback,4.7,142.0,,9798322166856,108,Sport and Outdoors,7-10,2025-01-22T20:12:59.246181,B0D12PYZYQ,https://www.amazon.co.uk/Football-Designer-Colouring-Book-Kids/dp/B0D12PYZYQ,https://images-eu.ssl-images-amazon.com/images/P/B0D12PYZYQ.01.L.jpg,1 in Celtic Glasgow | 2 in Children's Books on Football | 8 in Colouring Books for Children
3,"Hide-and-Seek Pig: A Lift-the-flap Story (Tales From Acorn Wood, 2)",Julia Donaldson,4.0,Board book,4.8,3978.0,1529023548,9781529023541,12,Sport and Outdoors,1-3,2025-01-22T20:12:59.249296,1529023548,https://www.amazon.co.uk/Hide-Seek-Pig-Anniversary-Tales/dp/1529023548,https://images-eu.ssl-images-amazon.com/images/P/1529023548.01.L.jpg,3 in Children's Books on Farm Animals | 3 in Children's Books on Pigs | 3 in Children's Books on Sports & the Outdoors
4,Match Annual 2025: The UK's Best-selling Football Annual!,MATCH,2.99,Hardcover,4.7,65.0,1035041081,9781035041084,96,Sport and Outdoors,9-11,2025-01-22T20:12:59.256289,1035041081,https://www.amazon.co.uk/Match-Annual-2025-MATCH/dp/1035041081,https://images-eu.ssl-images-amazon.com/images/P/1035041081.01.L.jpg,1 in Children's Books on the Olympics | 1 in Football References | 2 in Soccer Coaching
5,The Most Incredible True Football Stories (You Never Knew): Winner of the Telegraph Children's Sports Book of the Year (Unbelievable Football),Matt Oldfield,5.43,Paperback,4.7,1885.0,1526362449,9781526362445,240,Sport and Outdoors,8-11,2025-01-22T20:12:59.259100,1526362449,https://www.amazon.co.uk/Unbelievable-Football-Incredible-Stories-Never/dp/1526362449,https://images-eu.ssl-images-amazon.com/images/P/1526362449.01.L.jpg,1 in Sports & Recreation Biographies for Children | 2 in Football References | 4 in Children & Young Adult Biographies
6,Official Liverpool FC Annual 2025,Grange,6.99,Hardcover,4.7,94.0,1915879884,9781915879882,64,Sport and Outdoors,,2025-01-22T20:12:59.263430,1915879884,https://www.amazon.co.uk/Official-Liverpool-FC-Annual-2025/dp/1915879884,https://images-eu.ssl-images-amazon.com/images/P/1915879884.01.L.jpg,1 in FC Liverpool | 1 in Books on Football for Young Adults | 3 in Football References
7,Skandar and the Chaos Trials: The INSTANT NUMBER ONE BESTSELLER in the biggest fantasy adventure series since Harry Potter (Volume 3),A.F. Steadman,7.0,Hardcover,4.7,940.0,1398502952,9781398502956,416,Sport and Outdoors,10-12,2025-01-22T20:12:59.267314,1398502952,https://www.amazon.co.uk/Skandar-3-F-Steadman/dp/1398502952,https://images-eu.ssl-images-amazon.com/images/P/1398502952.01.L.jpg,3 in Fiction About Parents for Young Adults | 4 in Fiction About Siblings for Young Adults | 4 in Fantasy & Supernatural Mysteries & Thrillers for Young Adults
8,"Skandar and the Unicorn Thief: The international, award-winning hit, and the biggest fantasy adventure series since Harry Potter (Volume 1)",A.F. Steadman,4.5,Paperback,4.7,1641.0,1398502731,9781398502734,400,Sport and Outdoors,9+,2025-01-22T20:12:59.270351,1398502731,https://www.amazon.co.uk/Skandar-Unicorn-Thief-major-fantasy/dp/1398502731,https://images-eu.ssl-images-amazon.com/images/P/1398502731.01.L.jpg,1 in Children's Books on Horses | 8 in Children's Books on Sports & the Outdoors | 10 in Science Fiction for Children
9,"Simone Biles (103) (Little People, BIG DREAMS)",Maria Isabel Sanchez Vegara,7.04,Hardcover,4.6,92.0,0711285780,9780711285781,32,Sport and Outdoors,4-7,2025-01-22T20:12:59.275076,0711285780,https://www.amazon.co.uk/Simone-Biles-Little-People-DREAMS/dp/0711285780,https://images-eu.ssl-images-amazon.com/images/P/0711285780.01.L.jpg,1 in Children's Books on Gymnastics | 1 in Athletics Biographies | 1 in Children's Books on Marriage & Divorce
10,The Academy: 1 (The Academy Series),T.Z. Layton,9.19,Paperback,4.8,1305.0,1955804087,9781955804080,306,Sport and Outdoors,9-11,2025-01-22T20:12:59.278107,1955804087,https://www.amazon.co.uk/Academy-T-Z-Layton/dp/1955804087,https://images-eu.ssl-images-amazon.com/images/P/1955804087.01.L.jpg,4 in Intermediate & Advanced Readers for Children | 4 in Children's Fiction on Maturing | 9 in Children's Books on Football
11,"The Breakfast Club Adventures: The Beast Beyond the Fence: 1 (The Breakfast Club Adventures, 1)",Marcus Rashford,4.0,Paperback,4.7,1323.0,1529076625,9781529076622,272,Sport and Outdoors,7-10,2025-01-22T20:12:59.281209,1529076625,https://www.amazon.co.uk/Breakfast-Club-Adventures-Beast-Beyond/dp/1529076625,https://images-eu.ssl-images-amazon.com/images/P/1529076625.01.L.jpg,7 in Children's Books on Football | 10 in Sports Humour | 21 in Children's Books on School
12,Football Colouring Book For Kids: Ages 4-8,The Future Teacher Foundation,3.99,Paperback,4.6,360.0,1090953607,9781090953605,64,Sport and Outdoors,5-7,2025-01-22T20:12:59.285999,1090953607,https://www.amazon.co.uk/Football-Colouring-Book-Kids-Ages/dp/1090953607,https://images-eu.ssl-images-amazon.com/images/P/1090953607.01.L.jpg,1 in Football Fans | 1 in Football Skills & Coaching | 2 in Premier League Football
13,Ultimate Football Heroes Colouring Book (The No.1 football series): Collect them all!,Ultimate Football Heroes,7.35,Paperback,4.6,305.0,1800784015,9781800784017,80,Sport and Outdoors,,2025-01-22T20:12:59.290394,1800784015,https://www.amazon.co.uk/Ultimate-Football-Heroes-Colouring-football/dp/1800784015,https://images-eu.ssl-images-amazon.com/images/P/1800784015.01.L.jpg,3 in FIFA | 13 in Children's Books on Football | 14 in Jokes & Riddles Humour
14,Ronaldo (Ultimate Football Heroes - the No. 1 football series): Collect them all!,Matt Oldfield Ltd,4.99,Paperback,4.7,1734.0,1786064057,9781786064059,192,Sport and Outdoors,8-12,2025-01-22T20:12:59.293312,1786064057,https://www.amazon.co.uk/Ronaldo-Ultimate-Football-Heroes-Collect/dp/1786064057,https://images-eu.ssl-images-amazon.com/images/P/1786064057.01.L.jpg,1 in South American Football | 2 in Football Biographies (Books) | 3 in Sports & Recreation Biographies for Children
15,"Skandar and the Unicorn Thief: The international, award-winning hit, and the biggest fantasy adventure series since Harry Potter",A.F. Steadman,0.99,Kindle Edition,4.7,1641.0,,,399,Sport and Outdoors,,2025-01-22T20:12:59.296395,B08JZH59QY,https://www.amazon.co.uk/Skandar-Unicorn-Thief-F-Steadman-ebook/dp/B08JZH59QY,https://images-eu.ssl-images-amazon.com/images/P/B08JZH59QY.01.L.jpg,1 in Children's Fantasy & Supernatural Mystery eBooks | 1 in Children's Action & Adventure Sci-Fi eBooks | 1 in Children's Mystery & Detective Adventure
16,Satisfying Patterns Colouring Book (Satisfying Patterns Colouring Books),ali,9.41,Paperback,4.4,348.0,,9798850162160,63,Sport and Outdoors,,2025-01-22T20:12:59.300183,B0C9S3G5JR,https://www.amazon.co.uk/Satisfying-Patterns-Colouring-Book-Books/dp/B0C9S3G5JR,https://images-eu.ssl-images-amazon.com/images/P/B0C9S3G5JR.01.L.jpg,16 in Children's Books on Sports & the Outdoors
17,Bellingham (Ultimate Football Heroes - The No.1 football series): Collect them all!,Matt & Tom Oldfield,6.41,Paperback,4.6,152.0,1789464943,9781789464948,176,Sport and Outdoors,7-12,2025-01-22T20:12:59.303814,1789464943,https://www.amazon.co.uk/Bellingham-Ultimate-Football-Heroes-football/dp/1789464943,https://images-eu.ssl-images-amazon.com/images/P/1789464943.01.L.jpg,4 in Sports & Recreation Biographies for Children | 5 in Football Biographies (Books) | 11 in Children's Books on Football
18,Where's the Footballer?: A Search-and-Find Book (Fun With Ladybird),Gary Panton,7.35,Paperback,4.5,32.0,0241687683,9780241687680,32,Sport and Outdoors,,2025-01-22T20:12:59.316907,0241687683,https://www.amazon.co.uk/Wheres-Footballer-Search-Find-Ladybird/dp/0241687683,https://images-eu.ssl-images-amazon.com/images/P/0241687683.01.L.jpg,12 in Children's Books on Football | 19 in Hidden Picture Books for Children | 67 in Children's Books on Games
19,Match of the Day Annual 2025,Match of the Day Magazine,7.99,Hardcover,4.7,73.0,1785948385,9781785948381,96,Sport and Outdoors,,2025-01-22T20:12:59.327122,1785948385,https://www.amazon.co.uk/Match-Day-Annual-2025-Magazine/dp/1785948385,https://images-eu.ssl-images-amazon.com/images/P/1785948385.01.L.jpg,2 in Books on Football for Young Adults | 2 in Children's Books on American Football | 4 in Football References
20,"Leo Messi (Little People, BIG DREAMS)",Maria Isabel Sanchez Vegara,9.19,Hardcover,4.9,225.0,0711290571,9780711290570,32,Sport and Outdoors,4-7,2025-01-22T20:12:59.329094,0711290571,https://www.amazon.co.uk/Leo-Messi-Little-People-DREAMS/dp/0711290571,https://images-eu.ssl-images-amazon.com/images/P/0711290571.01.L.jpg,2 in Exploring the United States for Children | 5 in Sports & Recreation Biographies for Children | 14 in Children's Books on Football
21,The Football School Encyclopedia: Everything you want to know about football,Alex Bellos,12.15,Hardcover,4.6,147.0,1529507588,9781529507584,144,Sport and Outdoors,7-10,2025-01-22T20:12:59.332034,1529507588,https://www.amazon.co.uk/Football-School-Encyclopedia-Everything-football/dp/1529507588,https://images-eu.ssl-images-amazon.com/images/P/1529507588.01.L.jpg,"1 in Sports, Hobby & Games Encyclopaedias | 2 in Humour Encyclopaedias | 3 in Children's Books on American Football"
22,You Are a Champion: How to Be the Best You Can Be,Marcus Rashford,5.0,Paperback,4.7,4982.0,1529068177,9781529068177,224,Sport and Outdoors,9-11,2025-01-22T20:12:59.335740,1529068177,https://www.amazon.co.uk/You-Are-Champion-How-Best/dp/1529068177,https://images-eu.ssl-images-amazon.com/images/P/1529068177.01.L.jpg,16 in Children's Books on Football | 45 in Children's Books on Emotions & Feelings | 74 in Children's Books on Self-Esteem & Self-Respect
23,Worst Week Ever! Saturday (Volume 6),Eva Amores,6.43,Paperback,4.5,43.0,1398522031,9781398522039,192,Sport and Outdoors,,2025-01-22T20:12:59.346132,1398522031,https://www.amazon.co.uk/Worst-Week-Ever-Saturday-6/dp/1398522031,https://images-eu.ssl-images-amazon.com/images/P/1398522031.01.L.jpg,3 in Exploring Australia & Oceania for Children | 17 in Horror Graphic Novels (Books) | 23 in Children's Books on Sports & the Outdoors
24,Football Activity Book For Kids: The Ultimate Football Themed Workbook For Kids Aged 4-8 | 6-12: The Perfect Football Gift For Football Mad Kids | ... Of Football Fun | Ideal For Travel Journeys,Activity Bandits,5.99,Paperback,4.6,118.0,,9798836514228,94,Sport and Outdoors,,2025-01-22T20:12:59.348886,B0B3RQRPSF,https://www.amazon.co.uk/Football-Activity-Book-Kids-Ultimate/dp/B0B3RQRPSF,https://images-eu.ssl-images-amazon.com/images/P/B0B3RQRPSF.01.L.jpg,4 in Premier League Football | 7 in Books of Mazes for Children | 22 in Children's Books on Football
25,Ultimate Football Heroes Colouring Book: Revised & Updated Euro 2024 Edition,Ultimate Football Heroes,7.35,Paperback,4.5,45.0,1835870406,9781835870402,80,Sport and Outdoors,,2025-01-22T20:12:59.351912,1835870406,https://www.amazon.co.uk/Ultimate-Football-Heroes-Colouring-Book/dp/1835870406,https://images-eu.ssl-images-amazon.com/images/P/1835870406.01.L.jpg,16 in Children's Books on Football | 61 in Colouring Books for Children | 677 in Literature & Fiction for Children (Books)
26,"Football Superstars 12 Books Collection Rules Mega Pack Set By Simon Mugford & Dan Green(Fact,Stories & Starts)(Rolando, Neymar, Messi, Kane, Mbappé, Rashford, Haaland, Salah, De Bruyne & More)",Simon Mugford,26.45,Paperback,4.7,56.0,1804535974,9781804535974,1536,Sport and Outdoors,,2025-01-22T20:12:59.368212,1804535974,https://www.amazon.co.uk/Football-Superstars-Collection-Mugford-Rashford/dp/1804535974,https://images-eu.ssl-images-amazon.com/images/P/1804535974.01.L.jpg,19 in Children's Books on Football
