rank,title,author,price,format,rating,review_count,isbn10,isbn13,page_count,category,target_age_range,timestamp,asin,product_url,image_url,category_ranks
28,Dog Man and Cat Kid: From the Creator of Captain Underpants (Dog Man #4),Dav Pilkey,9.19,Paperback,4.8,22451.0,1407192124,9781407192123,256,Comics and Graphic Novels,7-10,2025-01-22T20:13:02.152599,1407192124,https://www.amazon.co.uk/Dog-Man-Cat-Kid/dp/1407192124,https://images-eu.ssl-images-amazon.com/images/P/1407192124.01.L.jpg,9 in Children's Comics & Graphic Novels on Social & Philosophical Topics | 10 in Children's Mystery & Detective Comics & Graphic Novels | 10 in Superhero Comics for Children
29,Pokémon Where’s Pikachu? A search & find book: New for 2023: Search and find the perfect gift for fans of Pokémon in this official Pikachu adventure!,Pokemon,6.99,Paperback,4.7,458.0,0008547599,9780008547592,40,Comics and Graphic Novels,4-8,2025-01-22T20:13:02.156384,0008547599,https://www.amazon.co.uk/Pok%C3%A9mon-Wheres-Pikachu-search-find/dp/0008547599,https://images-eu.ssl-images-amazon.com/images/P/0008547599.01.L.jpg,1 in Comics with Media Tie-Ins for Children | 2 in Children's Books on the History of Exploration & Discovery | 3 in Children's Interactive Adventures
30,Dog Man: Grime and Punishment: from the bestselling creator of Captain Underpants (Dog Man #9),Dav Pilkey,8.27,Paperback,4.8,47298.0,0702310670,9780702310676,240,Comics and Graphic Novels,8-10,2025-01-22T20:13:02.159980,0702310670,https://www.amazon.co.uk/Dog-Man-Punishment-bestselling-Underpants/dp/0702310670,https://images-eu.ssl-images-amazon.com/images/P/0702310670.01.L.jpg,10 in Children's Comics & Graphic Novels on Social & Philosophical Topics | 11 in Children's Mystery & Detective Comics & Graphic Novels | 11 in Superhero Comics for Children
1,Jonty Gentoo: The Adventures of a Penguin The Number One Bestseller by the creators of Stick Man and Zog,Julia Donaldson,6.49,Hardcover,4.8,362.0,0702329436,9780702329432,40,"Science, Nature & How It Works",3-6,2025-01-22T20:13:03.446953,0702329436,https://www.amazon.co.uk/Jonty-Gentoo-Adventures-Julia-Donaldson/dp/0702329436,https://images-eu.ssl-images-amazon.com/images/P/0702329436.01.L.jpg,"1 in Early Reader's Rhymes, Verse & Wordplay for Children | 1 in Children's Books on Birds | 1 in Children's Books on Nature"
2,The Great Race: The Story of the Chinese Zodiac,Emily Hiles,7.23,Paperback,4.5,485.0,1983565180,9781983565182,34,"Science, Nature & How It Works",3-5,2025-01-22T20:13:03.456806,1983565180,https://www.amazon.co.uk/Great-Race-Story-Chinese-Zodiac/dp/1983565180,https://images-eu.ssl-images-amazon.com/images/P/1983565180.01.L.jpg,1 in Children's Books on Time & the Seasons | 1 in Children's Early Learning Books on Time | 1 in Children's Books on Asian History
3,"Busy Chinese New Year: A Push, Pull, Slide Book: the perfect gift to celebrate the Year of the Snake with your toddler! (Campbell Busy Books, 33)",Campbell Books,6.43,Board book,4.8,242.0,1035012855,9781035012855,10,"Science, Nature & How It Works",2-5,2025-01-22T20:13:03.463444,1035012855,https://www.amazon.co.uk/Busy-Chinese-Year-Campbell-Books/dp/1035012855,https://images-eu.ssl-images-amazon.com/images/P/1035012855.01.L.jpg,"1 in Asian Tales & Myths for Children | 1 in Dragons, Unicorns & Mythical Creatures Tales for Children | 1 in Children's Books on Mystery & Wonders"
4,Zog,Julia Donaldson,4.0,Paperback,4.9,11091.0,,9781407170763,32,"Science, Nature & How It Works",2-5,2025-01-22T20:13:03.466756,1407170767,https://www.amazon.co.uk/Zog-Julia-Donaldson/dp/1407170767,https://images-eu.ssl-images-amazon.com/images/P/1407170767.01.L.jpg,"1 in Children's Books on Royalty | 2 in Dragons, Unicorns & Mythical Creatures Tales for Children | 2 in Travel Fiction for Children"
5,"The Baddies: the wickedly funny picture book from the creators of Zog and Stick Man, now available in paperback!",Julia Donaldson,4.0,Paperback,4.7,2125.0,0702325066,9780702325069,32,"Science, Nature & How It Works",3-6,2025-01-22T20:13:03.473996,0702325066,https://www.amazon.co.uk/Baddies-wickedly-creators-available-paperback/dp/0702325066,https://images-eu.ssl-images-amazon.com/images/P/0702325066.01.L.jpg,"1 in Horror & Ghost Stories for Children | 3 in Children's Books on Mystery & Wonders | 4 in Fairy Tales, Folk Tales & Myths for Children (Books)"
6,Klutz: Lego Chain Reactions: Design and Build Amazing Moving Machines,Pat Murphy,12.99,Spiral-bound,4.5,22604.0,0545703301,9780281079544,48,"Science, Nature & How It Works",8-12,2025-01-22T20:13:03.481331,0545703301,https://www.amazon.co.uk/Lego-Chain-Reactions-Klutz-Murphy/dp/0545703301,https://images-eu.ssl-images-amazon.com/images/P/0545703301.01.L.jpg,"1 in Children's Books on Cars, Trains & Things That Go | 1 in Children's Books on Question & Answer Games | 1 in Children's Books on Crafts & Hobbies"
7,Superworm,Julia Donaldson,4.0,Paperback,4.8,8410.0,,9781407170725,32,"Science, Nature & How It Works",2-5,2025-01-22T20:13:03.484399,1407170724,https://www.amazon.co.uk/Superworm-Julia-Donaldson/dp/1407170724,https://images-eu.ssl-images-amazon.com/images/P/1407170724.01.L.jpg,2 in Children's Books on Performing Arts | 2 in Fantasy Adventure for Children | 3 in Children's Books on Nature
8,"Bunny vs Monkey: Bunny Bonanza (a Phoenix Comic Book, from the million-selling Jamie Smart, Illustrator of the Year): A Rollicking Rabbit Rumble",Jamie Smart,4.99,Paperback,4.8,454.0,1788453077,9781788453073,240,"Science, Nature & How It Works",7-10,2025-01-22T20:13:03.489254,1788453077,https://www.amazon.co.uk/Bunny-Monkey-million-selling-Illustrator-Rollicking/dp/1788453077,https://images-eu.ssl-images-amazon.com/images/P/1788453077.01.L.jpg,"5 in Children's Animal Comics & Graphic Novels | 7 in Children's Humorous Comics & Graphic Novels | 8 in Children's Books on Science, Nature & How It Works"
9,Paddington’s Suitcase: Eight funny Paddington Bear picture books for children in a gift-set carry case!,Michael Bond,10.0,Paperback,4.8,3255.0,0007251947,9780007251940,192,"Science, Nature & How It Works",2-5,2025-01-22T20:13:03.491994,0007251947,https://www.amazon.co.uk/Paddington-Suitcase-Eight-book-Bear/dp/0007251947,https://images-eu.ssl-images-amazon.com/images/P/0007251947.01.L.jpg,1 in Children's Books on Bears | 1 in Children's Books on Emigrants & Immigrants | 1 in Short Story Collections for Children
10,Zog and the Flying Doctors,Julia Donaldson,4.0,Paperback,4.9,9371.0,1407173502,9781407173504,32,"Science, Nature & How It Works",2-4,2025-01-22T20:13:03.495316,1407173502,https://www.amazon.co.uk/Zog-Flying-Doctors-Julia-Donaldson/dp/1407173502,https://images-eu.ssl-images-amazon.com/images/P/1407173502.01.L.jpg,1 in Children's Early Learning Books on Sense & Sensation | 2 in Children's Books on Jobs & Careers | 3 in Children's Books on Royalty
11,"Frog's Day Out: A Lift-the-flap Story (Tales From Acorn Wood, 10)",Julia Donaldson,4.0,Board book,4.8,229.0,103500688X,9781035006885,12,"Science, Nature & How It Works",2-3,2025-01-22T20:13:03.498342,103500688X,https://www.amazon.co.uk/Frogs-Day-Out-Lift-flap/dp/103500688X,https://images-eu.ssl-images-amazon.com/images/P/103500688X.01.L.jpg,1 in Children's Books on Frogs & Toads | 1 in Children's Books on Reptiles & Amphibians | 5 in Children's Books on Nature
12,"The Gruffalo (The Gruffalo, 1)",Julia Donaldson,6.49,Board book,4.9,16958.0,,9781509830398,24,"Science, Nature & How It Works",2-4,2025-01-22T20:13:03.505164,1509830391,https://www.amazon.co.uk/Gruffalo-Julia-Donaldson/dp/1509830391,https://images-eu.ssl-images-amazon.com/images/P/1509830391.01.L.jpg,"2 in Horror & Ghost Stories for Children | 4 in Dragons, Unicorns & Mythical Creatures Tales for Children | 5 in Children's Books on Mystery & Wonders"
13,"100% Unofficial Roblox Annual 2025: Brand new gaming annual for 2025 – the perfect companion for kids who love gaming and want to discover tricks, tips, guide and more!",Farshore,2.99,Hardcover,4.7,132.0,0008616957,9780008616953,72,"Science, Nature & How It Works",6-10,2025-01-22T20:13:03.510096,0008616957,https://www.amazon.co.uk/100-Unofficial-Roblox-Annual-2025/dp/0008616957,https://images-eu.ssl-images-amazon.com/images/P/0008616957.01.L.jpg,1 in Children's Books on Computer Programming | 1 in Children's Books on Video & Electronic Games | 1 in Children's Books on Computer Entertainment & Games
14,Bluey,Bluey,1.0,Paperback,,,0241734401,9780241734407,16,"Science, Nature & How It Works",3-6,2025-01-22T20:13:03.515089,0241734401,https://www.amazon.co.uk/Bluey-Blueys-Little-Book-World/dp/0241734401,https://images-eu.ssl-images-amazon.com/images/P/0241734401.01.L.jpg,"3 in TV, Movie & Video Game Adaptations for Children | 6 in Children's Books on Nature | 8 in Children's Books on Dogs"
15,"The Oak Tree: a dazzling, poetic picture book, by Julia Donaldson, author of The Gruffalo and Stick Man",Julia Donaldson,4.0,Paperback,4.7,430.0,0702324353,9780702324352,32,"Science, Nature & How It Works",3-6,2025-01-22T20:13:03.518175,0702324353,https://www.amazon.co.uk/Oak-Tree-dazzling-Donaldson-Gruffalo/dp/0702324353,https://images-eu.ssl-images-amazon.com/images/P/0702324353.01.L.jpg,1 in Birdwatching (Books) | 1 in Children's Books on Forests & Trees | 2 in Wild Mammals
16,Julia Donaldson,,1.0,Paperback,,,1035059223,9781035059225,16,"Science, Nature & How It Works",3-7,2025-01-22T20:13:03.530578,1035059223,https://www.amazon.co.uk/Tales-Acorn-Wood-search-find/dp/1035059223,https://images-eu.ssl-images-amazon.com/images/P/1035059223.01.L.jpg,
17,The Last Bear: Winner of the Blue Peter Award – ‘A dazzling debut’ THE TIMES,Hannah Gold,4.5,Paperback,4.7,2623.0,000841131X,9780008411312,320,"Science, Nature & How It Works",8+,2025-01-22T20:13:03.539003,000841131X,https://www.amazon.co.uk/Last-Bear-stunning-childrens-battle/dp/000841131X,https://images-eu.ssl-images-amazon.com/images/P/000841131X.01.L.jpg,1 in Exploring Polar Regions for Children | 1 in Children's Books on Recycling & Green Living | 3 in Children's Books on Bears
18,"There's a Dinosaur in Your Book: An interactive board book for toddlers: 9 (Who's in Your Book?, 9)",Tom Fletcher,4.0,Paperback,4.8,585.0,0241591317,9780241591314,32,"Science, Nature & How It Works",2-4,2025-01-22T20:13:03.546988,0241591317,https://www.amazon.co.uk/Theres-Dinosaur-Your-Book-Whos/dp/0241591317,https://images-eu.ssl-images-amazon.com/images/P/0241591317.01.L.jpg,1 in Children's Books on Dinosaurs | 2 in Children's Books on Social Skills | 2 in Children's Books on Manners
19,Sticker Dolly Dressing Pets,,4.0,Paperback,4.8,60.0,1805316907,9781805316909,44,"Science, Nature & How It Works",5-8,2025-01-22T20:13:03.552285,1805316907,https://www.amazon.co.uk/Sticker-Dolly-Dressing-Pets-Fiona/dp/1805316907,https://images-eu.ssl-images-amazon.com/images/P/1805316907.01.L.jpg,
20,"In the Jungle: A Push, Pull, Slide Book (Campbell Axel Scheffler, 6)",,6.03,Board book,4.7,2158.0,1509866957,9781509866953,10,"Science, Nature & How It Works",1-2,2025-01-22T20:13:03.559752,1509866957,https://www.amazon.co.uk/Axel-Scheffler-Jungle/dp/1509866957,https://images-eu.ssl-images-amazon.com/images/P/1509866957.01.L.jpg,
21,That's not my dog...,Fiona Watt,4.0,Board book,4.8,203.0,1805312235,9781805312239,10,"Science, Nature & How It Works",,2025-01-22T20:13:03.562630,1805312235,https://www.amazon.co.uk/Thats-not-dog-Fiona-Watt/dp/1805312235,https://images-eu.ssl-images-amazon.com/images/P/1805312235.01.L.jpg,3 in Children's Books on Pets | 9 in Children's Books on Dogs | 9 in Animal Sciences
22,"Weird but true! 2025: Discover weird, unbelievable facts and world records in this popular annual for the whole family (National Geographic Kids)",National Geographic Kids,12.8,Hardcover,4.7,199.0,0008694125,9780008694128,256,"Science, Nature & How It Works",6-10,2025-01-22T20:13:03.590598,0008694125,https://www.amazon.co.uk/Weird-but-true-2025-Geographic/dp/0008694125,https://images-eu.ssl-images-amazon.com/images/P/0008694125.01.L.jpg,1 in Humour Collections & Anthologies | 1 in Amazing Facts | 2 in Sports Humour
23,Minecraft Catch the Creeper and Other Mobs: Search for your favourite mobs in this official Minecraft Search and Find book! Perfect for kids into video games.,Mojang AB,7.35,Paperback,4.7,2673.0,0755503570,9780755503575,40,"Science, Nature & How It Works",5-9,2025-01-22T20:13:03.594128,0755503570,https://www.amazon.co.uk/Minecraft-Catch-Creeper-Other-Mobs/dp/0755503570,https://images-eu.ssl-images-amazon.com/images/P/0755503570.01.L.jpg,
24,Disney Stitch: The Ultimate Colouring Book,Walt Disney,4.99,Paperback,4.6,346.0,1837950326,9781837950324,72,"Science, Nature & How It Works",6-9,2025-01-22T20:13:03.616732,1837950326,https://www.amazon.co.uk/Disney-Stitch-Ultimate-Colouring-Book/dp/1837950326,https://images-eu.ssl-images-amazon.com/images/P/1837950326.01.L.jpg,
25,"Bunny vs Monkey (a Phoenix Comic Book, from the million-selling Jamie Smart, Illustrator of the Year)",Jamie Smart,6.0,Paperback,4.8,1099.0,1788451775,9781788451772,256,"Science, Nature & How It Works",8-9,2025-01-22T20:13:03.647771,1788451775,https://www.amazon.co.uk/Bunny-vs-Monkey-Jamie-Smart/dp/1788451775,https://images-eu.ssl-images-amazon.com/images/P/1788451775.01.L.jpg,
26,From the Wizarding Archive: Curated Writing from the World of Harry Potter,,17.99,Audible Audiobook,4.4,225.0,,,,"Science, Nature & How It Works",,2025-01-22T20:13:03.668735,B0D8WJ56XZ,https://www.amazon.co.uk/Wizarding-Archive-Curated-Writing-Potter/dp/B0D8WJ56XZ,https://images-eu.ssl-images-amazon.com/images/P/B0D8WJ56XZ.01.L.jpg,
27,LEGO Race Cars: 5 (Klutz),,15.17,Toy,4.3,1255.0,1338802062,9781338802061,64,"Science, Nature & How It Works",5-7,2025-01-22T20:13:03.672717,1338802062,https://www.amazon.co.uk/LEGO-Race-Cars-Klutz-Editors/dp/1338802062,https://images-eu.ssl-images-amazon.com/images/P/1338802062.01.L.jpg,
28,There’s a Snake in My School!: The spectacularly funny illustrated children’s book from number-one bestelling author David Walliams!,David Walliams,5.0,Paperback,4.8,5497.0,,9780008172718,32,"Science, Nature & How It Works",4-6,2025-01-22T20:13:03.680455,0008172714,https://www.amazon.co.uk/THERES-SNAKE-SCHOOL-spectacularly-illustrated/dp/0008172714,https://images-eu.ssl-images-amazon.com/images/P/0008172714.01.L.jpg,
29,Bluey: Bluey and Friends Little Library,Bluey,5.51,Board book,4.6,575.0,0241605040,9780241605042,48,"Science, Nature & How It Works",1-3,2025-01-22T20:13:03.686871,0241605040,https://www.amazon.co.uk/Bluey-Friends-Little-Library/dp/0241605040,https://images-eu.ssl-images-amazon.com/images/P/0241605040.01.L.jpg,
30,Big Book of Colouring: Animals: For Children Ages 4+ (Big Books of Colouring (Ages 4+)),FairyWren Publishing,5.85,Paperback,4.6,141.0,191545428X,9781915454287,127,"Science, Nature & How It Works",3-8,2025-01-22T20:13:03.689941,191545428X,https://www.amazon.co.uk/Big-Book-Colouring-Animals-Children/dp/191545428X,https://images-eu.ssl-images-amazon.com/images/P/191545428X.01.L.jpg,
1,Peppa Pig: Chinese New Year,Peppa Pig,5.51,Board book,4.7,1182.0,0241359872,9780241359877,16,"TV, Movie & Video Game Adaptations",2-4,2025-01-22T20:13:05.167471,0241359872,https://www.amazon.co.uk/Peppa-Pig-Chinese-New-Year/dp/0241359872,https://images-eu.ssl-images-amazon.com/images/P/0241359872.01.L.jpg,
2,Bluey: Where's Bluey?: A Search-and-Find Book,Bluey,6.79,Paperback,4.8,3240.0,0241558573,9780241558577,32,"TV, Movie & Video Game Adaptations",2-5,2025-01-22T20:13:05.173558,0241558573,https://www.amazon.co.uk/Bluey-Wheres-Search-Find-Book/dp/0241558573,https://images-eu.ssl-images-amazon.com/images/P/0241558573.01.L.jpg,
3,Bluey,Bluey,1.0,Paperback,,,0241734401,9780241734407,16,"TV, Movie & Video Game Adaptations",3-6,2025-01-22T20:13:05.180613,0241734401,https://www.amazon.co.uk/Bluey-Blueys-Little-Book-World/dp/0241734401,https://images-eu.ssl-images-amazon.com/images/P/0241734401.01.L.jpg,
4,Nickelodeon Publishing,,,Kindle Edition,4.7,963.0,,,14,"TV, Movie & Video Game Adaptations",,2025-01-22T20:13:05.185425,B073R342DW,https://www.amazon.co.uk/Save-School-Bus-PAW-Patrol-ebook/dp/B073R342DW,https://images-eu.ssl-images-amazon.com/images/P/B073R342DW.01.L.jpg,
5,Minecraft Catch the Creeper and Other Mobs: Search for your favourite mobs in this official Minecraft Search and Find book! Perfect for kids into video games.,Mojang AB,7.35,Paperback,4.7,2673.0,0755503570,9780755503575,40,"TV, Movie & Video Game Adaptations",5-9,2025-01-22T20:13:05.189882,0755503570,https://www.amazon.co.uk/Minecraft-Catch-Creeper-Other-Mobs/dp/0755503570,https://images-eu.ssl-images-amazon.com/images/P/0755503570.01.L.jpg,
6,Disney Stitch: The Ultimate Colouring Book,Walt Disney,4.99,Paperback,4.6,346.0,1837950326,9781837950324,72,"TV, Movie & Video Game Adaptations",6-9,2025-01-22T20:13:05.193117,1837950326,https://www.amazon.co.uk/Disney-Stitch-Ultimate-Colouring-Book/dp/1837950326,https://images-eu.ssl-images-amazon.com/images/P/1837950326.01.L.jpg,
7,Bluey: Bluey and Friends Little Library,Bluey,5.51,Board book,4.6,575.0,0241605040,9780241605042,48,"TV, Movie & Video Game Adaptations",1-3,2025-01-22T20:13:05.195654,0241605040,https://www.amazon.co.uk/Bluey-Friends-Little-Library/dp/0241605040,https://images-eu.ssl-images-amazon.com/images/P/0241605040.01.L.jpg,
8,Disneyland Parks Colouring Book,Igloo Books,4.0,Paperback,4.7,4065.0,1838523650,9781838523657,96,"TV, Movie & Video Game Adaptations",5+,2025-01-22T20:13:05.199437,1838523650,https://www.amazon.co.uk/Disneyland-Parks-Colouring-Igloo-Books/dp/1838523650,https://images-eu.ssl-images-amazon.com/images/P/1838523650.01.L.jpg,
9,Pokémon Where’s Pikachu? A search & find book: New for 2023: Search and find the perfect gift for fans of Pokémon in this official Pikachu adventure!,Pokemon,6.99,Paperback,4.7,458.0,0008547599,9780008547592,40,"TV, Movie & Video Game Adaptations",4-8,2025-01-22T20:13:05.204332,0008547599,https://www.amazon.co.uk/Pok%C3%A9mon-Wheres-Pikachu-search-find/dp/0008547599,https://images-eu.ssl-images-amazon.com/images/P/0008547599.01.L.jpg,
10,Marvel Spider-Man: Giant Colour-Me Pad,Marvel Entertainment International Ltd,5.0,Paperback,4.8,222.0,1801082448,9781801082440,64,"TV, Movie & Video Game Adaptations",4-6,2025-01-22T20:13:05.207250,1801082448,https://www.amazon.co.uk/Marvel-Spider-Man-Giant-Colour-Pad/dp/1801082448,https://images-eu.ssl-images-amazon.com/images/P/1801082448.01.L.jpg,
11,Wicked: I Am Glinda,,4.5,Hardcover,5.0,3.0,1408362295,9781408362297,24,"TV, Movie & Video Game Adaptations",,2025-01-22T20:13:05.212194,1408362295,https://www.amazon.co.uk/Wicked-Am-Glinda-Mary-Man-Kong/dp/1408362295,https://images-eu.ssl-images-amazon.com/images/P/1408362295.01.L.jpg,
12,Wicked: I Am Elphaba,Mary Man-Kong,4.5,Hardcover,4.6,7.0,1408354438,9781408354438,24,"TV, Movie & Video Game Adaptations",,2025-01-22T20:13:05.217998,1408354438,https://www.amazon.co.uk/Wicked-Am-Elphaba-Mary-Man-Kong/dp/1408354438,https://images-eu.ssl-images-amazon.com/images/P/1408354438.01.L.jpg,
13,Ms Rachel: Ms Rachel and the Special Surprise: Encouraging Speech and Learning Through Play and Music,Ms Rachel,4.5,Paperback,4.7,36.0,0241760607,9780241760604,40,"TV, Movie & Video Game Adaptations",,2025-01-22T20:13:05.222803,0241760607,https://www.amazon.co.uk/Ms-Rachel-Surprise-Encouraging-Learning/dp/0241760607,https://images-eu.ssl-images-amazon.com/images/P/0241760607.01.L.jpg,
14,Peppa Pig: Little Library,,3.75,Board book,4.7,25430.0,,9781409303183,60,"TV, Movie & Video Game Adaptations",1-3,2025-01-22T20:13:05.226997,1409303187,https://www.amazon.co.uk/Peppa-Pig-Little-Library-Ladybird/dp/1409303187,https://images-eu.ssl-images-amazon.com/images/P/1409303187.01.L.jpg,
15,Disney Princess: Simply Colouring (Over 30 pages to colour in),Igloo Books,3.99,Paperback,4.5,375.0,1800220294,9781800220294,32,"TV, Movie & Video Game Adaptations",4-6,2025-01-22T20:13:05.229993,1800220294,https://www.amazon.co.uk/Disney-Princess-Colouring-Igloo-Books/dp/1800220294,https://images-eu.ssl-images-amazon.com/images/P/1800220294.01.L.jpg,
16,The Adventures of Paddington – The Wrong List,,2.99,Kindle Edition,4.9,231.0,,,,"TV, Movie & Video Game Adaptations",,2025-01-22T20:13:05.242620,B082DRYBGN,https://www.amazon.co.uk/Adventures-Paddington-Wrong-List-TV-ebook/dp/B082DRYBGN,https://images-eu.ssl-images-amazon.com/images/P/B082DRYBGN.01.L.jpg,
17,Shrek 2: The Movie Storybook,,2.55,Kindle Edition,3.9,67.0,,,56,"TV, Movie & Video Game Adaptations",,2025-01-22T20:13:05.251194,B009093GXU,https://www.amazon.co.uk/Shrek-2-Movie-Storybook-zuuka-ebook/dp/B009093GXU,https://images-eu.ssl-images-amazon.com/images/P/B009093GXU.01.L.jpg,
18,Disney Princess: A Treasury of Magical Stories (Deluxe Treasury),Walt Disney,9.0,Hardcover,4.8,202.0,1800222084,9781800222083,194,"TV, Movie & Video Game Adaptations",3-6,2025-01-22T20:13:05.259394,1800222084,https://www.amazon.co.uk/Disney-Princess-Treasury-Magical-Stories/dp/1800222084,https://images-eu.ssl-images-amazon.com/images/P/1800222084.01.L.jpg,
19,Marvel Avengers: The Ultimate Colouring Book,,4.99,Paperback,4.7,604.0,1801081549,9781801081542,72,"TV, Movie & Video Game Adaptations",4-8,2025-01-22T20:13:05.263614,1801081549,https://www.amazon.co.uk/Marvel-Avengers-Ultimate-Colouring-Book/dp/1801081549,https://images-eu.ssl-images-amazon.com/images/P/1801081549.01.L.jpg,
21,Bluey: Let's Stick!: Sticker Scenes Book,,6.43,Paperback,4.7,640.0,0241551951,9780241551950,24,"TV, Movie & Video Game Adaptations",3-4,2025-01-22T20:13:05.273084,0241551951,https://www.amazon.co.uk/Bluey-Lets-Stick-Sticker-Scenes/dp/0241551951,https://images-eu.ssl-images-amazon.com/images/P/0241551951.01.L.jpg,
22,Numberblocks: Countdown to Bed (A Numberblocks Storybook Perfect for Bedtimes Ages 3-6),Numberblocks,6.99,Paperback,4.8,81.0,1802632522,9781802632521,32,"TV, Movie & Video Game Adaptations",3-6,2025-01-22T20:13:05.276160,1802632522,https://www.amazon.co.uk/Numberblocks-Countdown-Bed/dp/1802632522,https://images-eu.ssl-images-amazon.com/images/P/1802632522.01.L.jpg,
23,"Numberblocks Annual 2025 - Kids Activity Book, Maths Puzzles & Games for Preschool Ages 3-6 Years (Numberblocks Annuals)",,8.15,Hardcover,4.7,67.0,1802630805,9781802630800,72,"TV, Movie & Video Game Adaptations",3-5,2025-01-22T20:13:05.280574,1802630805,https://www.amazon.co.uk/Numberblocks-Annual-2025-Annuals/dp/1802630805,https://images-eu.ssl-images-amazon.com/images/P/1802630805.01.L.jpg,
24,Dino Racing (Hot Wheels),Ace Landers,4.02,Kindle Edition,4.2,96.0,,,18,"TV, Movie & Video Game Adaptations",,2025-01-22T20:13:05.284137,B071G3N6KX,https://www.amazon.co.uk/Dino-Racing-Hot-Wheels-Landers-ebook/dp/B071G3N6KX,https://images-eu.ssl-images-amazon.com/images/P/B071G3N6KX.01.L.jpg,
25,HarperCollins Children’s Books,HarperCollins Children’s Books,5.0,Board book,,,0008621691,9780008621698,10,"TV, Movie & Video Game Adaptations",1-5,2025-01-22T20:13:05.288794,0008621691,https://www.amazon.co.uk/Paddingtons-New-Friend-touch-feel/dp/0008621691,https://images-eu.ssl-images-amazon.com/images/P/0008621691.01.L.jpg,
26,Teletubbies: Pocket Library: A colourful collection of board book favourites for toddlers aged 1-3,,5.51,Hardcover,4.7,2518.0,1405281138,9781405281133,60,"TV, Movie & Video Game Adaptations",1-2,2025-01-22T20:13:05.293379,1405281138,https://www.amazon.co.uk/Teletubbies-Library-Egmont-Publishing-UK/dp/1405281138,https://images-eu.ssl-images-amazon.com/images/P/1405281138.01.L.jpg,
27,The Ultimate Sonic Prime Coloring Book (Sonic the Hedgehog),Patrick Spaziante,5.49,Paperback,4.6,327.0,0593750489,9780593750483,64,"TV, Movie & Video Game Adaptations",4-6,2025-01-22T20:13:05.297647,0593750489,https://www.amazon.co.uk/Ultimate-Sonic-Prime-Coloring-Hedgehog/dp/0593750489,https://images-eu.ssl-images-amazon.com/images/P/0593750489.01.L.jpg,
28,Disney: Bedtime Stories (Treasury of Classic Tales),Walt Disney,10.0,Hardcover,4.7,18.0,1837959080,9781837959082,384,"TV, Movie & Video Game Adaptations",6-10,2025-01-22T20:13:05.300887,1837959080,https://www.amazon.co.uk/Disney-Bedtime-Stories-Treasury-Classic/dp/1837959080,https://images-eu.ssl-images-amazon.com/images/P/1837959080.01.L.jpg,
29,Doctor Who: Annual 2025,Doctor Who,2.99,Hardcover,4.8,102.0,1405965282,9781405965286,64,"TV, Movie & Video Game Adaptations",8-12,2025-01-22T20:13:05.304561,1405965282,https://www.amazon.co.uk/Doctor-Who-Annual-2025/dp/1405965282,https://images-eu.ssl-images-amazon.com/images/P/1405965282.01.L.jpg,
30,Disney Frozen 2 The Ultimate Colouring Book (Mammoth Colouring Disney),Igloo Books,4.99,Paperback,4.7,2876.0,1789055512,9781789055511,72,"TV, Movie & Video Game Adaptations",3-6,2025-01-22T20:13:05.307660,1789055512,https://www.amazon.co.uk/Disney-Frozen-Ultimate-Colouring-Mammoth/dp/1789055512,https://images-eu.ssl-images-amazon.com/images/P/1789055512.01.L.jpg,
1,The Very Hungry Caterpillar [Board Book]: Eric Carle,Eric Carle,4.0,Board book,4.8,92709.0,0241003008,9780241003008,24,Educational Books,1-3,2025-01-22T20:13:06.983828,0241003008,https://www.amazon.co.uk/Very-Hungry-Caterpillar-Board-Book/dp/0241003008,https://images-eu.ssl-images-amazon.com/images/P/0241003008.01.L.jpg,
2,Jonty Gentoo: The Adventures of a Penguin The Number One Bestseller by the creators of Stick Man and Zog,Julia Donaldson,6.49,Hardcover,4.8,362.0,0702329436,9780702329432,40,Educational Books,3-6,2025-01-22T20:13:06.987392,0702329436,https://www.amazon.co.uk/Jonty-Gentoo-Adventures-Julia-Donaldson/dp/0702329436,https://images-eu.ssl-images-amazon.com/images/P/0702329436.01.L.jpg,
3,Guinness World Records 2025,Guinness World Records,8.0,Hardcover,4.8,1075.0,1913484556,9781913484552,256,Educational Books,,2025-01-22T20:13:06.993645,1913484556,https://www.amazon.co.uk/Guinness-World-Records-2025/dp/1913484556,https://images-eu.ssl-images-amazon.com/images/P/1913484556.01.L.jpg,
