rank,title,author,price,format,rating,review_count,isbn10,isbn13,page_count,category,target_age_range,timestamp,asin,product_url,image_url,category_ranks
30,Pokémon Where’s Pikachu? A search & find book: New for 2023: Search and find the perfect gift for fans of Pokémon in this official Pikachu adventure!,Pokemon,6.99,Paperback,4.7,465.0,0008547599,9780008547592,40,Comics and Graphic Novels,4-8,2025-02-14T09:19:14.591571,0008547599,https://www.amazon.co.uk/Pok%C3%A9mon-Wheres-Pikachu-search-find/dp/0008547599,https://images-eu.ssl-images-amazon.com/images/P/0008547599.01.L.jpg,1 in Comics with Media Tie-Ins for Children | 2 in Children's Books on the History of Exploration & Discovery | 3 in Children's Books on Video & Electronic Games
1,"Tales from Acorn Wood: Who's in Acorn Wood? World Book Day 2025: A rhyming search-and-find story (Tales From Acorn Wood, 12)",Julia Donaldson,1.0,Paperback,3.0,1.0,1035059223,9781035059225,16,"Science, Nature & How It Works",3-7,2025-02-14T09:19:15.693620,1035059223,https://www.amazon.co.uk/Tales-Acorn-Wood-search-find/dp/1035059223,https://images-eu.ssl-images-amazon.com/images/P/1035059223.01.L.jpg,1 in Hidden Picture Books for Children | 1 in Children's Fiction Books on Animals | 1 in Stories in Verse for Children (Books)
2,Bluey: Bluey's Little Book: A World Book Day 2025 MINI BOOK,Bluey,1.0,Paperback,2.0,2.0,0241734401,9780241734407,16,"Science, Nature & How It Works",3-6,2025-02-14T09:19:15.695250,0241734401,https://www.amazon.co.uk/Bluey-Blueys-Little-Book-World/dp/0241734401,https://images-eu.ssl-images-amazon.com/images/P/0241734401.01.L.jpg,"1 in Fiction About Friendship for Children | 1 in Children's Books on Friendship | 1 in TV, Movie & Video Game Adaptations for Children"
3,LEGO Our Amazing Universe: World Book Day 2025: Fantastic Building Ideas and Facts About Our Universe,DK,1.0,Paperback,3.5,2.0,0241740851,9780241740859,80,"Science, Nature & How It Works",6-11,2025-02-14T09:19:15.697131,0241740851,https://www.amazon.co.uk/LEGO-Our-Amazing-Universe-Fantastic/dp/0241740851,https://images-eu.ssl-images-amazon.com/images/P/0241740851.01.L.jpg,1 in Children's Books on Computers & Technology | 1 in Children's Books on Aeronautics & Space | 1 in Home Improvement Construction
4,Can You Get Jellyfish in Space? A World Book Day 2024 Mini Book,Dr Sheila Kanani,1.0,Paperback,4.6,142.0,0241669839,9780241669839,96,"Science, Nature & How It Works",7-9,2025-02-14T09:19:15.698754,0241669839,https://www.amazon.co.uk/Jellyfish-Space-World-Book-2024/dp/0241669839,https://images-eu.ssl-images-amazon.com/images/P/0241669839.01.L.jpg,1 in Animal Sciences | 1 in Children's Books on Mystery & Wonders | 2 in Children's Books on Aeronautics & Space
5,The Adventures of Paddington: Farm Escape!: World Book Day 2025: The brilliantly funny new Paddington mini picture book for World Book Day 2025!,HarperCollins Children’s Books,,Paperback,3.0,1.0,0008714576,9780008714574,16,"Science, Nature & How It Works",1-5,2025-02-14T09:19:15.700378,0008714576,https://www.amazon.co.uk/Adventures-Paddington-Escape-brilliantly-picture/dp/0008714576,https://images-eu.ssl-images-amazon.com/images/P/0008714576.01.L.jpg,1 in Children's Books on Country & Farm Life | 1 in Children's Books on Farm Animals | 2 in Children's Books on Nature
6,Zog,Julia Donaldson,4.0,Paperback,4.9,11126.0,,9781407170763,32,"Science, Nature & How It Works",2-5,2025-02-14T09:19:15.702158,1407170767,https://www.amazon.co.uk/Zog-Julia-Donaldson/dp/1407170767,https://images-eu.ssl-images-amazon.com/images/P/1407170767.01.L.jpg,"1 in Children's Books on Royalty | 1 in Dragons, Unicorns & Mythical Creatures Tales for Children | 2 in Early Reader's Rhymes, Verse & Wordplay for Children"
7,Jonty Gentoo: The Adventures of a Penguin The Number One Bestseller by the creators of Stick Man and Zog,Julia Donaldson,6.49,Hardcover,4.8,436.0,0702329436,9780702329432,40,"Science, Nature & How It Works",3-6,2025-02-14T09:19:15.703786,0702329436,https://www.amazon.co.uk/Jonty-Gentoo-Adventures-Julia-Donaldson/dp/0702329436,https://images-eu.ssl-images-amazon.com/images/P/0702329436.01.L.jpg,1 in Children's Books on Birds | 2 in Fiction About Health for Children | 3 in Children's Books on Nature
8,"The Baddies: the wickedly funny picture book from the creators of Zog and Stick Man, now available in paperback!",Julia Donaldson,4.0,Paperback,4.7,2151.0,0702325066,9780702325069,32,"Science, Nature & How It Works",3-6,2025-02-14T09:19:15.705614,0702325066,https://www.amazon.co.uk/Baddies-wickedly-creators-available-paperback/dp/0702325066,https://images-eu.ssl-images-amazon.com/images/P/0702325066.01.L.jpg,"1 in Horror & Ghost Stories for Children | 2 in Fairy Tales, Folk Tales & Myths for Children (Books) | 3 in Children's Books on Mystery & Wonders"
9,Superworm,Julia Donaldson,4.0,Paperback,4.8,8433.0,,9781407170725,32,"Science, Nature & How It Works",2-5,2025-02-14T09:19:15.707239,1407170724,https://www.amazon.co.uk/Superworm-Julia-Donaldson/dp/1407170724,https://images-eu.ssl-images-amazon.com/images/P/1407170724.01.L.jpg,1 in Children's Books on Performing Arts | 1 in Fantasy Adventure for Children | 4 in Children's Books on Nature
10,We're Looking for the Perfect Hug: A Lift-the-Flap Adventure and perfect Valentines gift (The Bunny Adventures),Martha Mumford,4.5,Paperback,5.0,2.0,1526671379,9781526671370,24,"Science, Nature & How It Works",,2025-02-14T09:19:15.708977,1526671379,https://www.amazon.co.uk/Were-Looking-Perfect-Lift-Flap/dp/1526671379,https://images-eu.ssl-images-amazon.com/images/P/1526671379.01.L.jpg,1 in Children's Books on Rabbits | 3 in Hidden Picture Books for Children | 3 in Children's Books on Valentine's Day
11,"There’s a Bunny in Your Book (Who's in Your Book?, 11)",Tom Fletcher,4.0,Paperback,5.0,7.0,0241591244,9780241591246,32,"Science, Nature & How It Works",,2025-02-14T09:19:15.710603,0241591244,https://www.amazon.co.uk/Theres-Bunny-Your-Book-Whos/dp/0241591244,https://images-eu.ssl-images-amazon.com/images/P/0241591244.01.L.jpg,2 in Children's Books on Rabbits | 6 in Children's Books on Nature | 10 in Children's Books on Mammals
12,Zog and the Flying Doctors,Julia Donaldson,4.0,Paperback,4.9,9387.0,1407173502,9781407173504,32,"Science, Nature & How It Works",2-4,2025-02-14T09:19:15.712204,1407173502,https://www.amazon.co.uk/Zog-Flying-Doctors-Julia-Donaldson/dp/1407173502,https://images-eu.ssl-images-amazon.com/images/P/1407173502.01.L.jpg,2 in Children's Books on Royalty | 2 in Children's Books on Jobs & Careers | 2 in Children's Early Learning Books on Sense & Sensation
13,"The Gruffalo (The Gruffalo, 1)",Julia Donaldson,6.39,Board book,4.9,17004.0,,9781509830398,24,"Science, Nature & How It Works",2-4,2025-02-14T09:19:15.713800,1509830391,https://www.amazon.co.uk/Gruffalo-Julia-Donaldson/dp/1509830391,https://images-eu.ssl-images-amazon.com/images/P/1509830391.01.L.jpg,"2 in Horror & Ghost Stories for Children | 3 in Dragons, Unicorns & Mythical Creatures Tales for Children | 5 in Classics for Children"
14,Sticker Dolly Dressing Pets,Fiona Watt,4.0,Paperback,4.7,75.0,1805316907,9781805316909,44,"Science, Nature & How It Works",5-8,2025-02-14T09:19:15.716220,1805316907,https://www.amazon.co.uk/Sticker-Dolly-Dressing-Pets-Fiona/dp/1805316907,https://images-eu.ssl-images-amazon.com/images/P/1805316907.01.L.jpg,2 in Children's Books on Pets | 7 in Primary School Textbooks | 7 in Children's Books on Nature
15,"Bunny vs Monkey: Bunny Bonanza (a Phoenix Comic Book, from the million-selling Jamie Smart, Illustrator of the Year): A Rollicking Rabbit Rumble",Jamie Smart,5.0,Paperback,4.8,473.0,1788453077,9781788453073,240,"Science, Nature & How It Works",7-10,2025-02-14T09:19:15.717922,1788453077,https://www.amazon.co.uk/Bunny-Monkey-million-selling-Illustrator-Rollicking/dp/1788453077,https://images-eu.ssl-images-amazon.com/images/P/1788453077.01.L.jpg,"9 in Children's Animal Comics & Graphic Novels | 11 in Children's Humorous Comics & Graphic Novels | 15 in Children's Books on Science, Nature & How It Works"
16,From the Wizarding Archive: Curated Writing from the World of Harry Potter,J.K. Rowling,17.99,Audible Audiobook,4.4,240.0,,,,"Science, Nature & How It Works",,2025-02-14T09:19:15.720212,B0D8WJ56XZ,https://www.amazon.co.uk/Wizarding-Archive-Curated-Writing-Potter/dp/B0D8WJ56XZ,https://images-eu.ssl-images-amazon.com/images/P/B0D8WJ56XZ.01.L.jpg,
17,Stephen Mangan,Stephen Mangan,,Paperback,,,0702340634,9780702340635,112,"Science, Nature & How It Works",9-12,2025-02-14T09:19:15.721910,0702340634,https://www.amazon.co.uk/Fart-That-Broke-World-Book/dp/0702340634,https://images-eu.ssl-images-amazon.com/images/P/0702340634.01.L.jpg,4 in Children's Books on Royalty | 5 in Travel Fiction for Children | 6 in Children's Books on Emotions & Feelings
18,Paddington’s Suitcase: Eight funny Paddington Bear picture books for children in a gift-set carry case!,Michael Bond,10.0,Paperback,4.8,3274.0,0007251947,9780007251940,192,"Science, Nature & How It Works",2-5,2025-02-14T09:19:15.723861,0007251947,https://www.amazon.co.uk/Paddington-Suitcase-Eight-book-Bear/dp/0007251947,https://images-eu.ssl-images-amazon.com/images/P/0007251947.01.L.jpg,1 in Children's Books on Bears | 1 in Children's Books on Emigrants & Immigrants | 1 in Short Story Collections for Children
19,"The Oak Tree: a dazzling, poetic picture book, by Julia Donaldson, author of The Gruffalo and Stick Man",Julia Donaldson,4.0,Paperback,4.7,448.0,0702324353,9780702324352,32,"Science, Nature & How It Works",3-6,2025-02-14T09:19:15.725502,0702324353,https://www.amazon.co.uk/Oak-Tree-dazzling-Donaldson-Gruffalo/dp/0702324353,https://images-eu.ssl-images-amazon.com/images/P/0702324353.01.L.jpg,
20,Charlie Cook's Favourite Book,Julia Donaldson,4.0,Paperback,4.7,4516.0,,9781509812486,32,"Science, Nature & How It Works",2-5,2025-02-14T09:19:15.727288,1509812482,https://www.amazon.co.uk/Charlie-Cooks-Favourite-Julia-Donaldson/dp/1509812482,https://images-eu.ssl-images-amazon.com/images/P/1509812482.01.L.jpg,1 in Mystical Poetry | 1 in Literary Criticism & Collections for Children | 1 in Children's Books on Pirates
21,The Last Bear: Winner of the Blue Peter Award – ‘A dazzling debut’ THE TIMES,Hannah Gold,4.5,Paperback,4.7,2660.0,000841131X,9780008411312,320,"Science, Nature & How It Works",8+,2025-02-14T09:19:15.728929,000841131X,https://www.amazon.co.uk/Last-Bear-stunning-childrens-battle/dp/000841131X,https://images-eu.ssl-images-amazon.com/images/P/000841131X.01.L.jpg,
22,That's not my dog...,Fiona Watt,4.0,Board book,4.8,221.0,1805312235,9781805312239,10,"Science, Nature & How It Works",,2025-02-14T09:19:15.730550,1805312235,https://www.amazon.co.uk/Thats-not-dog-Fiona-Watt/dp/1805312235,https://images-eu.ssl-images-amazon.com/images/P/1805312235.01.L.jpg,
23,"There's a Dinosaur in Your Book: An interactive board book for toddlers: 9 (Who's in Your Book?, 9)",Tom Fletcher,4.0,Paperback,4.8,606.0,0241591317,9780241591314,32,"Science, Nature & How It Works",2-4,2025-02-14T09:19:15.732377,0241591317,https://www.amazon.co.uk/Theres-Dinosaur-Your-Book-Whos/dp/0241591317,https://images-eu.ssl-images-amazon.com/images/P/0241591317.01.L.jpg,
24,LEGO Race Cars: 5 (Klutz),Editors of Klutz,14.99,Toy,4.4,1327.0,1338802062,9781338802061,64,"Science, Nature & How It Works",5-7,2025-02-14T09:19:15.734683,1338802062,https://www.amazon.co.uk/LEGO-Race-Cars-Klutz-Editors/dp/1338802062,https://images-eu.ssl-images-amazon.com/images/P/1338802062.01.L.jpg,1 in Children's Books on Home | 1 in Children's Books on Computer Hardware & Robotics | 1 in Children's Books on How Things Work
25,"In the Jungle: A Push, Pull, Slide Book (Campbell Axel Scheffler, 6)",,5.34,Board book,4.7,2169.0,1509866957,9781509866953,10,"Science, Nature & How It Works",1-2,2025-02-14T09:19:15.736951,1509866957,https://www.amazon.co.uk/Axel-Scheffler-Jungle/dp/1509866957,https://images-eu.ssl-images-amazon.com/images/P/1509866957.01.L.jpg,
26,"Bunny vs Monkey (a Phoenix Comic Book, from the million-selling Jamie Smart, Illustrator of the Year)",Jamie Smart,6.0,Paperback,4.8,1139.0,1788451775,9781788451772,256,"Science, Nature & How It Works",8-9,2025-02-14T09:19:15.739847,1788451775,https://www.amazon.co.uk/Bunny-vs-Monkey-Jamie-Smart/dp/1788451775,https://images-eu.ssl-images-amazon.com/images/P/1788451775.01.L.jpg,
27,Minecraft Catch the Creeper and Other Mobs: Search for your favourite mobs in this official Minecraft Search and Find book! Perfect for kids into video games.,Mojang AB,7.35,Paperback,4.7,2688.0,0755503570,9780755503575,40,"Science, Nature & How It Works",5-9,2025-02-14T09:19:15.741960,0755503570,https://www.amazon.co.uk/Minecraft-Catch-Creeper-Other-Mobs/dp/0755503570,https://images-eu.ssl-images-amazon.com/images/P/0755503570.01.L.jpg,
28,"Weird but true! 2025: Discover weird, unbelievable facts and world records in this popular annual for the whole family (National Geographic Kids)",National Geographic Kids,10.39,Hardcover,4.7,243.0,0008694125,9780008694128,256,"Science, Nature & How It Works",7-10,2025-02-14T09:19:15.743582,0008694125,https://www.amazon.co.uk/Weird-but-true-2025-Geographic/dp/0008694125,https://images-eu.ssl-images-amazon.com/images/P/0008694125.01.L.jpg,
29,The Girl of Ink and Stars: winner of the British Book Awards' Children's Book of the Year,Kiran Millwood Hargrave,6.99,Paperback,4.6,7916.0,1910002747,9781910002742,240,"Science, Nature & How It Works",9-12,2025-02-14T09:19:15.745415,1910002747,https://www.amazon.co.uk/Girl-Ink-Stars-Waterstones-Childrens/dp/1910002747,https://images-eu.ssl-images-amazon.com/images/P/1910002747.01.L.jpg,
30,The Wild Robot: Now a major DreamWorks animation!,Peter Brown,5.65,Paperback,4.7,13216.0,1848127278,9781848127272,288,"Science, Nature & How It Works",7-10,2025-02-14T09:19:15.747018,1848127278,https://www.amazon.co.uk/Wild-Robot-Peter-Brown/dp/1848127278,https://images-eu.ssl-images-amazon.com/images/P/1848127278.01.L.jpg,
1,Bluey: Bluey's Little Book: A World Book Day 2025 MINI BOOK,Bluey,1.0,Paperback,2.0,2.0,0241734401,9780241734407,16,"TV, Movie & Video Game Adaptations",3-6,2025-02-14T09:19:16.631230,0241734401,https://www.amazon.co.uk/Bluey-Blueys-Little-Book-World/dp/0241734401,https://images-eu.ssl-images-amazon.com/images/P/0241734401.01.L.jpg,
2,Marvel Avengers: The Ultimate Colouring Book,,2.0,Paperback,4.6,624.0,1801081549,9781801081542,72,"TV, Movie & Video Game Adaptations",4-8,2025-02-14T09:19:16.633671,1801081549,https://www.amazon.co.uk/Marvel-Avengers-Ultimate-Colouring-Book/dp/1801081549,https://images-eu.ssl-images-amazon.com/images/P/1801081549.01.L.jpg,
3,Disney Princess: The Ultimate Colouring Book,Walt Disney,2.0,Paperback,4.7,2940.0,1801081530,9781801081535,72,"TV, Movie & Video Game Adaptations",3-7,2025-02-14T09:19:16.635287,1801081530,https://www.amazon.co.uk/Disney-Princess-Ultimate-Colouring-Book/dp/1801081530,https://images-eu.ssl-images-amazon.com/images/P/1801081530.01.L.jpg,
4,Bluey: Where's Bluey?: A Search-and-Find Book,Bluey,6.91,Paperback,4.8,3290.0,0241558573,9780241558577,32,"TV, Movie & Video Game Adaptations",2-5,2025-02-14T09:19:16.637154,0241558573,https://www.amazon.co.uk/Bluey-Wheres-Search-Find-Book/dp/0241558573,https://images-eu.ssl-images-amazon.com/images/P/0241558573.01.L.jpg,
5,Nickelodeon Publishing,,,Kindle Edition,4.7,966.0,,,14,"TV, Movie & Video Game Adaptations",,2025-02-14T09:19:16.639315,B073R342DW,https://www.amazon.co.uk/Save-School-Bus-PAW-Patrol-ebook/dp/B073R342DW,https://images-eu.ssl-images-amazon.com/images/P/B073R342DW.01.L.jpg,
6,Minecraft Catch the Creeper and Other Mobs: Search for your favourite mobs in this official Minecraft Search and Find book! Perfect for kids into video games.,Mojang AB,7.35,Paperback,4.7,2688.0,0755503570,9780755503575,40,"TV, Movie & Video Game Adaptations",5-9,2025-02-14T09:19:16.640941,0755503570,https://www.amazon.co.uk/Minecraft-Catch-Creeper-Other-Mobs/dp/0755503570,https://images-eu.ssl-images-amazon.com/images/P/0755503570.01.L.jpg,
7,Bluey: Bluey and Friends Little Library,Bluey,5.51,Board book,4.6,595.0,0241605040,9780241605042,48,"TV, Movie & Video Game Adaptations",1-3,2025-02-14T09:19:16.642687,0241605040,https://www.amazon.co.uk/Bluey-Friends-Little-Library/dp/0241605040,https://images-eu.ssl-images-amazon.com/images/P/0241605040.01.L.jpg,
8,Ms Rachel: Ms Rachel and the Special Surprise: Encouraging Speech and Learning Through Play and Music,Ms Rachel,4.5,Paperback,4.8,49.0,0241760607,9780241760604,40,"TV, Movie & Video Game Adaptations",,2025-02-14T09:19:16.644309,0241760607,https://www.amazon.co.uk/Ms-Rachel-Surprise-Encouraging-Learning/dp/0241760607,https://images-eu.ssl-images-amazon.com/images/P/0241760607.01.L.jpg,
9,Pokémon Where’s Pikachu? A search & find book: New for 2023: Search and find the perfect gift for fans of Pokémon in this official Pikachu adventure!,Pokemon,6.99,Paperback,4.7,465.0,0008547599,9780008547592,40,"TV, Movie & Video Game Adaptations",4-8,2025-02-14T09:19:16.645998,0008547599,https://www.amazon.co.uk/Pok%C3%A9mon-Wheres-Pikachu-search-find/dp/0008547599,https://images-eu.ssl-images-amazon.com/images/P/0008547599.01.L.jpg,
10,Disney Stitch: The Ultimate Colouring Book,Walt Disney,4.99,Paperback,4.5,378.0,1837950326,9781837950324,72,"TV, Movie & Video Game Adaptations",6-9,2025-02-14T09:19:16.647631,1837950326,https://www.amazon.co.uk/Disney-Stitch-Ultimate-Colouring-Book/dp/1837950326,https://images-eu.ssl-images-amazon.com/images/P/1837950326.01.L.jpg,
11,Marvel Spider-Man: Sticker Scenes (With over 50 stickers!),,3.49,Paperback,4.1,52.0,1837950148,9781837950140,12,"TV, Movie & Video Game Adaptations",4-6,2025-02-14T09:19:16.650060,1837950148,https://www.amazon.co.uk/Marvel-Spider-Man-Sticker-Scenes-stickers/dp/1837950148,https://images-eu.ssl-images-amazon.com/images/P/1837950148.01.L.jpg,
12,Disney Princess: Simply Colouring (Over 30 pages to colour in),Igloo Books,3.99,Paperback,4.5,379.0,1800220294,9781800220294,32,"TV, Movie & Video Game Adaptations",4-6,2025-02-14T09:19:16.651680,1800220294,https://www.amazon.co.uk/Disney-Princess-Colouring-Igloo-Books/dp/1800220294,https://images-eu.ssl-images-amazon.com/images/P/1800220294.01.L.jpg,
13,Bluey: Bluey and Friends: A Sticker Activity Book,,3.99,Paperback,4.6,1179.0,0241550513,9780241550519,16,"TV, Movie & Video Game Adaptations",2-5,2025-02-14T09:19:16.653958,0241550513,https://www.amazon.co.uk/Bluey-Friends-Sticker-Activity/dp/0241550513,https://images-eu.ssl-images-amazon.com/images/P/0241550513.01.L.jpg,
14,Peppa Pig: Little Library,,4.0,Board book,4.7,25450.0,,9781409303183,60,"TV, Movie & Video Game Adaptations",1-3,2025-02-14T09:19:16.656402,1409303187,https://www.amazon.co.uk/Peppa-Pig-Little-Library-Ladybird/dp/1409303187,https://images-eu.ssl-images-amazon.com/images/P/1409303187.01.L.jpg,
15,Disney: Disneyland Paris Colouring Book (Young Adult Colouring),Walt Disney,4.5,Paperback,4.8,75.0,1837714401,9781837714407,96,"TV, Movie & Video Game Adaptations",9-13,2025-02-14T09:19:16.658038,1837714401,https://www.amazon.co.uk/Disney-Disneyland-Paris-Colouring-Book/dp/1837714401,https://images-eu.ssl-images-amazon.com/images/P/1837714401.01.L.jpg,
16,Peppa Pig: Peppa's Party Bus!: Noisy Sound Book,Peppa Pig,7.0,Board book,4.3,14.0,0241666007,9780241666005,10,"TV, Movie & Video Game Adaptations",,2025-02-14T09:19:16.659654,0241666007,https://www.amazon.co.uk/Peppa-Pig-Peppas-Party-Noisy/dp/0241666007,https://images-eu.ssl-images-amazon.com/images/P/0241666007.01.L.jpg,
17,Disneyland Parks Colouring Book,Igloo Books,4.0,Paperback,4.7,4083.0,1838523650,9781838523657,96,"TV, Movie & Video Game Adaptations",5+,2025-02-14T09:19:16.661275,1838523650,https://www.amazon.co.uk/Disneyland-Parks-Colouring-Igloo-Books/dp/1838523650,https://images-eu.ssl-images-amazon.com/images/P/1838523650.01.L.jpg,
18,"Marvel Avengers: 5 in 1 Colouring (With dot-to-dot, colour-by-numbers, copy colouring, and more!)",Marvel Entertainment International Ltd,1.99,Paperback,4.5,26.0,1837950091,9781837950096,48,"TV, Movie & Video Game Adaptations",4-6,2025-02-14T09:19:16.662963,1837950091,https://www.amazon.co.uk/Marvel-Avengers-dot-colour-numbers/dp/1837950091,https://images-eu.ssl-images-amazon.com/images/P/1837950091.01.L.jpg,
19,"Disney The Lion King: 5 in 1 Colouring (With dot-to-dot, colour-by-numbers, copy colouring, and more!)",Walt Disney,1.99,Paperback,4.7,46.0,1837950083,9781837950089,48,"TV, Movie & Video Game Adaptations",4-6,2025-02-14T09:19:16.664580,1837950083,https://www.amazon.co.uk/Disney-Lion-King-colour-numbers/dp/1837950083,https://images-eu.ssl-images-amazon.com/images/P/1837950083.01.L.jpg,
20,"Paw Patrol: Meet the Pups Sticker Activity: With over 50 BIG stickers! A fun illustrated sticker book for children aged 3, 4, 5 based on the Nickelodeon TV Series",,5.51,Paperback,4.7,539.0,075550268X,9780755502684,32,"TV, Movie & Video Game Adaptations",3-4,2025-02-14T09:19:16.667001,075550268X,https://www.amazon.co.uk/Paw-Patrol-Sticker-Activity-stickers/dp/075550268X,https://images-eu.ssl-images-amazon.com/images/P/075550268X.01.L.jpg,
21,Peppa Pig: At the Zoo: A Lift-the-Flap Book,Peppa Pig,4.0,Board book,4.8,2865.0,0241335914,9780241335918,10,"TV, Movie & Video Game Adaptations",1-3,2025-02-14T09:19:16.668720,0241335914,https://www.amazon.co.uk/Peppa-Pig-Lift-Flap-Book/dp/0241335914,https://images-eu.ssl-images-amazon.com/images/P/0241335914.01.L.jpg,
22,Bluey: Let's Stick!: Sticker Scenes Book,,6.43,Paperback,4.7,652.0,0241551951,9780241551950,24,"TV, Movie & Video Game Adaptations",3-4,2025-02-14T09:19:16.671014,0241551951,https://www.amazon.co.uk/Bluey-Lets-Stick-Sticker-Scenes/dp/0241551951,https://images-eu.ssl-images-amazon.com/images/P/0241551951.01.L.jpg,
23,Disney: Bedtime Stories (Treasury of Classic Tales),Walt Disney,10.0,Hardcover,4.6,31.0,1837959080,9781837959082,384,"TV, Movie & Video Game Adaptations",6-10,2025-02-14T09:19:16.672628,1837959080,https://www.amazon.co.uk/Disney-Bedtime-Stories-Treasury-Classic/dp/1837959080,https://images-eu.ssl-images-amazon.com/images/P/1837959080.01.L.jpg,
24,Peppa Pig: Peppa and the New Baby,Peppa Pig,5.51,Board book,4.8,77.0,0241575710,9780241575710,16,"TV, Movie & Video Game Adaptations",2-6,2025-02-14T09:19:16.674234,0241575710,https://www.amazon.co.uk/Peppa-Pig-New-Baby/dp/0241575710,https://images-eu.ssl-images-amazon.com/images/P/0241575710.01.L.jpg,
25,Marvel Spider-Man: Giant Colour-Me Pad,Marvel Entertainment International Ltd,5.0,Paperback,4.8,228.0,1801082448,9781801082440,64,"TV, Movie & Video Game Adaptations",4-6,2025-02-14T09:19:16.678268,1801082448,https://www.amazon.co.uk/Marvel-Spider-Man-Giant-Colour-Pad/dp/1801082448,https://images-eu.ssl-images-amazon.com/images/P/1801082448.01.L.jpg,
26,Marvel: Ultimate Storybook (Treasury of Superhero Adventures),,10.0,Hardcover,4.7,235.0,1801082685,9781801082686,384,"TV, Movie & Video Game Adaptations",4-8,2025-02-14T09:19:16.681821,1801082685,https://www.amazon.co.uk/Marvel-Ultimate-Storybook-Superhero-Adventures/dp/1801082685,https://images-eu.ssl-images-amazon.com/images/P/1801082685.01.L.jpg,
27,Shrek 2: The Movie Storybook,,2.55,Kindle Edition,3.9,66.0,,,56,"TV, Movie & Video Game Adaptations",,2025-02-14T09:19:16.684128,B009093GXU,https://www.amazon.co.uk/Shrek-2-Movie-Storybook-zuuka-ebook/dp/B009093GXU,https://images-eu.ssl-images-amazon.com/images/P/B009093GXU.01.L.jpg,
28,Bluey: My Dad Is Awesome,Bluey,4.0,Board book,4.8,501.0,024155067X,9780241550670,24,"TV, Movie & Video Game Adaptations",2-5,2025-02-14T09:19:16.685737,024155067X,https://www.amazon.co.uk/Bluey-My-Dad-Awesome/dp/024155067X,https://images-eu.ssl-images-amazon.com/images/P/024155067X.01.L.jpg,
29,Peppa Pig: George's Potty: A potty training sound book,Peppa Pig,8.27,Board book,4.4,330.0,0241476488,9780241476482,10,"TV, Movie & Video Game Adaptations",2-3,2025-02-14T09:19:16.689481,0241476488,https://www.amazon.co.uk/Peppa-Pig-Georges-Potty/dp/0241476488,https://images-eu.ssl-images-amazon.com/images/P/0241476488.01.L.jpg,
30,Bluey: Sleepytime,Bluey,5.0,Paperback,4.8,642.0,0241663652,9780241663653,32,"TV, Movie & Video Game Adaptations",2-4,2025-02-14T09:19:16.691123,0241663652,https://www.amazon.co.uk/Bluey-Sleepytime/dp/0241663652,https://images-eu.ssl-images-amazon.com/images/P/0241663652.01.L.jpg,
1,Bluey: Bluey's Little Book: A World Book Day 2025 MINI BOOK,Bluey,1.0,Paperback,2.0,2.0,0241734401,9780241734407,16,Educational Books,3-6,2025-02-14T09:19:17.821023,0241734401,https://www.amazon.co.uk/Bluey-Blueys-Little-Book-World/dp/0241734401,https://images-eu.ssl-images-amazon.com/images/P/0241734401.01.L.jpg,
2,LEGO Our Amazing Universe: World Book Day 2025: Fantastic Building Ideas and Facts About Our Universe,DK,1.0,Paperback,3.5,2.0,0241740851,9780241740859,80,Educational Books,6-11,2025-02-14T09:19:17.822645,0241740851,https://www.amazon.co.uk/LEGO-Our-Amazing-Universe-Fantastic/dp/0241740851,https://images-eu.ssl-images-amazon.com/images/P/0241740851.01.L.jpg,
3,The Very Hungry Caterpillar [Board Book]: Eric Carle,Eric Carle,4.0,Board book,4.8,92823.0,0241003008,9780241003008,24,Educational Books,1-3,2025-02-14T09:19:17.824263,0241003008,https://www.amazon.co.uk/Very-Hungry-Caterpillar-Board-Book/dp/0241003008,https://images-eu.ssl-images-amazon.com/images/P/0241003008.01.L.jpg,
4,Pokémon: The Epic Pocket Guide. World Book Day 2025: Become an expert Pokémon Trainer with this new handy pocket-sized guidebook for World Book Day 2025,Pokémon,1.0,Paperback,4.0,1.0,0008719810,9780008719814,64,Educational Books,5-8,2025-02-14T09:19:17.826122,0008719810,https://www.amazon.co.uk/Pok%C3%A9mon-Pocket-Trainer-pocket-sized-guidebook/dp/0008719810,https://images-eu.ssl-images-amazon.com/images/P/0008719810.01.L.jpg,
